05:49:25.549451 IP 138.197.139.105.ssh > cpef81d0fadd1d3-cmf81d0fadd1d0.cpe.net.fido.ca.51098: Flags [P.], seq 3391056:3391252, ack 1945, win 501, length 196
05:49:25.549634 IP 138.197.139.105.ssh > cpef81d0fadd1d3-cmf81d0fadd1d0.cpe.net.fido.ca.51098: Flags [P.], seq 3391252:3391448, ack 1945, win 501, length 196
05:49:25.549771 IP 138.197.139.105.ssh > cpef81d0fadd1d3-cmf81d0fadd1d0.cpe.net.fido.ca.51098: Flags [P.], seq 3391448:3391644, ack 1945, win 501, length 196
05:49:25.549889 IP 138.197.139.105.ssh > cpef81d0fadd1d3-cmf81d0fadd1d0.cpe.net.fido.ca.51098: Flags [P.], seq 3391644:3391840, ack 1945, win 501, length 196
05:49:25.550037 IP 138.197.139.105.ssh > cpef81d0fadd1d3-cmf81d0fadd1d0.cpe.net.fido.ca.51098: Flags [P.], seq 3391840:3392036, ack 1945, win 501, length 196
05:49:25.550231 IP 138.197.139.105.ssh > cpef81d0fadd1d3-cmf81d0fadd1d0.cpe.net.fido.ca.51098: Flags [P.], seq 3392036:3392232, ack 1945, win 501, length 196
05:49:25.550420 IP 138.197.139.105.ssh > cpef81d0fadd1d3-cmf81d0fadd1d0.cpe.net.fido.ca.51098: Flags [P.], seq 3392232:3392428, ack 1945, win 501, length 196
05:49:25.550554 IP 138.197.139.105.ssh > cpef81d0fadd1d3-cmf81d0fadd1d0.cpe.net.fido.ca.51098: Flags [P.], seq 3392428:3392624, ack 1945, win 501, length 196
05:49:25.550642 IP cpef81d0fadd1d3-cmf81d0fadd1d0.cpe.net.fido.ca.51098 > 138.197.139.105.ssh: Flags [.], ack 3377408, win 513, length 0
05:49:25.550642 IP cpef81d0fadd1d3-cmf81d0fadd1d0.cpe.net.fido.ca.51098 > 138.197.139.105.ssh: Flags [.], ack 3380544, win 513, length 0
05:49:25.550642 IP cpef81d0fadd1d3-cmf81d0fadd1d0.cpe.net.fido.ca.51098 > 138.197.139.105.ssh: Flags [.], ack 3384036, win 513, length 0
05:49:25.550832 IP 138.197.139.105.ssh > cpef81d0fadd1d3-cmf81d0fadd1d0.cpe.net.fido.ca.51098: Flags [P.], seq 3392624:3393236, ack 1945, win 501, length 612
05:49:25.550963 IP 138.197.139.105.ssh > cpef81d0fadd1d3-cmf81d0fadd1d0.cpe.net.fido.ca.51098: Flags [P.], seq 3393236:3393432, ack 1945, win 501, length 196
05:49:25.551107 IP 138.197.139.105.ssh > cpef81d0fadd1d3-cmf81d0fadd1d0.cpe.net.fido.ca.51098: Flags [P.], seq 3393432:3393628, ack 1945, win 501, length 196
05:49:25.551229 IP 138.197.139.105.ssh > cpef81d0fadd1d3-cmf81d0fadd1d0.cpe.net.fido.ca.51098: Flags [P.], seq 3393628:3393824, ack 1945, win 501, length 196
05:49:25.551418 IP 138.197.139.105.ssh > cpef81d0fadd1d3-cmf81d0fadd1d0.cpe.net.fido.ca.51098: Flags [P.], seq 3393824:3394020, ack 1945, win 501, length 196
05:49:25.551612 IP 138.197.139.105.ssh > cpef81d0fadd1d3-cmf81d0fadd1d0.cpe.net.fido.ca.51098: Flags [P.], seq 3394020:3394216, ack 1945, win 501, length 196
05:49:25.551774 IP 138.197.139.105.ssh > cpef81d0fadd1d3-cmf81d0fadd1d0.cpe.net.fido.ca.51098: Flags [P.], seq 3394216:3394412, ack 1945, win 501, length 196
05:49:25.551900 IP 138.197.139.105.ssh > cpef81d0fadd1d3-cmf81d0fadd1d0.cpe.net.fido.ca.51098: Flags [P.], seq 3394412:3394608, ack 1945, win 501, length 196
05:49:25.552024 IP 138.197.139.105.ssh > cpef81d0fadd1d3-cmf81d0fadd1d0.cpe.net.fido.ca.51098: Flags [P.], seq 3394608:3394804, ack 1945, win 501, length 196
05:49:25.552141 IP 138.197.139.105.ssh > cpef81d0fadd1d3-cmf81d0fadd1d0.cpe.net.fido.ca.51098: Flags [P.], seq 3394804:3395000, ack 1945, win 501, length 196
05:49:25.552259 IP 138.197.139.105.ssh > cpef81d0fadd1d3-cmf81d0fadd1d0.cpe.net.fido.ca.51098: Flags [P.], seq 3395000:3395196, ack 1945, win 501, length 196
05:49:25.552376 IP 138.197.139.105.ssh > cpef81d0fadd1d3-cmf81d0fadd1d0.cpe.net.fido.ca.51098: Flags [P.], seq 3395196:3395392, ack 1945, win 501, length 196
05:49:25.552493 IP 138.197.139.105.ssh > cpef81d0fadd1d3-cmf81d0fadd1d0.cpe.net.fido.ca.51098: Flags [P.], seq 3395392:3395588, ack 1945, win 501, length 196
05:49:25.552664 IP 138.197.139.105.ssh > cpef81d0fadd1d3-cmf81d0fadd1d0.cpe.net.fido.ca.51098: Flags [P.], seq 3395588:3395784, ack 1945, win 501, length 196
05:49:25.552839 IP 138.197.139.105.ssh > cpef81d0fadd1d3-cmf81d0fadd1d0.cpe.net.fido.ca.51098: Flags [P.], seq 3395784:3395980, ack 1945, win 501, length 196
05:49:25.553014 IP 138.197.139.105.ssh > cpef81d0fadd1d3-cmf81d0fadd1d0.cpe.net.fido.ca.51098: Flags [P.], seq 3395980:3396176, ack 1945, win 501, length 196
05:49:25.553178 IP 138.197.139.105.ssh > cpef81d0fadd1d3-cmf81d0fadd1d0.cpe.net.fido.ca.51098: Flags [P.], seq 3396176:3396372, ack 1945, win 501, length 196
05:49:25.553333 IP 138.197.139.105.ssh > cpef81d0fadd1d3-cmf81d0fadd1d0.cpe.net.fido.ca.51098: Flags [P.], seq 3396372:3396568, ack 1945, win 501, length 196
05:49:25.553501 IP 138.197.139.105.ssh > cpef81d0fadd1d3-cmf81d0fadd1d0.cpe.net.fido.ca.51098: Flags [P.], seq 3396568:3396764, ack 1945, win 501, length 196
05:49:25.553703 IP 138.197.139.105.ssh > cpef81d0fadd1d3-cmf81d0fadd1d0.cpe.net.fido.ca.51098: Flags [P.], seq 3396764:3396960, ack 1945, win 501, length 196
05:49:25.553891 IP 138.197.139.105.ssh > cpef81d0fadd1d3-cmf81d0fadd1d0.cpe.net.fido.ca.51098: Flags [P.], seq 3396960:3397156, ack 1945, win 501, length 196
05:49:25.554061 IP 138.197.139.105.ssh > cpef81d0fadd1d3-cmf81d0fadd1d0.cpe.net.fido.ca.51098: Flags [P.], seq 3397156:3397352, ack 1945, win 501, length 196
05:49:25.554238 IP 138.197.139.105.ssh > cpef81d0fadd1d3-cmf81d0fadd1d0.cpe.net.fido.ca.51098: Flags [P.], seq 3397352:3397548, ack 1945, win 501, length 196
05:49:25.554406 IP 138.197.139.105.ssh > cpef81d0fadd1d3-cmf81d0fadd1d0.cpe.net.fido.ca.51098: Flags [P.], seq 3397548:3397744, ack 1945, win 501, length 196
05:49:25.554606 IP 138.197.139.105.ssh > cpef81d0fadd1d3-cmf81d0fadd1d0.cpe.net.fido.ca.51098: Flags [P.], seq 3397744:3397940, ack 1945, win 501, length 196
05:49:25.554796 IP 138.197.139.105.ssh > cpef81d0fadd1d3-cmf81d0fadd1d0.cpe.net.fido.ca.51098: Flags [P.], seq 3397940:3398136, ack 1945, win 501, length 196
05:49:25.554973 IP 138.197.139.105.ssh > cpef81d0fadd1d3-cmf81d0fadd1d0.cpe.net.fido.ca.51098: Flags [P.], seq 3398136:3398332, ack 1945, win 501, length 196
05:49:25.555180 IP 138.197.139.105.ssh > cpef81d0fadd1d3-cmf81d0fadd1d0.cpe.net.fido.ca.51098: Flags [P.], seq 3398332:3398528, ack 1945, win 501, length 196
05:49:25.555378 IP 138.197.139.105.ssh > cpef81d0fadd1d3-cmf81d0fadd1d0.cpe.net.fido.ca.51098: Flags [P.], seq 3398528:3398724, ack 1945, win 501, length 196
05:49:25.555550 IP 138.197.139.105.ssh > cpef81d0fadd1d3-cmf81d0fadd1d0.cpe.net.fido.ca.51098: Flags [P.], seq 3398724:3398920, ack 1945, win 501, length 196
05:49:25.555722 IP 138.197.139.105.ssh > cpef81d0fadd1d3-cmf81d0fadd1d0.cpe.net.fido.ca.51098: Flags [P.], seq 3398920:3399116, ack 1945, win 501, length 196
05:49:25.555891 IP 138.197.139.105.ssh > cpef81d0fadd1d3-cmf81d0fadd1d0.cpe.net.fido.ca.51098: Flags [P.], seq 3399116:3399312, ack 1945, win 501, length 196
05:49:25.556048 IP 138.197.139.105.ssh > cpef81d0fadd1d3-cmf81d0fadd1d0.cpe.net.fido.ca.51098: Flags [P.], seq 3399312:3399508, ack 1945, win 501, length 196
05:49:25.556213 IP 138.197.139.105.ssh > cpef81d0fadd1d3-cmf81d0fadd1d0.cpe.net.fido.ca.51098: Flags [P.], seq 3399508:3399704, ack 1945, win 501, length 196
05:49:25.556375 IP 138.197.139.105.ssh > cpef81d0fadd1d3-cmf81d0fadd1d0.cpe.net.fido.ca.51098: Flags [P.], seq 3399704:3399900, ack 1945, win 501, length 196
05:49:25.556540 IP 138.197.139.105.ssh > cpef81d0fadd1d3-cmf81d0fadd1d0.cpe.net.fido.ca.51098: Flags [P.], seq 3399900:3400096, ack 1945, win 501, length 196
05:49:25.556682 IP cpef81d0fadd1d3-cmf81d0fadd1d0.cpe.net.fido.ca.51098 > 138.197.139.105.ssh: Flags [.], ack 3387172, win 513, length 0
05:49:25.556682 IP cpef81d0fadd1d3-cmf81d0fadd1d0.cpe.net.fido.ca.51098 > 138.197.139.105.ssh: Flags [P.], seq 1945:1981, ack 3387172, win 513, length 36
05:49:25.556682 IP cpef81d0fadd1d3-cmf81d0fadd1d0.cpe.net.fido.ca.51098 > 138.197.139.105.ssh: Flags [.], ack 3389880, win 513, length 0
05:49:25.556830 IP 138.197.139.105.ssh > cpef81d0fadd1d3-cmf81d0fadd1d0.cpe.net.fido.ca.51098: Flags [P.], seq 3400096:3400292, ack 1981, win 501, length 196
05:49:25.557130 IP 138.197.139.105.ssh > cpef81d0fadd1d3-cmf81d0fadd1d0.cpe.net.fido.ca.51098: Flags [P.], seq 3400292:3400920, ack 1981, win 501, length 628
05:49:25.557337 IP 138.197.139.105.ssh > cpef81d0fadd1d3-cmf81d0fadd1d0.cpe.net.fido.ca.51098: Flags [P.], seq 3400920:3401116, ack 1981, win 501, length 196
05:49:25.557507 IP 138.197.139.105.ssh > cpef81d0fadd1d3-cmf81d0fadd1d0.cpe.net.fido.ca.51098: Flags [P.], seq 3401116:3401312, ack 1981, win 501, length 196
05:49:25.557673 IP 138.197.139.105.ssh > cpef81d0fadd1d3-cmf81d0fadd1d0.cpe.net.fido.ca.51098: Flags [P.], seq 3401312:3401508, ack 1981, win 501, length 196
05:49:25.557837 IP 138.197.139.105.ssh > cpef81d0fadd1d3-cmf81d0fadd1d0.cpe.net.fido.ca.51098: Flags [P.], seq 3401508:3401704, ack 1981, win 501, length 196
05:49:25.558003 IP 138.197.139.105.ssh > cpef81d0fadd1d3-cmf81d0fadd1d0.cpe.net.fido.ca.51098: Flags [P.], seq 3401704:3401900, ack 1981, win 501, length 196
05:49:25.558169 IP 138.197.139.105.ssh > cpef81d0fadd1d3-cmf81d0fadd1d0.cpe.net.fido.ca.51098: Flags [P.], seq 3401900:3402096, ack 1981, win 501, length 196
05:49:25.558332 IP 138.197.139.105.ssh > cpef81d0fadd1d3-cmf81d0fadd1d0.cpe.net.fido.ca.51098: Flags [P.], seq 3402096:3402292, ack 1981, win 501, length 196
05:49:25.558505 IP 138.197.139.105.ssh > cpef81d0fadd1d3-cmf81d0fadd1d0.cpe.net.fido.ca.51098: Flags [P.], seq 3402292:3402488, ack 1981, win 501, length 196
05:49:25.558674 IP 138.197.139.105.ssh > cpef81d0fadd1d3-cmf81d0fadd1d0.cpe.net.fido.ca.51098: Flags [P.], seq 3402488:3402684, ack 1981, win 501, length 196
05:49:25.558867 IP 138.197.139.105.ssh > cpef81d0fadd1d3-cmf81d0fadd1d0.cpe.net.fido.ca.51098: Flags [P.], seq 3402684:3402880, ack 1981, win 501, length 196
05:49:25.559075 IP 138.197.139.105.ssh > cpef81d0fadd1d3-cmf81d0fadd1d0.cpe.net.fido.ca.51098: Flags [P.], seq 3402880:3403076, ack 1981, win 501, length 196
05:49:25.559293 IP 138.197.139.105.ssh > cpef81d0fadd1d3-cmf81d0fadd1d0.cpe.net.fido.ca.51098: Flags [P.], seq 3403076:3403272, ack 1981, win 501, length 196
05:49:25.559478 IP 138.197.139.105.ssh > cpef81d0fadd1d3-cmf81d0fadd1d0.cpe.net.fido.ca.51098: Flags [P.], seq 3403272:3403468, ack 1981, win 501, length 196
05:49:25.559666 IP 138.197.139.105.ssh > cpef81d0fadd1d3-cmf81d0fadd1d0.cpe.net.fido.ca.51098: Flags [P.], seq 3403468:3403664, ack 1981, win 501, length 196
05:49:25.559846 IP 138.197.139.105.ssh > cpef81d0fadd1d3-cmf81d0fadd1d0.cpe.net.fido.ca.51098: Flags [P.], seq 3403664:3403860, ack 1981, win 501, length 196
05:49:25.560014 IP 138.197.139.105.ssh > cpef81d0fadd1d3-cmf81d0fadd1d0.cpe.net.fido.ca.51098: Flags [P.], seq 3403860:3404056, ack 1981, win 501, length 196
05:49:25.560197 IP 138.197.139.105.ssh > cpef81d0fadd1d3-cmf81d0fadd1d0.cpe.net.fido.ca.51098: Flags [P.], seq 3404056:3404252, ack 1981, win 501, length 196
05:49:25.560391 IP 138.197.139.105.ssh > cpef81d0fadd1d3-cmf81d0fadd1d0.cpe.net.fido.ca.51098: Flags [P.], seq 3404252:3404448, ack 1981, win 501, length 196
05:49:25.560572 IP 138.197.139.105.ssh > cpef81d0fadd1d3-cmf81d0fadd1d0.cpe.net.fido.ca.51098: Flags [P.], seq 3404448:3404644, ack 1981, win 501, length 196
05:49:25.560726 IP 138.197.139.105.ssh > cpef81d0fadd1d3-cmf81d0fadd1d0.cpe.net.fido.ca.51098: Flags [P.], seq 3404644:3404840, ack 1981, win 501, length 196
05:49:25.560910 IP 138.197.139.105.ssh > cpef81d0fadd1d3-cmf81d0fadd1d0.cpe.net.fido.ca.51098: Flags [P.], seq 3404840:3405036, ack 1981, win 501, length 196
05:49:25.561082 IP 138.197.139.105.ssh > cpef81d0fadd1d3-cmf81d0fadd1d0.cpe.net.fido.ca.51098: Flags [P.], seq 3405036:3405232, ack 1981, win 501, length 196
05:49:25.561245 IP 138.197.139.105.ssh > cpef81d0fadd1d3-cmf81d0fadd1d0.cpe.net.fido.ca.51098: Flags [P.], seq 3405232:3405428, ack 1981, win 501, length 196
05:49:25.561404 IP 138.197.139.105.ssh > cpef81d0fadd1d3-cmf81d0fadd1d0.cpe.net.fido.ca.51098: Flags [P.], seq 3405428:3405624, ack 1981, win 501, length 196
05:49:25.561563 IP 138.197.139.105.ssh > cpef81d0fadd1d3-cmf81d0fadd1d0.cpe.net.fido.ca.51098: Flags [P.], seq 3405624:3405820, ack 1981, win 501, length 196
05:49:25.561731 IP 138.197.139.105.ssh > cpef81d0fadd1d3-cmf81d0fadd1d0.cpe.net.fido.ca.51098: Flags [P.], seq 3405820:3406016, ack 1981, win 501, length 196
05:49:25.561885 IP 138.197.139.105.ssh > cpef81d0fadd1d3-cmf81d0fadd1d0.cpe.net.fido.ca.51098: Flags [P.], seq 3406016:3406212, ack 1981, win 501, length 196
05:49:25.562040 IP 138.197.139.105.ssh > cpef81d0fadd1d3-cmf81d0fadd1d0.cpe.net.fido.ca.51098: Flags [P.], seq 3406212:3406408, ack 1981, win 501, length 196
05:49:25.562220 IP cpef81d0fadd1d3-cmf81d0fadd1d0.cpe.net.fido.ca.51098 > 138.197.139.105.ssh: Flags [.], ack 3392428, win 513, length 0
05:49:25.562220 IP cpef81d0fadd1d3-cmf81d0fadd1d0.cpe.net.fido.ca.51098 > 138.197.139.105.ssh: Flags [.], ack 3395784, win 513, length 0
05:49:25.562221 IP cpef81d0fadd1d3-cmf81d0fadd1d0.cpe.net.fido.ca.51098 > 138.197.139.105.ssh: Flags [.], ack 3398136, win 513, length 0
05:49:25.562221 IP cpef81d0fadd1d3-cmf81d0fadd1d0.cpe.net.fido.ca.51098 > 138.197.139.105.ssh: Flags [.], ack 3400292, win 513, length 0
05:49:25.562258 IP 138.197.139.105.ssh > cpef81d0fadd1d3-cmf81d0fadd1d0.cpe.net.fido.ca.51098: Flags [P.], seq 3406408:3406604, ack 1981, win 501, length 196
05:49:25.562607 IP 138.197.139.105.ssh > cpef81d0fadd1d3-cmf81d0fadd1d0.cpe.net.fido.ca.51098: Flags [P.], seq 3406604:3407352, ack 1981, win 501, length 748
05:49:25.562787 IP 138.197.139.105.ssh > cpef81d0fadd1d3-cmf81d0fadd1d0.cpe.net.fido.ca.51098: Flags [P.], seq 3407352:3407548, ack 1981, win 501, length 196
05:49:25.562963 IP 138.197.139.105.ssh > cpef81d0fadd1d3-cmf81d0fadd1d0.cpe.net.fido.ca.51098: Flags [P.], seq 3407548:3407744, ack 1981, win 501, length 196
05:49:25.563164 IP 138.197.139.105.ssh > cpef81d0fadd1d3-cmf81d0fadd1d0.cpe.net.fido.ca.51098: Flags [P.], seq 3407744:3407940, ack 1981, win 501, length 196
05:49:25.563380 IP 138.197.139.105.ssh > cpef81d0fadd1d3-cmf81d0fadd1d0.cpe.net.fido.ca.51098: Flags [P.], seq 3407940:3408136, ack 1981, win 501, length 196
05:49:25.563544 IP 138.197.139.105.ssh > cpef81d0fadd1d3-cmf81d0fadd1d0.cpe.net.fido.ca.51098: Flags [P.], seq 3408136:3408332, ack 1981, win 501, length 196
05:49:25.563709 IP 138.197.139.105.ssh > cpef81d0fadd1d3-cmf81d0fadd1d0.cpe.net.fido.ca.51098: Flags [P.], seq 3408332:3408528, ack 1981, win 501, length 196
05:49:25.563865 IP 138.197.139.105.ssh > cpef81d0fadd1d3-cmf81d0fadd1d0.cpe.net.fido.ca.51098: Flags [P.], seq 3408528:3408724, ack 1981, win 501, length 196
05:49:25.564033 IP 138.197.139.105.ssh > cpef81d0fadd1d3-cmf81d0fadd1d0.cpe.net.fido.ca.51098: Flags [P.], seq 3408724:3408920, ack 1981, win 501, length 196
05:49:25.564206 IP 138.197.139.105.ssh > cpef81d0fadd1d3-cmf81d0fadd1d0.cpe.net.fido.ca.51098: Flags [P.], seq 3408920:3409116, ack 1981, win 501, length 196
05:49:25.564369 IP 138.197.139.105.ssh > cpef81d0fadd1d3-cmf81d0fadd1d0.cpe.net.fido.ca.51098: Flags [P.], seq 3409116:3409312, ack 1981, win 501, length 196
05:49:25.564555 IP 138.197.139.105.ssh > cpef81d0fadd1d3-cmf81d0fadd1d0.cpe.net.fido.ca.51098: Flags [P.], seq 3409312:3409508, ack 1981, win 501, length 196
05:49:25.564753 IP 138.197.139.105.ssh > cpef81d0fadd1d3-cmf81d0fadd1d0.cpe.net.fido.ca.51098: Flags [P.], seq 3409508:3409704, ack 1981, win 501, length 196
05:49:25.564923 IP 138.197.139.105.ssh > cpef81d0fadd1d3-cmf81d0fadd1d0.cpe.net.fido.ca.51098: Flags [P.], seq 3409704:3409900, ack 1981, win 501, length 196
05:49:25.565084 IP 138.197.139.105.ssh > cpef81d0fadd1d3-cmf81d0fadd1d0.cpe.net.fido.ca.51098: Flags [P.], seq 3409900:3410096, ack 1981, win 501, length 196
05:49:25.565259 IP 138.197.139.105.ssh > cpef81d0fadd1d3-cmf81d0fadd1d0.cpe.net.fido.ca.51098: Flags [P.], seq 3410096:3410292, ack 1981, win 501, length 196
05:49:25.565423 IP 138.197.139.105.ssh > cpef81d0fadd1d3-cmf81d0fadd1d0.cpe.net.fido.ca.51098: Flags [P.], seq 3410292:3410488, ack 1981, win 501, length 196
05:49:25.565585 IP 138.197.139.105.ssh > cpef81d0fadd1d3-cmf81d0fadd1d0.cpe.net.fido.ca.51098: Flags [P.], seq 3410488:3410684, ack 1981, win 501, length 196
05:49:25.565741 IP 138.197.139.105.ssh > cpef81d0fadd1d3-cmf81d0fadd1d0.cpe.net.fido.ca.51098: Flags [P.], seq 3410684:3410880, ack 1981, win 501, length 196
05:49:25.565898 IP 138.197.139.105.ssh > cpef81d0fadd1d3-cmf81d0fadd1d0.cpe.net.fido.ca.51098: Flags [P.], seq 3410880:3411076, ack 1981, win 501, length 196
05:49:25.566062 IP 138.197.139.105.ssh > cpef81d0fadd1d3-cmf81d0fadd1d0.cpe.net.fido.ca.51098: Flags [P.], seq 3411076:3411272, ack 1981, win 501, length 196
05:49:25.566216 IP 138.197.139.105.ssh > cpef81d0fadd1d3-cmf81d0fadd1d0.cpe.net.fido.ca.51098: Flags [P.], seq 3411272:3411468, ack 1981, win 501, length 196
05:49:25.566371 IP 138.197.139.105.ssh > cpef81d0fadd1d3-cmf81d0fadd1d0.cpe.net.fido.ca.51098: Flags [P.], seq 3411468:3411664, ack 1981, win 501, length 196
05:49:25.566531 IP 138.197.139.105.ssh > cpef81d0fadd1d3-cmf81d0fadd1d0.cpe.net.fido.ca.51098: Flags [P.], seq 3411664:3411860, ack 1981, win 501, length 196
05:49:25.566694 IP 138.197.139.105.ssh > cpef81d0fadd1d3-cmf81d0fadd1d0.cpe.net.fido.ca.51098: Flags [P.], seq 3411860:3412056, ack 1981, win 501, length 196
05:49:25.566849 IP 138.197.139.105.ssh > cpef81d0fadd1d3-cmf81d0fadd1d0.cpe.net.fido.ca.51098: Flags [P.], seq 3412056:3412252, ack 1981, win 501, length 196
05:49:25.567044 IP 138.197.139.105.ssh > cpef81d0fadd1d3-cmf81d0fadd1d0.cpe.net.fido.ca.51098: Flags [P.], seq 3412252:3412448, ack 1981, win 501, length 196
05:49:25.567210 IP 138.197.139.105.ssh > cpef81d0fadd1d3-cmf81d0fadd1d0.cpe.net.fido.ca.51098: Flags [P.], seq 3412448:3412644, ack 1981, win 501, length 196
05:49:25.567587 IP 138.197.139.105.ssh > cpef81d0fadd1d3-cmf81d0fadd1d0.cpe.net.fido.ca.51098: Flags [P.], seq 3412644:3412840, ack 1981, win 501, length 196
05:49:25.567761 IP 138.197.139.105.ssh > cpef81d0fadd1d3-cmf81d0fadd1d0.cpe.net.fido.ca.51098: Flags [P.], seq 3412840:3413036, ack 1981, win 501, length 196
05:49:25.567932 IP 138.197.139.105.ssh > cpef81d0fadd1d3-cmf81d0fadd1d0.cpe.net.fido.ca.51098: Flags [P.], seq 3413036:3413232, ack 1981, win 501, length 196
05:49:25.568097 IP 138.197.139.105.ssh > cpef81d0fadd1d3-cmf81d0fadd1d0.cpe.net.fido.ca.51098: Flags [P.], seq 3413232:3413428, ack 1981, win 501, length 196
05:49:25.568380 IP 138.197.139.105.ssh > cpef81d0fadd1d3-cmf81d0fadd1d0.cpe.net.fido.ca.51098: Flags [P.], seq 3413428:3413624, ack 1981, win 501, length 196
05:49:25.568553 IP 138.197.139.105.ssh > cpef81d0fadd1d3-cmf81d0fadd1d0.cpe.net.fido.ca.51098: Flags [P.], seq 3413624:3413820, ack 1981, win 501, length 196
05:49:25.568712 IP 138.197.139.105.ssh > cpef81d0fadd1d3-cmf81d0fadd1d0.cpe.net.fido.ca.51098: Flags [P.], seq 3413820:3414016, ack 1981, win 501, length 196
05:49:25.568888 IP 138.197.139.105.ssh > cpef81d0fadd1d3-cmf81d0fadd1d0.cpe.net.fido.ca.51098: Flags [P.], seq 3414016:3414212, ack 1981, win 501, length 196
05:49:25.569057 IP 138.197.139.105.ssh > cpef81d0fadd1d3-cmf81d0fadd1d0.cpe.net.fido.ca.51098: Flags [P.], seq 3414212:3414408, ack 1981, win 501, length 196
05:49:25.569226 IP 138.197.139.105.ssh > cpef81d0fadd1d3-cmf81d0fadd1d0.cpe.net.fido.ca.51098: Flags [P.], seq 3414408:3414604, ack 1981, win 501, length 196
05:49:25.569398 IP 138.197.139.105.ssh > cpef81d0fadd1d3-cmf81d0fadd1d0.cpe.net.fido.ca.51098: Flags [P.], seq 3414604:3414800, ack 1981, win 501, length 196
05:49:25.569562 IP 138.197.139.105.ssh > cpef81d0fadd1d3-cmf81d0fadd1d0.cpe.net.fido.ca.51098: Flags [P.], seq 3414800:3414996, ack 1981, win 501, length 196
05:49:25.569728 IP 138.197.139.105.ssh > cpef81d0fadd1d3-cmf81d0fadd1d0.cpe.net.fido.ca.51098: Flags [P.], seq 3414996:3415192, ack 1981, win 501, length 196
05:49:25.569923 IP 138.197.139.105.ssh > cpef81d0fadd1d3-cmf81d0fadd1d0.cpe.net.fido.ca.51098: Flags [P.], seq 3415192:3415388, ack 1981, win 501, length 196
05:49:25.570106 IP 138.197.139.105.ssh > cpef81d0fadd1d3-cmf81d0fadd1d0.cpe.net.fido.ca.51098: Flags [P.], seq 3415388:3415584, ack 1981, win 501, length 196
05:49:25.570266 IP 138.197.139.105.ssh > cpef81d0fadd1d3-cmf81d0fadd1d0.cpe.net.fido.ca.51098: Flags [P.], seq 3415584:3415780, ack 1981, win 501, length 196
05:49:25.570448 IP 138.197.139.105.ssh > cpef81d0fadd1d3-cmf81d0fadd1d0.cpe.net.fido.ca.51098: Flags [P.], seq 3415780:3415976, ack 1981, win 501, length 196
05:49:25.570649 IP 138.197.139.105.ssh > cpef81d0fadd1d3-cmf81d0fadd1d0.cpe.net.fido.ca.51098: Flags [P.], seq 3415976:3416172, ack 1981, win 501, length 196
05:49:25.570825 IP 138.197.139.105.ssh > cpef81d0fadd1d3-cmf81d0fadd1d0.cpe.net.fido.ca.51098: Flags [P.], seq 3416172:3416368, ack 1981, win 501, length 196
05:49:25.571026 IP 138.197.139.105.ssh > cpef81d0fadd1d3-cmf81d0fadd1d0.cpe.net.fido.ca.51098: Flags [P.], seq 3416368:3416564, ack 1981, win 501, length 196
05:49:25.571189 IP 138.197.139.105.ssh > cpef81d0fadd1d3-cmf81d0fadd1d0.cpe.net.fido.ca.51098: Flags [P.], seq 3416564:3416760, ack 1981, win 501, length 196
05:49:25.571384 IP 138.197.139.105.ssh > cpef81d0fadd1d3-cmf81d0fadd1d0.cpe.net.fido.ca.51098: Flags [P.], seq 3416760:3416956, ack 1981, win 501, length 196
05:49:25.571593 IP 138.197.139.105.ssh > cpef81d0fadd1d3-cmf81d0fadd1d0.cpe.net.fido.ca.51098: Flags [P.], seq 3416956:3417152, ack 1981, win 501, length 196
05:49:25.571775 IP 138.197.139.105.ssh > cpef81d0fadd1d3-cmf81d0fadd1d0.cpe.net.fido.ca.51098: Flags [P.], seq 3417152:3417348, ack 1981, win 501, length 196
05:49:25.571972 IP 138.197.139.105.ssh > cpef81d0fadd1d3-cmf81d0fadd1d0.cpe.net.fido.ca.51098: Flags [P.], seq 3417348:3417544, ack 1981, win 501, length 196
05:49:25.572095 IP cpef81d0fadd1d3-cmf81d0fadd1d0.cpe.net.fido.ca.51098 > 138.197.139.105.ssh: Flags [.], ack 3404252, win 513, length 0
05:49:25.572096 IP cpef81d0fadd1d3-cmf81d0fadd1d0.cpe.net.fido.ca.51098 > 138.197.139.105.ssh: Flags [.], ack 3406408, win 513, length 0
05:49:25.572096 IP cpef81d0fadd1d3-cmf81d0fadd1d0.cpe.net.fido.ca.51098 > 138.197.139.105.ssh: Flags [.], ack 3408332, win 513, length 0
05:49:25.572343 IP 138.197.139.105.ssh > cpef81d0fadd1d3-cmf81d0fadd1d0.cpe.net.fido.ca.51098: Flags [P.], seq 3417544:3418156, ack 1981, win 501, length 612
05:49:25.572549 IP 138.197.139.105.ssh > cpef81d0fadd1d3-cmf81d0fadd1d0.cpe.net.fido.ca.51098: Flags [P.], seq 3418156:3418352, ack 1981, win 501, length 196
05:49:25.572747 IP 138.197.139.105.ssh > cpef81d0fadd1d3-cmf81d0fadd1d0.cpe.net.fido.ca.51098: Flags [P.], seq 3418352:3418548, ack 1981, win 501, length 196
05:49:25.572945 IP 138.197.139.105.ssh > cpef81d0fadd1d3-cmf81d0fadd1d0.cpe.net.fido.ca.51098: Flags [P.], seq 3418548:3418744, ack 1981, win 501, length 196
05:49:25.573129 IP 138.197.139.105.ssh > cpef81d0fadd1d3-cmf81d0fadd1d0.cpe.net.fido.ca.51098: Flags [P.], seq 3418744:3418940, ack 1981, win 501, length 196
05:49:25.573330 IP 138.197.139.105.ssh > cpef81d0fadd1d3-cmf81d0fadd1d0.cpe.net.fido.ca.51098: Flags [P.], seq 3418940:3419136, ack 1981, win 501, length 196
05:49:25.573526 IP 138.197.139.105.ssh > cpef81d0fadd1d3-cmf81d0fadd1d0.cpe.net.fido.ca.51098: Flags [P.], seq 3419136:3419332, ack 1981, win 501, length 196
05:49:25.573717 IP 138.197.139.105.ssh > cpef81d0fadd1d3-cmf81d0fadd1d0.cpe.net.fido.ca.51098: Flags [P.], seq 3419332:3419528, ack 1981, win 501, length 196
05:49:25.573913 IP 138.197.139.105.ssh > cpef81d0fadd1d3-cmf81d0fadd1d0.cpe.net.fido.ca.51098: Flags [P.], seq 3419528:3419724, ack 1981, win 501, length 196
05:49:25.574097 IP 138.197.139.105.ssh > cpef81d0fadd1d3-cmf81d0fadd1d0.cpe.net.fido.ca.51098: Flags [P.], seq 3419724:3419920, ack 1981, win 501, length 196
05:49:25.574281 IP 138.197.139.105.ssh > cpef81d0fadd1d3-cmf81d0fadd1d0.cpe.net.fido.ca.51098: Flags [P.], seq 3419920:3420116, ack 1981, win 501, length 196
05:49:25.574490 IP 138.197.139.105.ssh > cpef81d0fadd1d3-cmf81d0fadd1d0.cpe.net.fido.ca.51098: Flags [P.], seq 3420116:3420312, ack 1981, win 501, length 196
05:49:25.574654 IP 138.197.139.105.ssh > cpef81d0fadd1d3-cmf81d0fadd1d0.cpe.net.fido.ca.51098: Flags [P.], seq 3420312:3420508, ack 1981, win 501, length 196
05:49:25.574840 IP 138.197.139.105.ssh > cpef81d0fadd1d3-cmf81d0fadd1d0.cpe.net.fido.ca.51098: Flags [P.], seq 3420508:3420704, ack 1981, win 501, length 196
05:49:25.575049 IP 138.197.139.105.ssh > cpef81d0fadd1d3-cmf81d0fadd1d0.cpe.net.fido.ca.51098: Flags [P.], seq 3420704:3420900, ack 1981, win 501, length 196
05:49:25.575242 IP 138.197.139.105.ssh > cpef81d0fadd1d3-cmf81d0fadd1d0.cpe.net.fido.ca.51098: Flags [P.], seq 3420900:3421096, ack 1981, win 501, length 196
05:49:25.575446 IP 138.197.139.105.ssh > cpef81d0fadd1d3-cmf81d0fadd1d0.cpe.net.fido.ca.51098: Flags [P.], seq 3421096:3421292, ack 1981, win 501, length 196
05:49:25.575638 IP 138.197.139.105.ssh > cpef81d0fadd1d3-cmf81d0fadd1d0.cpe.net.fido.ca.51098: Flags [P.], seq 3421292:3421488, ack 1981, win 501, length 196
05:49:25.575829 IP 138.197.139.105.ssh > cpef81d0fadd1d3-cmf81d0fadd1d0.cpe.net.fido.ca.51098: Flags [P.], seq 3421488:3421684, ack 1981, win 501, length 196
05:49:25.576017 IP 138.197.139.105.ssh > cpef81d0fadd1d3-cmf81d0fadd1d0.cpe.net.fido.ca.51098: Flags [P.], seq 3421684:3421880, ack 1981, win 501, length 196
05:49:25.576180 IP 138.197.139.105.ssh > cpef81d0fadd1d3-cmf81d0fadd1d0.cpe.net.fido.ca.51098: Flags [P.], seq 3421880:3422076, ack 1981, win 501, length 196
05:49:25.576283 IP cpef81d0fadd1d3-cmf81d0fadd1d0.cpe.net.fido.ca.51098 > 138.197.139.105.ssh: Flags [.], ack 3410880, win 513, length 0
05:49:25.576284 IP cpef81d0fadd1d3-cmf81d0fadd1d0.cpe.net.fido.ca.51098 > 138.197.139.105.ssh: Flags [.], ack 3413232, win 513, length 0
05:49:25.576284 IP cpef81d0fadd1d3-cmf81d0fadd1d0.cpe.net.fido.ca.51098 > 138.197.139.105.ssh: Flags [.], ack 3415192, win 513, length 0
05:49:25.576539 IP 138.197.139.105.ssh > cpef81d0fadd1d3-cmf81d0fadd1d0.cpe.net.fido.ca.51098: Flags [P.], seq 3422076:3422688, ack 1981, win 501, length 612
05:49:25.576719 IP 138.197.139.105.ssh > cpef81d0fadd1d3-cmf81d0fadd1d0.cpe.net.fido.ca.51098: Flags [P.], seq 3422688:3422884, ack 1981, win 501, length 196
05:49:25.576914 IP 138.197.139.105.ssh > cpef81d0fadd1d3-cmf81d0fadd1d0.cpe.net.fido.ca.51098: Flags [P.], seq 3422884:3423080, ack 1981, win 501, length 196
05:49:25.577109 IP 138.197.139.105.ssh > cpef81d0fadd1d3-cmf81d0fadd1d0.cpe.net.fido.ca.51098: Flags [P.], seq 3423080:3423276, ack 1981, win 501, length 196
05:49:25.577272 IP 138.197.139.105.ssh > cpef81d0fadd1d3-cmf81d0fadd1d0.cpe.net.fido.ca.51098: Flags [P.], seq 3423276:3423472, ack 1981, win 501, length 196
05:49:25.577430 IP 138.197.139.105.ssh > cpef81d0fadd1d3-cmf81d0fadd1d0.cpe.net.fido.ca.51098: Flags [P.], seq 3423472:3423668, ack 1981, win 501, length 196
05:49:25.577587 IP 138.197.139.105.ssh > cpef81d0fadd1d3-cmf81d0fadd1d0.cpe.net.fido.ca.51098: Flags [P.], seq 3423668:3423864, ack 1981, win 501, length 196
05:49:25.577757 IP 138.197.139.105.ssh > cpef81d0fadd1d3-cmf81d0fadd1d0.cpe.net.fido.ca.51098: Flags [P.], seq 3423864:3424060, ack 1981, win 501, length 196
05:49:25.577935 IP 138.197.139.105.ssh > cpef81d0fadd1d3-cmf81d0fadd1d0.cpe.net.fido.ca.51098: Flags [P.], seq 3424060:3424256, ack 1981, win 501, length 196
05:49:25.578135 IP 138.197.139.105.ssh > cpef81d0fadd1d3-cmf81d0fadd1d0.cpe.net.fido.ca.51098: Flags [P.], seq 3424256:3424452, ack 1981, win 501, length 196
05:49:25.578314 IP 138.197.139.105.ssh > cpef81d0fadd1d3-cmf81d0fadd1d0.cpe.net.fido.ca.51098: Flags [P.], seq 3424452:3424648, ack 1981, win 501, length 196
05:49:25.578475 IP 138.197.139.105.ssh > cpef81d0fadd1d3-cmf81d0fadd1d0.cpe.net.fido.ca.51098: Flags [P.], seq 3424648:3424844, ack 1981, win 501, length 196
05:49:25.578653 IP 138.197.139.105.ssh > cpef81d0fadd1d3-cmf81d0fadd1d0.cpe.net.fido.ca.51098: Flags [P.], seq 3424844:3425040, ack 1981, win 501, length 196
05:49:25.578851 IP 138.197.139.105.ssh > cpef81d0fadd1d3-cmf81d0fadd1d0.cpe.net.fido.ca.51098: Flags [P.], seq 3425040:3425236, ack 1981, win 501, length 196
05:49:25.579095 IP 138.197.139.105.ssh > cpef81d0fadd1d3-cmf81d0fadd1d0.cpe.net.fido.ca.51098: Flags [P.], seq 3425236:3425432, ack 1981, win 501, length 196
05:49:25.579589 IP 138.197.139.105.ssh > cpef81d0fadd1d3-cmf81d0fadd1d0.cpe.net.fido.ca.51098: Flags [P.], seq 3425432:3425628, ack 1981, win 501, length 196
05:49:25.579774 IP 138.197.139.105.ssh > cpef81d0fadd1d3-cmf81d0fadd1d0.cpe.net.fido.ca.51098: Flags [P.], seq 3425628:3425824, ack 1981, win 501, length 196
05:49:25.579957 IP 138.197.139.105.ssh > cpef81d0fadd1d3-cmf81d0fadd1d0.cpe.net.fido.ca.51098: Flags [P.], seq 3425824:3426020, ack 1981, win 501, length 196
05:49:25.580100 IP 138.197.139.105.ssh > cpef81d0fadd1d3-cmf81d0fadd1d0.cpe.net.fido.ca.51098: Flags [P.], seq 3426020:3426216, ack 1981, win 501, length 196
05:49:25.580230 IP 138.197.139.105.ssh > cpef81d0fadd1d3-cmf81d0fadd1d0.cpe.net.fido.ca.51098: Flags [P.], seq 3426216:3426412, ack 1981, win 501, length 196
05:49:25.580352 IP 138.197.139.105.ssh > cpef81d0fadd1d3-cmf81d0fadd1d0.cpe.net.fido.ca.51098: Flags [P.], seq 3426412:3426608, ack 1981, win 501, length 196
05:49:25.580471 IP 138.197.139.105.ssh > cpef81d0fadd1d3-cmf81d0fadd1d0.cpe.net.fido.ca.51098: Flags [P.], seq 3426608:3426804, ack 1981, win 501, length 196
05:49:25.580589 IP 138.197.139.105.ssh > cpef81d0fadd1d3-cmf81d0fadd1d0.cpe.net.fido.ca.51098: Flags [P.], seq 3426804:3427000, ack 1981, win 501, length 196
05:49:25.580706 IP 138.197.139.105.ssh > cpef81d0fadd1d3-cmf81d0fadd1d0.cpe.net.fido.ca.51098: Flags [P.], seq 3427000:3427196, ack 1981, win 501, length 196
05:49:25.580832 IP 138.197.139.105.ssh > cpef81d0fadd1d3-cmf81d0fadd1d0.cpe.net.fido.ca.51098: Flags [P.], seq 3427196:3427392, ack 1981, win 501, length 196
05:49:25.580949 IP 138.197.139.105.ssh > cpef81d0fadd1d3-cmf81d0fadd1d0.cpe.net.fido.ca.51098: Flags [P.], seq 3427392:3427588, ack 1981, win 501, length 196
05:49:25.581066 IP 138.197.139.105.ssh > cpef81d0fadd1d3-cmf81d0fadd1d0.cpe.net.fido.ca.51098: Flags [P.], seq 3427588:3427784, ack 1981, win 501, length 196
05:49:25.581188 IP 138.197.139.105.ssh > cpef81d0fadd1d3-cmf81d0fadd1d0.cpe.net.fido.ca.51098: Flags [P.], seq 3427784:3427980, ack 1981, win 501, length 196
05:49:25.581324 IP 138.197.139.105.ssh > cpef81d0fadd1d3-cmf81d0fadd1d0.cpe.net.fido.ca.51098: Flags [P.], seq 3427980:3428176, ack 1981, win 501, length 196
05:49:25.581443 IP 138.197.139.105.ssh > cpef81d0fadd1d3-cmf81d0fadd1d0.cpe.net.fido.ca.51098: Flags [P.], seq 3428176:3428372, ack 1981, win 501, length 196
05:49:25.581565 IP 138.197.139.105.ssh > cpef81d0fadd1d3-cmf81d0fadd1d0.cpe.net.fido.ca.51098: Flags [P.], seq 3428372:3428568, ack 1981, win 501, length 196
05:49:25.581679 IP 138.197.139.105.ssh > cpef81d0fadd1d3-cmf81d0fadd1d0.cpe.net.fido.ca.51098: Flags [P.], seq 3428568:3428764, ack 1981, win 501, length 196
05:49:25.581864 IP 138.197.139.105.ssh > cpef81d0fadd1d3-cmf81d0fadd1d0.cpe.net.fido.ca.51098: Flags [P.], seq 3428764:3428960, ack 1981, win 501, length 196
05:49:25.582004 IP 138.197.139.105.ssh > cpef81d0fadd1d3-cmf81d0fadd1d0.cpe.net.fido.ca.51098: Flags [P.], seq 3428960:3429156, ack 1981, win 501, length 196
05:49:25.582128 IP 138.197.139.105.ssh > cpef81d0fadd1d3-cmf81d0fadd1d0.cpe.net.fido.ca.51098: Flags [P.], seq 3429156:3429352, ack 1981, win 501, length 196
05:49:25.582259 IP 138.197.139.105.ssh > cpef81d0fadd1d3-cmf81d0fadd1d0.cpe.net.fido.ca.51098: Flags [P.], seq 3429352:3429548, ack 1981, win 501, length 196
05:49:25.582387 IP 138.197.139.105.ssh > cpef81d0fadd1d3-cmf81d0fadd1d0.cpe.net.fido.ca.51098: Flags [P.], seq 3429548:3429744, ack 1981, win 501, length 196
05:49:25.582506 IP 138.197.139.105.ssh > cpef81d0fadd1d3-cmf81d0fadd1d0.cpe.net.fido.ca.51098: Flags [P.], seq 3429744:3429940, ack 1981, win 501, length 196
05:49:25.582624 IP 138.197.139.105.ssh > cpef81d0fadd1d3-cmf81d0fadd1d0.cpe.net.fido.ca.51098: Flags [P.], seq 3429940:3430136, ack 1981, win 501, length 196
05:49:25.582752 IP 138.197.139.105.ssh > cpef81d0fadd1d3-cmf81d0fadd1d0.cpe.net.fido.ca.51098: Flags [P.], seq 3430136:3430332, ack 1981, win 501, length 196
05:49:25.582894 IP 138.197.139.105.ssh > cpef81d0fadd1d3-cmf81d0fadd1d0.cpe.net.fido.ca.51098: Flags [P.], seq 3430332:3430528, ack 1981, win 501, length 196
05:49:25.583088 IP 138.197.139.105.ssh > cpef81d0fadd1d3-cmf81d0fadd1d0.cpe.net.fido.ca.51098: Flags [P.], seq 3430528:3430724, ack 1981, win 501, length 196
05:49:25.583314 IP 138.197.139.105.ssh > cpef81d0fadd1d3-cmf81d0fadd1d0.cpe.net.fido.ca.51098: Flags [P.], seq 3430724:3430920, ack 1981, win 501, length 196
05:49:25.583455 IP 138.197.139.105.ssh > cpef81d0fadd1d3-cmf81d0fadd1d0.cpe.net.fido.ca.51098: Flags [P.], seq 3430920:3431116, ack 1981, win 501, length 196
05:49:25.583585 IP 138.197.139.105.ssh > cpef81d0fadd1d3-cmf81d0fadd1d0.cpe.net.fido.ca.51098: Flags [P.], seq 3431116:3431312, ack 1981, win 501, length 196
05:49:25.583702 IP 138.197.139.105.ssh > cpef81d0fadd1d3-cmf81d0fadd1d0.cpe.net.fido.ca.51098: Flags [P.], seq 3431312:3431508, ack 1981, win 501, length 196
05:49:25.583823 IP 138.197.139.105.ssh > cpef81d0fadd1d3-cmf81d0fadd1d0.cpe.net.fido.ca.51098: Flags [P.], seq 3431508:3431704, ack 1981, win 501, length 196
05:49:25.583967 IP 138.197.139.105.ssh > cpef81d0fadd1d3-cmf81d0fadd1d0.cpe.net.fido.ca.51098: Flags [P.], seq 3431704:3431900, ack 1981, win 501, length 196
05:49:25.584085 IP 138.197.139.105.ssh > cpef81d0fadd1d3-cmf81d0fadd1d0.cpe.net.fido.ca.51098: Flags [P.], seq 3431900:3432096, ack 1981, win 501, length 196
05:49:25.584141 IP cpef81d0fadd1d3-cmf81d0fadd1d0.cpe.net.fido.ca.51098 > 138.197.139.105.ssh: Flags [.], ack 3418156, win 513, length 0
05:49:25.584141 IP cpef81d0fadd1d3-cmf81d0fadd1d0.cpe.net.fido.ca.51098 > 138.197.139.105.ssh: Flags [.], ack 3418744, win 510, length 0
05:49:25.584141 IP cpef81d0fadd1d3-cmf81d0fadd1d0.cpe.net.fido.ca.51098 > 138.197.139.105.ssh: Flags [.], ack 3420508, win 513, length 0
05:49:25.584362 IP 138.197.139.105.ssh > cpef81d0fadd1d3-cmf81d0fadd1d0.cpe.net.fido.ca.51098: Flags [P.], seq 3432096:3432708, ack 1981, win 501, length 612
05:49:25.584486 IP 138.197.139.105.ssh > cpef81d0fadd1d3-cmf81d0fadd1d0.cpe.net.fido.ca.51098: Flags [P.], seq 3432708:3432904, ack 1981, win 501, length 196
05:49:25.584608 IP 138.197.139.105.ssh > cpef81d0fadd1d3-cmf81d0fadd1d0.cpe.net.fido.ca.51098: Flags [P.], seq 3432904:3433100, ack 1981, win 501, length 196
05:49:25.584725 IP 138.197.139.105.ssh > cpef81d0fadd1d3-cmf81d0fadd1d0.cpe.net.fido.ca.51098: Flags [P.], seq 3433100:3433296, ack 1981, win 501, length 196
05:49:25.584841 IP 138.197.139.105.ssh > cpef81d0fadd1d3-cmf81d0fadd1d0.cpe.net.fido.ca.51098: Flags [P.], seq 3433296:3433492, ack 1981, win 501, length 196
05:49:25.584961 IP 138.197.139.105.ssh > cpef81d0fadd1d3-cmf81d0fadd1d0.cpe.net.fido.ca.51098: Flags [P.], seq 3433492:3433688, ack 1981, win 501, length 196
05:49:25.585081 IP 138.197.139.105.ssh > cpef81d0fadd1d3-cmf81d0fadd1d0.cpe.net.fido.ca.51098: Flags [P.], seq 3433688:3433884, ack 1981, win 501, length 196
05:49:25.585202 IP 138.197.139.105.ssh > cpef81d0fadd1d3-cmf81d0fadd1d0.cpe.net.fido.ca.51098: Flags [P.], seq 3433884:3434080, ack 1981, win 501, length 196
05:49:25.585710 IP 138.197.139.105.ssh > cpef81d0fadd1d3-cmf81d0fadd1d0.cpe.net.fido.ca.51098: Flags [P.], seq 3434080:3434276, ack 1981, win 501, length 196
05:49:25.585961 IP 138.197.139.105.ssh > cpef81d0fadd1d3-cmf81d0fadd1d0.cpe.net.fido.ca.51098: Flags [P.], seq 3434276:3434472, ack 1981, win 501, length 196
05:49:25.586117 IP 138.197.139.105.ssh > cpef81d0fadd1d3-cmf81d0fadd1d0.cpe.net.fido.ca.51098: Flags [P.], seq 3434472:3434668, ack 1981, win 501, length 196
05:49:25.586245 IP 138.197.139.105.ssh > cpef81d0fadd1d3-cmf81d0fadd1d0.cpe.net.fido.ca.51098: Flags [P.], seq 3434668:3434864, ack 1981, win 501, length 196
05:49:25.586366 IP 138.197.139.105.ssh > cpef81d0fadd1d3-cmf81d0fadd1d0.cpe.net.fido.ca.51098: Flags [P.], seq 3434864:3435060, ack 1981, win 501, length 196
05:49:25.586483 IP 138.197.139.105.ssh > cpef81d0fadd1d3-cmf81d0fadd1d0.cpe.net.fido.ca.51098: Flags [P.], seq 3435060:3435256, ack 1981, win 501, length 196
05:49:25.586602 IP 138.197.139.105.ssh > cpef81d0fadd1d3-cmf81d0fadd1d0.cpe.net.fido.ca.51098: Flags [P.], seq 3435256:3435452, ack 1981, win 501, length 196
05:49:25.586719 IP 138.197.139.105.ssh > cpef81d0fadd1d3-cmf81d0fadd1d0.cpe.net.fido.ca.51098: Flags [P.], seq 3435452:3435648, ack 1981, win 501, length 196
05:49:25.586835 IP 138.197.139.105.ssh > cpef81d0fadd1d3-cmf81d0fadd1d0.cpe.net.fido.ca.51098: Flags [P.], seq 3435648:3435844, ack 1981, win 501, length 196
05:49:25.586952 IP 138.197.139.105.ssh > cpef81d0fadd1d3-cmf81d0fadd1d0.cpe.net.fido.ca.51098: Flags [P.], seq 3435844:3436040, ack 1981, win 501, length 196
05:49:25.587095 IP 138.197.139.105.ssh > cpef81d0fadd1d3-cmf81d0fadd1d0.cpe.net.fido.ca.51098: Flags [P.], seq 3436040:3436236, ack 1981, win 501, length 196
05:49:25.587215 IP 138.197.139.105.ssh > cpef81d0fadd1d3-cmf81d0fadd1d0.cpe.net.fido.ca.51098: Flags [P.], seq 3436236:3436432, ack 1981, win 501, length 196
05:49:25.587510 IP 138.197.139.105.ssh > cpef81d0fadd1d3-cmf81d0fadd1d0.cpe.net.fido.ca.51098: Flags [P.], seq 3436432:3436628, ack 1981, win 501, length 196
05:49:25.587653 IP 138.197.139.105.ssh > cpef81d0fadd1d3-cmf81d0fadd1d0.cpe.net.fido.ca.51098: Flags [P.], seq 3436628:3436824, ack 1981, win 501, length 196
05:49:25.587837 IP 138.197.139.105.ssh > cpef81d0fadd1d3-cmf81d0fadd1d0.cpe.net.fido.ca.51098: Flags [P.], seq 3436824:3437020, ack 1981, win 501, length 196
05:49:25.587969 IP 138.197.139.105.ssh > cpef81d0fadd1d3-cmf81d0fadd1d0.cpe.net.fido.ca.51098: Flags [P.], seq 3437020:3437216, ack 1981, win 501, length 196
05:49:25.588088 IP 138.197.139.105.ssh > cpef81d0fadd1d3-cmf81d0fadd1d0.cpe.net.fido.ca.51098: Flags [P.], seq 3437216:3437412, ack 1981, win 501, length 196
05:49:25.588252 IP cpef81d0fadd1d3-cmf81d0fadd1d0.cpe.net.fido.ca.51098 > 138.197.139.105.ssh: Flags [.], ack 3422076, win 513, length 0
05:49:25.588252 IP cpef81d0fadd1d3-cmf81d0fadd1d0.cpe.net.fido.ca.51098 > 138.197.139.105.ssh: Flags [.], ack 3425236, win 513, length 0
05:49:25.588252 IP cpef81d0fadd1d3-cmf81d0fadd1d0.cpe.net.fido.ca.51098 > 138.197.139.105.ssh: Flags [.], ack 3427588, win 513, length 0
05:49:25.588252 IP cpef81d0fadd1d3-cmf81d0fadd1d0.cpe.net.fido.ca.51098 > 138.197.139.105.ssh: Flags [.], ack 3430136, win 513, length 0
05:49:25.588284 IP 138.197.139.105.ssh > cpef81d0fadd1d3-cmf81d0fadd1d0.cpe.net.fido.ca.51098: Flags [P.], seq 3437412:3437608, ack 1981, win 501, length 196
05:49:25.588504 IP 138.197.139.105.ssh > cpef81d0fadd1d3-cmf81d0fadd1d0.cpe.net.fido.ca.51098: Flags [P.], seq 3437608:3438356, ack 1981, win 501, length 748
05:49:25.588711 IP 138.197.139.105.ssh > cpef81d0fadd1d3-cmf81d0fadd1d0.cpe.net.fido.ca.51098: Flags [P.], seq 3438356:3438552, ack 1981, win 501, length 196
05:49:25.588894 IP 138.197.139.105.ssh > cpef81d0fadd1d3-cmf81d0fadd1d0.cpe.net.fido.ca.51098: Flags [P.], seq 3438552:3438748, ack 1981, win 501, length 196
05:49:25.589072 IP 138.197.139.105.ssh > cpef81d0fadd1d3-cmf81d0fadd1d0.cpe.net.fido.ca.51098: Flags [P.], seq 3438748:3438944, ack 1981, win 501, length 196
05:49:25.589231 IP 138.197.139.105.ssh > cpef81d0fadd1d3-cmf81d0fadd1d0.cpe.net.fido.ca.51098: Flags [P.], seq 3438944:3439140, ack 1981, win 501, length 196
05:49:25.589411 IP 138.197.139.105.ssh > cpef81d0fadd1d3-cmf81d0fadd1d0.cpe.net.fido.ca.51098: Flags [P.], seq 3439140:3439336, ack 1981, win 501, length 196
05:49:25.589570 IP 138.197.139.105.ssh > cpef81d0fadd1d3-cmf81d0fadd1d0.cpe.net.fido.ca.51098: Flags [P.], seq 3439336:3439532, ack 1981, win 501, length 196
05:49:25.589739 IP 138.197.139.105.ssh > cpef81d0fadd1d3-cmf81d0fadd1d0.cpe.net.fido.ca.51098: Flags [P.], seq 3439532:3439728, ack 1981, win 501, length 196
05:49:25.589897 IP 138.197.139.105.ssh > cpef81d0fadd1d3-cmf81d0fadd1d0.cpe.net.fido.ca.51098: Flags [P.], seq 3439728:3439924, ack 1981, win 501, length 196
05:49:25.590053 IP 138.197.139.105.ssh > cpef81d0fadd1d3-cmf81d0fadd1d0.cpe.net.fido.ca.51098: Flags [P.], seq 3439924:3440120, ack 1981, win 501, length 196
05:49:25.590226 IP 138.197.139.105.ssh > cpef81d0fadd1d3-cmf81d0fadd1d0.cpe.net.fido.ca.51098: Flags [P.], seq 3440120:3440316, ack 1981, win 501, length 196
05:49:25.590383 IP 138.197.139.105.ssh > cpef81d0fadd1d3-cmf81d0fadd1d0.cpe.net.fido.ca.51098: Flags [P.], seq 3440316:3440512, ack 1981, win 501, length 196
05:49:25.590558 IP 138.197.139.105.ssh > cpef81d0fadd1d3-cmf81d0fadd1d0.cpe.net.fido.ca.51098: Flags [P.], seq 3440512:3440708, ack 1981, win 501, length 196
05:49:25.590728 IP 138.197.139.105.ssh > cpef81d0fadd1d3-cmf81d0fadd1d0.cpe.net.fido.ca.51098: Flags [P.], seq 3440708:3440904, ack 1981, win 501, length 196
05:49:25.590888 IP 138.197.139.105.ssh > cpef81d0fadd1d3-cmf81d0fadd1d0.cpe.net.fido.ca.51098: Flags [P.], seq 3440904:3441100, ack 1981, win 501, length 196
05:49:25.591105 IP 138.197.139.105.ssh > cpef81d0fadd1d3-cmf81d0fadd1d0.cpe.net.fido.ca.51098: Flags [P.], seq 3441100:3441296, ack 1981, win 501, length 196
05:49:25.591289 IP 138.197.139.105.ssh > cpef81d0fadd1d3-cmf81d0fadd1d0.cpe.net.fido.ca.51098: Flags [P.], seq 3441296:3441492, ack 1981, win 501, length 196
05:49:25.591451 IP 138.197.139.105.ssh > cpef81d0fadd1d3-cmf81d0fadd1d0.cpe.net.fido.ca.51098: Flags [P.], seq 3441492:3441688, ack 1981, win 501, length 196
05:49:25.591619 IP 138.197.139.105.ssh > cpef81d0fadd1d3-cmf81d0fadd1d0.cpe.net.fido.ca.51098: Flags [P.], seq 3441688:3441884, ack 1981, win 501, length 196
05:49:25.591793 IP 138.197.139.105.ssh > cpef81d0fadd1d3-cmf81d0fadd1d0.cpe.net.fido.ca.51098: Flags [P.], seq 3441884:3442080, ack 1981, win 501, length 196
05:49:25.591957 IP 138.197.139.105.ssh > cpef81d0fadd1d3-cmf81d0fadd1d0.cpe.net.fido.ca.51098: Flags [P.], seq 3442080:3442276, ack 1981, win 501, length 196
05:49:25.592111 IP 138.197.139.105.ssh > cpef81d0fadd1d3-cmf81d0fadd1d0.cpe.net.fido.ca.51098: Flags [P.], seq 3442276:3442472, ack 1981, win 501, length 196
05:49:25.592272 IP 138.197.139.105.ssh > cpef81d0fadd1d3-cmf81d0fadd1d0.cpe.net.fido.ca.51098: Flags [P.], seq 3442472:3442668, ack 1981, win 501, length 196
05:49:25.592459 IP 138.197.139.105.ssh > cpef81d0fadd1d3-cmf81d0fadd1d0.cpe.net.fido.ca.51098: Flags [P.], seq 3442668:3442864, ack 1981, win 501, length 196
05:49:25.592648 IP 138.197.139.105.ssh > cpef81d0fadd1d3-cmf81d0fadd1d0.cpe.net.fido.ca.51098: Flags [P.], seq 3442864:3443060, ack 1981, win 501, length 196
05:49:25.592837 IP 138.197.139.105.ssh > cpef81d0fadd1d3-cmf81d0fadd1d0.cpe.net.fido.ca.51098: Flags [P.], seq 3443060:3443256, ack 1981, win 501, length 196
05:49:25.593020 IP 138.197.139.105.ssh > cpef81d0fadd1d3-cmf81d0fadd1d0.cpe.net.fido.ca.51098: Flags [P.], seq 3443256:3443452, ack 1981, win 501, length 196
05:49:25.593214 IP 138.197.139.105.ssh > cpef81d0fadd1d3-cmf81d0fadd1d0.cpe.net.fido.ca.51098: Flags [P.], seq 3443452:3443648, ack 1981, win 501, length 196
05:49:25.593389 IP 138.197.139.105.ssh > cpef81d0fadd1d3-cmf81d0fadd1d0.cpe.net.fido.ca.51098: Flags [P.], seq 3443648:3443844, ack 1981, win 501, length 196
05:49:25.593572 IP 138.197.139.105.ssh > cpef81d0fadd1d3-cmf81d0fadd1d0.cpe.net.fido.ca.51098: Flags [P.], seq 3443844:3444040, ack 1981, win 501, length 196
05:49:25.593759 IP 138.197.139.105.ssh > cpef81d0fadd1d3-cmf81d0fadd1d0.cpe.net.fido.ca.51098: Flags [P.], seq 3444040:3444236, ack 1981, win 501, length 196
05:49:25.593961 IP 138.197.139.105.ssh > cpef81d0fadd1d3-cmf81d0fadd1d0.cpe.net.fido.ca.51098: Flags [P.], seq 3444236:3444432, ack 1981, win 501, length 196
05:49:25.594146 IP 138.197.139.105.ssh > cpef81d0fadd1d3-cmf81d0fadd1d0.cpe.net.fido.ca.51098: Flags [P.], seq 3444432:3444628, ack 1981, win 501, length 196
05:49:25.594273 IP cpef81d0fadd1d3-cmf81d0fadd1d0.cpe.net.fido.ca.51098 > 138.197.139.105.ssh: Flags [.], ack 3430724, win 510, length 0
05:49:25.594273 IP cpef81d0fadd1d3-cmf81d0fadd1d0.cpe.net.fido.ca.51098 > 138.197.139.105.ssh: Flags [.], ack 3433296, win 513, length 0
05:49:25.594273 IP cpef81d0fadd1d3-cmf81d0fadd1d0.cpe.net.fido.ca.51098 > 138.197.139.105.ssh: Flags [.], ack 3436040, win 513, length 0
05:49:25.594538 IP 138.197.139.105.ssh > cpef81d0fadd1d3-cmf81d0fadd1d0.cpe.net.fido.ca.51098: Flags [P.], seq 3444628:3445240, ack 1981, win 501, length 612
05:49:25.594742 IP 138.197.139.105.ssh > cpef81d0fadd1d3-cmf81d0fadd1d0.cpe.net.fido.ca.51098: Flags [P.], seq 3445240:3445436, ack 1981, win 501, length 196
05:49:25.594932 IP 138.197.139.105.ssh > cpef81d0fadd1d3-cmf81d0fadd1d0.cpe.net.fido.ca.51098: Flags [P.], seq 3445436:3445632, ack 1981, win 501, length 196
05:49:25.595166 IP 138.197.139.105.ssh > cpef81d0fadd1d3-cmf81d0fadd1d0.cpe.net.fido.ca.51098: Flags [P.], seq 3445632:3445828, ack 1981, win 501, length 196
05:49:25.595388 IP 138.197.139.105.ssh > cpef81d0fadd1d3-cmf81d0fadd1d0.cpe.net.fido.ca.51098: Flags [P.], seq 3445828:3446024, ack 1981, win 501, length 196
05:49:25.595576 IP 138.197.139.105.ssh > cpef81d0fadd1d3-cmf81d0fadd1d0.cpe.net.fido.ca.51098: Flags [P.], seq 3446024:3446220, ack 1981, win 501, length 196
05:49:25.595770 IP 138.197.139.105.ssh > cpef81d0fadd1d3-cmf81d0fadd1d0.cpe.net.fido.ca.51098: Flags [P.], seq 3446220:3446416, ack 1981, win 501, length 196
05:49:25.595950 IP 138.197.139.105.ssh > cpef81d0fadd1d3-cmf81d0fadd1d0.cpe.net.fido.ca.51098: Flags [P.], seq 3446416:3446612, ack 1981, win 501, length 196
05:49:25.596138 IP 138.197.139.105.ssh > cpef81d0fadd1d3-cmf81d0fadd1d0.cpe.net.fido.ca.51098: Flags [P.], seq 3446612:3446808, ack 1981, win 501, length 196
05:49:25.596319 IP 138.197.139.105.ssh > cpef81d0fadd1d3-cmf81d0fadd1d0.cpe.net.fido.ca.51098: Flags [P.], seq 3446808:3447004, ack 1981, win 501, length 196
05:49:25.596513 IP 138.197.139.105.ssh > cpef81d0fadd1d3-cmf81d0fadd1d0.cpe.net.fido.ca.51098: Flags [P.], seq 3447004:3447200, ack 1981, win 501, length 196
05:49:25.596701 IP 138.197.139.105.ssh > cpef81d0fadd1d3-cmf81d0fadd1d0.cpe.net.fido.ca.51098: Flags [P.], seq 3447200:3447396, ack 1981, win 501, length 196
05:49:25.596884 IP 138.197.139.105.ssh > cpef81d0fadd1d3-cmf81d0fadd1d0.cpe.net.fido.ca.51098: Flags [P.], seq 3447396:3447592, ack 1981, win 501, length 196
05:49:25.597080 IP 138.197.139.105.ssh > cpef81d0fadd1d3-cmf81d0fadd1d0.cpe.net.fido.ca.51098: Flags [P.], seq 3447592:3447788, ack 1981, win 501, length 196
05:49:25.597270 IP 138.197.139.105.ssh > cpef81d0fadd1d3-cmf81d0fadd1d0.cpe.net.fido.ca.51098: Flags [P.], seq 3447788:3447984, ack 1981, win 501, length 196
05:49:25.597462 IP 138.197.139.105.ssh > cpef81d0fadd1d3-cmf81d0fadd1d0.cpe.net.fido.ca.51098: Flags [P.], seq 3447984:3448180, ack 1981, win 501, length 196
05:49:25.597645 IP 138.197.139.105.ssh > cpef81d0fadd1d3-cmf81d0fadd1d0.cpe.net.fido.ca.51098: Flags [P.], seq 3448180:3448376, ack 1981, win 501, length 196
05:49:25.597823 IP 138.197.139.105.ssh > cpef81d0fadd1d3-cmf81d0fadd1d0.cpe.net.fido.ca.51098: Flags [P.], seq 3448376:3448572, ack 1981, win 501, length 196
