00:39:37.836073 IP 138.197.139.105.ssh > cpef81d0fadd1d3-cmf81d0fadd1d0.cpe.net.fido.ca.64129: Flags [P.], seq 1567884:1568080, ack 901, win 501, length 196
00:39:37.836196 IP 138.197.139.105.ssh > cpef81d0fadd1d3-cmf81d0fadd1d0.cpe.net.fido.ca.64129: Flags [P.], seq 1568080:1568276, ack 901, win 501, length 196
00:39:37.836312 IP 138.197.139.105.ssh > cpef81d0fadd1d3-cmf81d0fadd1d0.cpe.net.fido.ca.64129: Flags [P.], seq 1568276:1568472, ack 901, win 501, length 196
00:39:37.836469 IP 138.197.139.105.ssh > cpef81d0fadd1d3-cmf81d0fadd1d0.cpe.net.fido.ca.64129: Flags [P.], seq 1568472:1568668, ack 901, win 501, length 196
00:39:37.836601 IP 138.197.139.105.ssh > cpef81d0fadd1d3-cmf81d0fadd1d0.cpe.net.fido.ca.64129: Flags [P.], seq 1568668:1568864, ack 901, win 501, length 196
00:39:37.836719 IP 138.197.139.105.ssh > cpef81d0fadd1d3-cmf81d0fadd1d0.cpe.net.fido.ca.64129: Flags [P.], seq 1568864:1569060, ack 901, win 501, length 196
00:39:37.836862 IP 138.197.139.105.ssh > cpef81d0fadd1d3-cmf81d0fadd1d0.cpe.net.fido.ca.64129: Flags [P.], seq 1569060:1569256, ack 901, win 501, length 196
00:39:37.836977 IP 138.197.139.105.ssh > cpef81d0fadd1d3-cmf81d0fadd1d0.cpe.net.fido.ca.64129: Flags [P.], seq 1569256:1569452, ack 901, win 501, length 196
00:39:37.837107 IP 138.197.139.105.ssh > cpef81d0fadd1d3-cmf81d0fadd1d0.cpe.net.fido.ca.64129: Flags [P.], seq 1569452:1569648, ack 901, win 501, length 196
00:39:37.837223 IP 138.197.139.105.ssh > cpef81d0fadd1d3-cmf81d0fadd1d0.cpe.net.fido.ca.64129: Flags [P.], seq 1569648:1569844, ack 901, win 501, length 196
00:39:37.837342 IP 138.197.139.105.ssh > cpef81d0fadd1d3-cmf81d0fadd1d0.cpe.net.fido.ca.64129: Flags [P.], seq 1569844:1570040, ack 901, win 501, length 196
00:39:37.837456 IP 138.197.139.105.ssh > cpef81d0fadd1d3-cmf81d0fadd1d0.cpe.net.fido.ca.64129: Flags [P.], seq 1570040:1570236, ack 901, win 501, length 196
00:39:37.837581 IP 138.197.139.105.ssh > cpef81d0fadd1d3-cmf81d0fadd1d0.cpe.net.fido.ca.64129: Flags [P.], seq 1570236:1570432, ack 901, win 501, length 196
00:39:37.837699 IP 138.197.139.105.ssh > cpef81d0fadd1d3-cmf81d0fadd1d0.cpe.net.fido.ca.64129: Flags [P.], seq 1570432:1570628, ack 901, win 501, length 196
00:39:37.837817 IP 138.197.139.105.ssh > cpef81d0fadd1d3-cmf81d0fadd1d0.cpe.net.fido.ca.64129: Flags [P.], seq 1570628:1570824, ack 901, win 501, length 196
00:39:37.837941 IP 138.197.139.105.ssh > cpef81d0fadd1d3-cmf81d0fadd1d0.cpe.net.fido.ca.64129: Flags [P.], seq 1570824:1571020, ack 901, win 501, length 196
00:39:37.837980 IP cpef81d0fadd1d3-cmf81d0fadd1d0.cpe.net.fido.ca.64129 > 138.197.139.105.ssh: Flags [.], ack 1554160, win 2731, length 0
00:39:37.838003 IP cpef81d0fadd1d3-cmf81d0fadd1d0.cpe.net.fido.ca.64129 > 138.197.139.105.ssh: Flags [.], ack 1556340, win 2731, length 0
00:39:37.838012 IP cpef81d0fadd1d3-cmf81d0fadd1d0.cpe.net.fido.ca.64129 > 138.197.139.105.ssh: Flags [.], ack 1560652, win 2731, length 0
00:39:37.838273 IP 138.197.139.105.ssh > cpef81d0fadd1d3-cmf81d0fadd1d0.cpe.net.fido.ca.64129: Flags [P.], seq 1571020:1571632, ack 901, win 501, length 612
00:39:37.838498 IP 138.197.139.105.ssh > cpef81d0fadd1d3-cmf81d0fadd1d0.cpe.net.fido.ca.64129: Flags [P.], seq 1571632:1571828, ack 901, win 501, length 196
00:39:37.838713 IP 138.197.139.105.ssh > cpef81d0fadd1d3-cmf81d0fadd1d0.cpe.net.fido.ca.64129: Flags [P.], seq 1571828:1572024, ack 901, win 501, length 196
00:39:37.838948 IP 138.197.139.105.ssh > cpef81d0fadd1d3-cmf81d0fadd1d0.cpe.net.fido.ca.64129: Flags [P.], seq 1572024:1572220, ack 901, win 501, length 196
00:39:37.839089 IP 138.197.139.105.ssh > cpef81d0fadd1d3-cmf81d0fadd1d0.cpe.net.fido.ca.64129: Flags [P.], seq 1572220:1572416, ack 901, win 501, length 196
00:39:37.839215 IP 138.197.139.105.ssh > cpef81d0fadd1d3-cmf81d0fadd1d0.cpe.net.fido.ca.64129: Flags [P.], seq 1572416:1572612, ack 901, win 501, length 196
00:39:37.839361 IP 138.197.139.105.ssh > cpef81d0fadd1d3-cmf81d0fadd1d0.cpe.net.fido.ca.64129: Flags [P.], seq 1572612:1572808, ack 901, win 501, length 196
00:39:37.839545 IP 138.197.139.105.ssh > cpef81d0fadd1d3-cmf81d0fadd1d0.cpe.net.fido.ca.64129: Flags [P.], seq 1572808:1573004, ack 901, win 501, length 196
00:39:37.839728 IP 138.197.139.105.ssh > cpef81d0fadd1d3-cmf81d0fadd1d0.cpe.net.fido.ca.64129: Flags [P.], seq 1573004:1573200, ack 901, win 501, length 196
00:39:37.839891 IP 138.197.139.105.ssh > cpef81d0fadd1d3-cmf81d0fadd1d0.cpe.net.fido.ca.64129: Flags [P.], seq 1573200:1573396, ack 901, win 501, length 196
00:39:37.840100 IP 138.197.139.105.ssh > cpef81d0fadd1d3-cmf81d0fadd1d0.cpe.net.fido.ca.64129: Flags [P.], seq 1573396:1573592, ack 901, win 501, length 196
00:39:37.840252 IP 138.197.139.105.ssh > cpef81d0fadd1d3-cmf81d0fadd1d0.cpe.net.fido.ca.64129: Flags [P.], seq 1573592:1573788, ack 901, win 501, length 196
00:39:37.840409 IP 138.197.139.105.ssh > cpef81d0fadd1d3-cmf81d0fadd1d0.cpe.net.fido.ca.64129: Flags [P.], seq 1573788:1573984, ack 901, win 501, length 196
00:39:37.840595 IP 138.197.139.105.ssh > cpef81d0fadd1d3-cmf81d0fadd1d0.cpe.net.fido.ca.64129: Flags [P.], seq 1573984:1574180, ack 901, win 501, length 196
00:39:37.840769 IP 138.197.139.105.ssh > cpef81d0fadd1d3-cmf81d0fadd1d0.cpe.net.fido.ca.64129: Flags [P.], seq 1574180:1574376, ack 901, win 501, length 196
00:39:37.840968 IP 138.197.139.105.ssh > cpef81d0fadd1d3-cmf81d0fadd1d0.cpe.net.fido.ca.64129: Flags [P.], seq 1574376:1574572, ack 901, win 501, length 196
00:39:37.841140 IP 138.197.139.105.ssh > cpef81d0fadd1d3-cmf81d0fadd1d0.cpe.net.fido.ca.64129: Flags [P.], seq 1574572:1574768, ack 901, win 501, length 196
00:39:37.841316 IP 138.197.139.105.ssh > cpef81d0fadd1d3-cmf81d0fadd1d0.cpe.net.fido.ca.64129: Flags [P.], seq 1574768:1574964, ack 901, win 501, length 196
00:39:37.841827 IP 138.197.139.105.ssh > cpef81d0fadd1d3-cmf81d0fadd1d0.cpe.net.fido.ca.64129: Flags [P.], seq 1574964:1575160, ack 901, win 501, length 196
00:39:37.841965 IP 138.197.139.105.ssh > cpef81d0fadd1d3-cmf81d0fadd1d0.cpe.net.fido.ca.64129: Flags [P.], seq 1575160:1575356, ack 901, win 501, length 196
00:39:37.842086 IP 138.197.139.105.ssh > cpef81d0fadd1d3-cmf81d0fadd1d0.cpe.net.fido.ca.64129: Flags [P.], seq 1575356:1575552, ack 901, win 501, length 196
00:39:37.842195 IP 138.197.139.105.ssh > cpef81d0fadd1d3-cmf81d0fadd1d0.cpe.net.fido.ca.64129: Flags [P.], seq 1575552:1575748, ack 901, win 501, length 196
00:39:37.842355 IP 138.197.139.105.ssh > cpef81d0fadd1d3-cmf81d0fadd1d0.cpe.net.fido.ca.64129: Flags [P.], seq 1575748:1575944, ack 901, win 501, length 196
00:39:37.842519 IP 138.197.139.105.ssh > cpef81d0fadd1d3-cmf81d0fadd1d0.cpe.net.fido.ca.64129: Flags [P.], seq 1575944:1576140, ack 901, win 501, length 196
00:39:37.842642 IP 138.197.139.105.ssh > cpef81d0fadd1d3-cmf81d0fadd1d0.cpe.net.fido.ca.64129: Flags [P.], seq 1576140:1576336, ack 901, win 501, length 196
00:39:37.842758 IP 138.197.139.105.ssh > cpef81d0fadd1d3-cmf81d0fadd1d0.cpe.net.fido.ca.64129: Flags [P.], seq 1576336:1576532, ack 901, win 501, length 196
00:39:37.842872 IP 138.197.139.105.ssh > cpef81d0fadd1d3-cmf81d0fadd1d0.cpe.net.fido.ca.64129: Flags [P.], seq 1576532:1576728, ack 901, win 501, length 196
00:39:37.842983 IP 138.197.139.105.ssh > cpef81d0fadd1d3-cmf81d0fadd1d0.cpe.net.fido.ca.64129: Flags [P.], seq 1576728:1576924, ack 901, win 501, length 196
00:39:37.843094 IP 138.197.139.105.ssh > cpef81d0fadd1d3-cmf81d0fadd1d0.cpe.net.fido.ca.64129: Flags [P.], seq 1576924:1577120, ack 901, win 501, length 196
00:39:37.843204 IP 138.197.139.105.ssh > cpef81d0fadd1d3-cmf81d0fadd1d0.cpe.net.fido.ca.64129: Flags [P.], seq 1577120:1577316, ack 901, win 501, length 196
00:39:37.843316 IP 138.197.139.105.ssh > cpef81d0fadd1d3-cmf81d0fadd1d0.cpe.net.fido.ca.64129: Flags [P.], seq 1577316:1577512, ack 901, win 501, length 196
00:39:37.843439 IP 138.197.139.105.ssh > cpef81d0fadd1d3-cmf81d0fadd1d0.cpe.net.fido.ca.64129: Flags [P.], seq 1577512:1577708, ack 901, win 501, length 196
00:39:37.843563 IP 138.197.139.105.ssh > cpef81d0fadd1d3-cmf81d0fadd1d0.cpe.net.fido.ca.64129: Flags [P.], seq 1577708:1577904, ack 901, win 501, length 196
00:39:37.843677 IP 138.197.139.105.ssh > cpef81d0fadd1d3-cmf81d0fadd1d0.cpe.net.fido.ca.64129: Flags [P.], seq 1577904:1578100, ack 901, win 501, length 196
00:39:37.843828 IP 138.197.139.105.ssh > cpef81d0fadd1d3-cmf81d0fadd1d0.cpe.net.fido.ca.64129: Flags [P.], seq 1578100:1578296, ack 901, win 501, length 196
00:39:37.843884 IP cpef81d0fadd1d3-cmf81d0fadd1d0.cpe.net.fido.ca.64129 > 138.197.139.105.ssh: Flags [.], ack 1563396, win 2731, length 0
00:39:37.843909 IP cpef81d0fadd1d3-cmf81d0fadd1d0.cpe.net.fido.ca.64129 > 138.197.139.105.ssh: Flags [.], ack 1565924, win 2731, length 0
00:39:37.843918 IP cpef81d0fadd1d3-cmf81d0fadd1d0.cpe.net.fido.ca.64129 > 138.197.139.105.ssh: Flags [P.], seq 901:937, ack 1565924, win 2731, length 36
^C
8237 packets captured
8237 packets received by filter
0 packets dropped by kernel
