00:31:09.367321 IP 138.197.139.105.ssh > cpef81d0fadd1d3-cmf81d0fadd1d0.cpe.net.fido.ca.64129: Flags [P.], seq 7918532:7918728, ack 4609, win 501, length 196
00:31:09.367401 IP 138.197.139.105.ssh > cpef81d0fadd1d3-cmf81d0fadd1d0.cpe.net.fido.ca.64129: Flags [P.], seq 7918728:7918924, ack 4609, win 501, length 196
00:31:09.367487 IP 138.197.139.105.ssh > cpef81d0fadd1d3-cmf81d0fadd1d0.cpe.net.fido.ca.64129: Flags [P.], seq 7918924:7919120, ack 4609, win 501, length 196
00:31:09.367567 IP 138.197.139.105.ssh > cpef81d0fadd1d3-cmf81d0fadd1d0.cpe.net.fido.ca.64129: Flags [P.], seq 7919120:7919316, ack 4609, win 501, length 196
00:31:09.367647 IP 138.197.139.105.ssh > cpef81d0fadd1d3-cmf81d0fadd1d0.cpe.net.fido.ca.64129: Flags [P.], seq 7919316:7919512, ack 4609, win 501, length 196
00:31:09.367728 IP 138.197.139.105.ssh > cpef81d0fadd1d3-cmf81d0fadd1d0.cpe.net.fido.ca.64129: Flags [P.], seq 7919512:7919708, ack 4609, win 501, length 196
00:31:09.367811 IP 138.197.139.105.ssh > cpef81d0fadd1d3-cmf81d0fadd1d0.cpe.net.fido.ca.64129: Flags [P.], seq 7919708:7919904, ack 4609, win 501, length 196
00:31:09.367897 IP 138.197.139.105.ssh > cpef81d0fadd1d3-cmf81d0fadd1d0.cpe.net.fido.ca.64129: Flags [P.], seq 7919904:7920100, ack 4609, win 501, length 196
00:31:09.368009 IP 138.197.139.105.ssh > cpef81d0fadd1d3-cmf81d0fadd1d0.cpe.net.fido.ca.64129: Flags [P.], seq 7920100:7920296, ack 4609, win 501, length 196
00:31:09.368115 IP 138.197.139.105.ssh > cpef81d0fadd1d3-cmf81d0fadd1d0.cpe.net.fido.ca.64129: Flags [P.], seq 7920296:7920492, ack 4609, win 501, length 196
00:31:09.368202 IP 138.197.139.105.ssh > cpef81d0fadd1d3-cmf81d0fadd1d0.cpe.net.fido.ca.64129: Flags [P.], seq 7920492:7920688, ack 4609, win 501, length 196
00:31:09.368289 IP 138.197.139.105.ssh > cpef81d0fadd1d3-cmf81d0fadd1d0.cpe.net.fido.ca.64129: Flags [P.], seq 7920688:7920884, ack 4609, win 501, length 196
00:31:09.368369 IP 138.197.139.105.ssh > cpef81d0fadd1d3-cmf81d0fadd1d0.cpe.net.fido.ca.64129: Flags [P.], seq 7920884:7921080, ack 4609, win 501, length 196
00:31:09.368450 IP 138.197.139.105.ssh > cpef81d0fadd1d3-cmf81d0fadd1d0.cpe.net.fido.ca.64129: Flags [P.], seq 7921080:7921276, ack 4609, win 501, length 196
00:31:09.368530 IP 138.197.139.105.ssh > cpef81d0fadd1d3-cmf81d0fadd1d0.cpe.net.fido.ca.64129: Flags [P.], seq 7921276:7921472, ack 4609, win 501, length 196
00:31:09.368614 IP 138.197.139.105.ssh > cpef81d0fadd1d3-cmf81d0fadd1d0.cpe.net.fido.ca.64129: Flags [P.], seq 7921472:7921668, ack 4609, win 501, length 196
00:31:09.368697 IP 138.197.139.105.ssh > cpef81d0fadd1d3-cmf81d0fadd1d0.cpe.net.fido.ca.64129: Flags [P.], seq 7921668:7921864, ack 4609, win 501, length 196
00:31:09.368778 IP 138.197.139.105.ssh > cpef81d0fadd1d3-cmf81d0fadd1d0.cpe.net.fido.ca.64129: Flags [P.], seq 7921864:7922060, ack 4609, win 501, length 196
00:31:09.368884 IP 138.197.139.105.ssh > cpef81d0fadd1d3-cmf81d0fadd1d0.cpe.net.fido.ca.64129: Flags [P.], seq 7922060:7922256, ack 4609, win 501, length 196
00:31:09.368968 IP 138.197.139.105.ssh > cpef81d0fadd1d3-cmf81d0fadd1d0.cpe.net.fido.ca.64129: Flags [P.], seq 7922256:7922452, ack 4609, win 501, length 196
00:31:09.369048 IP 138.197.139.105.ssh > cpef81d0fadd1d3-cmf81d0fadd1d0.cpe.net.fido.ca.64129: Flags [P.], seq 7922452:7922648, ack 4609, win 501, length 196
00:31:09.369134 IP 138.197.139.105.ssh > cpef81d0fadd1d3-cmf81d0fadd1d0.cpe.net.fido.ca.64129: Flags [P.], seq 7922648:7922844, ack 4609, win 501, length 196
00:31:09.369215 IP 138.197.139.105.ssh > cpef81d0fadd1d3-cmf81d0fadd1d0.cpe.net.fido.ca.64129: Flags [P.], seq 7922844:7923040, ack 4609, win 501, length 196
00:31:09.369296 IP 138.197.139.105.ssh > cpef81d0fadd1d3-cmf81d0fadd1d0.cpe.net.fido.ca.64129: Flags [P.], seq 7923040:7923236, ack 4609, win 501, length 196
00:31:09.369380 IP 138.197.139.105.ssh > cpef81d0fadd1d3-cmf81d0fadd1d0.cpe.net.fido.ca.64129: Flags [P.], seq 7923236:7923432, ack 4609, win 501, length 196
00:31:09.369460 IP 138.197.139.105.ssh > cpef81d0fadd1d3-cmf81d0fadd1d0.cpe.net.fido.ca.64129: Flags [P.], seq 7923432:7923628, ack 4609, win 501, length 196
00:31:09.369540 IP 138.197.139.105.ssh > cpef81d0fadd1d3-cmf81d0fadd1d0.cpe.net.fido.ca.64129: Flags [P.], seq 7923628:7923824, ack 4609, win 501, length 196
00:31:09.369626 IP 138.197.139.105.ssh > cpef81d0fadd1d3-cmf81d0fadd1d0.cpe.net.fido.ca.64129: Flags [P.], seq 7923824:7924020, ack 4609, win 501, length 196
00:31:09.369707 IP 138.197.139.105.ssh > cpef81d0fadd1d3-cmf81d0fadd1d0.cpe.net.fido.ca.64129: Flags [P.], seq 7924020:7924216, ack 4609, win 501, length 196
00:31:09.369792 IP 138.197.139.105.ssh > cpef81d0fadd1d3-cmf81d0fadd1d0.cpe.net.fido.ca.64129: Flags [P.], seq 7924216:7924412, ack 4609, win 501, length 196
00:31:09.369873 IP 138.197.139.105.ssh > cpef81d0fadd1d3-cmf81d0fadd1d0.cpe.net.fido.ca.64129: Flags [P.], seq 7924412:7924608, ack 4609, win 501, length 196
00:31:09.369953 IP 138.197.139.105.ssh > cpef81d0fadd1d3-cmf81d0fadd1d0.cpe.net.fido.ca.64129: Flags [P.], seq 7924608:7924804, ack 4609, win 501, length 196
00:31:09.370038 IP 138.197.139.105.ssh > cpef81d0fadd1d3-cmf81d0fadd1d0.cpe.net.fido.ca.64129: Flags [P.], seq 7924804:7925000, ack 4609, win 501, length 196
00:31:09.370118 IP 138.197.139.105.ssh > cpef81d0fadd1d3-cmf81d0fadd1d0.cpe.net.fido.ca.64129: Flags [P.], seq 7925000:7925196, ack 4609, win 501, length 196
00:31:09.370204 IP 138.197.139.105.ssh > cpef81d0fadd1d3-cmf81d0fadd1d0.cpe.net.fido.ca.64129: Flags [P.], seq 7925196:7925392, ack 4609, win 501, length 196
00:31:09.370305 IP 138.197.139.105.ssh > cpef81d0fadd1d3-cmf81d0fadd1d0.cpe.net.fido.ca.64129: Flags [P.], seq 7925392:7925588, ack 4609, win 501, length 196
00:31:09.370350 IP cpef81d0fadd1d3-cmf81d0fadd1d0.cpe.net.fido.ca.64129 > 138.197.139.105.ssh: Flags [.], ack 7900672, win 513, length 0
00:31:09.370379 IP cpef81d0fadd1d3-cmf81d0fadd1d0.cpe.net.fido.ca.64129 > 138.197.139.105.ssh: Flags [.], ack 7905376, win 513, length 0
00:31:09.370395 IP cpef81d0fadd1d3-cmf81d0fadd1d0.cpe.net.fido.ca.64129 > 138.197.139.105.ssh: Flags [.], ack 7910080, win 513, length 0
00:31:09.370505 IP 138.197.139.105.ssh > cpef81d0fadd1d3-cmf81d0fadd1d0.cpe.net.fido.ca.64129: Flags [P.], seq 7925588:7926200, ack 4609, win 501, length 612
00:31:09.370596 IP 138.197.139.105.ssh > cpef81d0fadd1d3-cmf81d0fadd1d0.cpe.net.fido.ca.64129: Flags [P.], seq 7926200:7926396, ack 4609, win 501, length 196
00:31:09.370681 IP 138.197.139.105.ssh > cpef81d0fadd1d3-cmf81d0fadd1d0.cpe.net.fido.ca.64129: Flags [P.], seq 7926396:7926592, ack 4609, win 501, length 196
00:31:09.370767 IP 138.197.139.105.ssh > cpef81d0fadd1d3-cmf81d0fadd1d0.cpe.net.fido.ca.64129: Flags [P.], seq 7926592:7926788, ack 4609, win 501, length 196
00:31:09.370855 IP 138.197.139.105.ssh > cpef81d0fadd1d3-cmf81d0fadd1d0.cpe.net.fido.ca.64129: Flags [P.], seq 7926788:7926984, ack 4609, win 501, length 196
00:31:09.370941 IP 138.197.139.105.ssh > cpef81d0fadd1d3-cmf81d0fadd1d0.cpe.net.fido.ca.64129: Flags [P.], seq 7926984:7927180, ack 4609, win 501, length 196
00:31:09.371025 IP 138.197.139.105.ssh > cpef81d0fadd1d3-cmf81d0fadd1d0.cpe.net.fido.ca.64129: Flags [P.], seq 7927180:7927376, ack 4609, win 501, length 196
00:31:09.371106 IP 138.197.139.105.ssh > cpef81d0fadd1d3-cmf81d0fadd1d0.cpe.net.fido.ca.64129: Flags [P.], seq 7927376:7927572, ack 4609, win 501, length 196
00:31:09.371187 IP 138.197.139.105.ssh > cpef81d0fadd1d3-cmf81d0fadd1d0.cpe.net.fido.ca.64129: Flags [P.], seq 7927572:7927768, ack 4609, win 501, length 196
00:31:09.371270 IP 138.197.139.105.ssh > cpef81d0fadd1d3-cmf81d0fadd1d0.cpe.net.fido.ca.64129: Flags [P.], seq 7927768:7927964, ack 4609, win 501, length 196
00:31:09.371352 IP 138.197.139.105.ssh > cpef81d0fadd1d3-cmf81d0fadd1d0.cpe.net.fido.ca.64129: Flags [P.], seq 7927964:7928160, ack 4609, win 501, length 196
00:31:09.371433 IP 138.197.139.105.ssh > cpef81d0fadd1d3-cmf81d0fadd1d0.cpe.net.fido.ca.64129: Flags [P.], seq 7928160:7928356, ack 4609, win 501, length 196
00:31:09.371514 IP 138.197.139.105.ssh > cpef81d0fadd1d3-cmf81d0fadd1d0.cpe.net.fido.ca.64129: Flags [P.], seq 7928356:7928552, ack 4609, win 501, length 196
00:31:09.371599 IP 138.197.139.105.ssh > cpef81d0fadd1d3-cmf81d0fadd1d0.cpe.net.fido.ca.64129: Flags [P.], seq 7928552:7928748, ack 4609, win 501, length 196
00:31:09.371678 IP 138.197.139.105.ssh > cpef81d0fadd1d3-cmf81d0fadd1d0.cpe.net.fido.ca.64129: Flags [P.], seq 7928748:7928944, ack 4609, win 501, length 196
00:31:09.371760 IP 138.197.139.105.ssh > cpef81d0fadd1d3-cmf81d0fadd1d0.cpe.net.fido.ca.64129: Flags [P.], seq 7928944:7929140, ack 4609, win 501, length 196
00:31:09.371845 IP 138.197.139.105.ssh > cpef81d0fadd1d3-cmf81d0fadd1d0.cpe.net.fido.ca.64129: Flags [P.], seq 7929140:7929336, ack 4609, win 501, length 196
00:31:09.371945 IP 138.197.139.105.ssh > cpef81d0fadd1d3-cmf81d0fadd1d0.cpe.net.fido.ca.64129: Flags [P.], seq 7929336:7929532, ack 4609, win 501, length 196
00:31:09.372051 IP 138.197.139.105.ssh > cpef81d0fadd1d3-cmf81d0fadd1d0.cpe.net.fido.ca.64129: Flags [P.], seq 7929532:7929728, ack 4609, win 501, length 196
00:31:09.372136 IP 138.197.139.105.ssh > cpef81d0fadd1d3-cmf81d0fadd1d0.cpe.net.fido.ca.64129: Flags [P.], seq 7929728:7929924, ack 4609, win 501, length 196
00:31:09.372224 IP 138.197.139.105.ssh > cpef81d0fadd1d3-cmf81d0fadd1d0.cpe.net.fido.ca.64129: Flags [P.], seq 7929924:7930120, ack 4609, win 501, length 196
00:31:09.372335 IP 138.197.139.105.ssh > cpef81d0fadd1d3-cmf81d0fadd1d0.cpe.net.fido.ca.64129: Flags [P.], seq 7930120:7930316, ack 4609, win 501, length 196
00:31:09.372540 IP 138.197.139.105.ssh > cpef81d0fadd1d3-cmf81d0fadd1d0.cpe.net.fido.ca.64129: Flags [P.], seq 7930316:7930512, ack 4609, win 501, length 196
00:31:09.372639 IP 138.197.139.105.ssh > cpef81d0fadd1d3-cmf81d0fadd1d0.cpe.net.fido.ca.64129: Flags [P.], seq 7930512:7930708, ack 4609, win 501, length 196
00:31:09.372729 IP 138.197.139.105.ssh > cpef81d0fadd1d3-cmf81d0fadd1d0.cpe.net.fido.ca.64129: Flags [P.], seq 7930708:7930904, ack 4609, win 501, length 196
00:31:09.372813 IP 138.197.139.105.ssh > cpef81d0fadd1d3-cmf81d0fadd1d0.cpe.net.fido.ca.64129: Flags [P.], seq 7930904:7931100, ack 4609, win 501, length 196
00:31:09.372912 IP 138.197.139.105.ssh > cpef81d0fadd1d3-cmf81d0fadd1d0.cpe.net.fido.ca.64129: Flags [P.], seq 7931100:7931296, ack 4609, win 501, length 196
00:31:09.372995 IP 138.197.139.105.ssh > cpef81d0fadd1d3-cmf81d0fadd1d0.cpe.net.fido.ca.64129: Flags [P.], seq 7931296:7931492, ack 4609, win 501, length 196
00:31:09.373077 IP 138.197.139.105.ssh > cpef81d0fadd1d3-cmf81d0fadd1d0.cpe.net.fido.ca.64129: Flags [P.], seq 7931492:7931688, ack 4609, win 501, length 196
00:31:09.373161 IP 138.197.139.105.ssh > cpef81d0fadd1d3-cmf81d0fadd1d0.cpe.net.fido.ca.64129: Flags [P.], seq 7931688:7931884, ack 4609, win 501, length 196
00:31:09.373241 IP 138.197.139.105.ssh > cpef81d0fadd1d3-cmf81d0fadd1d0.cpe.net.fido.ca.64129: Flags [P.], seq 7931884:7932080, ack 4609, win 501, length 196
00:31:09.373346 IP 138.197.139.105.ssh > cpef81d0fadd1d3-cmf81d0fadd1d0.cpe.net.fido.ca.64129: Flags [P.], seq 7932080:7932276, ack 4609, win 501, length 196
00:31:09.373463 IP 138.197.139.105.ssh > cpef81d0fadd1d3-cmf81d0fadd1d0.cpe.net.fido.ca.64129: Flags [P.], seq 7932276:7932472, ack 4609, win 501, length 196
00:31:09.373555 IP 138.197.139.105.ssh > cpef81d0fadd1d3-cmf81d0fadd1d0.cpe.net.fido.ca.64129: Flags [P.], seq 7932472:7932668, ack 4609, win 501, length 196
00:31:09.373639 IP 138.197.139.105.ssh > cpef81d0fadd1d3-cmf81d0fadd1d0.cpe.net.fido.ca.64129: Flags [P.], seq 7932668:7932864, ack 4609, win 501, length 196
00:31:09.373740 IP 138.197.139.105.ssh > cpef81d0fadd1d3-cmf81d0fadd1d0.cpe.net.fido.ca.64129: Flags [P.], seq 7932864:7933060, ack 4609, win 501, length 196
00:31:09.373841 IP 138.197.139.105.ssh > cpef81d0fadd1d3-cmf81d0fadd1d0.cpe.net.fido.ca.64129: Flags [P.], seq 7933060:7933256, ack 4609, win 501, length 196
00:31:09.373929 IP 138.197.139.105.ssh > cpef81d0fadd1d3-cmf81d0fadd1d0.cpe.net.fido.ca.64129: Flags [P.], seq 7933256:7933452, ack 4609, win 501, length 196
00:31:09.374028 IP 138.197.139.105.ssh > cpef81d0fadd1d3-cmf81d0fadd1d0.cpe.net.fido.ca.64129: Flags [P.], seq 7933452:7933648, ack 4609, win 501, length 196
00:31:09.374135 IP 138.197.139.105.ssh > cpef81d0fadd1d3-cmf81d0fadd1d0.cpe.net.fido.ca.64129: Flags [P.], seq 7933648:7933844, ack 4609, win 501, length 196
00:31:09.374250 IP 138.197.139.105.ssh > cpef81d0fadd1d3-cmf81d0fadd1d0.cpe.net.fido.ca.64129: Flags [P.], seq 7933844:7934040, ack 4609, win 501, length 196
00:31:09.374358 IP 138.197.139.105.ssh > cpef81d0fadd1d3-cmf81d0fadd1d0.cpe.net.fido.ca.64129: Flags [P.], seq 7934040:7934236, ack 4609, win 501, length 196
00:31:09.374459 IP 138.197.139.105.ssh > cpef81d0fadd1d3-cmf81d0fadd1d0.cpe.net.fido.ca.64129: Flags [P.], seq 7934236:7934432, ack 4609, win 501, length 196
00:31:09.374587 IP 138.197.139.105.ssh > cpef81d0fadd1d3-cmf81d0fadd1d0.cpe.net.fido.ca.64129: Flags [P.], seq 7934432:7934628, ack 4609, win 501, length 196
00:31:09.374721 IP 138.197.139.105.ssh > cpef81d0fadd1d3-cmf81d0fadd1d0.cpe.net.fido.ca.64129: Flags [P.], seq 7934628:7934824, ack 4609, win 501, length 196
00:31:09.374824 IP 138.197.139.105.ssh > cpef81d0fadd1d3-cmf81d0fadd1d0.cpe.net.fido.ca.64129: Flags [P.], seq 7934824:7935020, ack 4609, win 501, length 196
00:31:09.374917 IP 138.197.139.105.ssh > cpef81d0fadd1d3-cmf81d0fadd1d0.cpe.net.fido.ca.64129: Flags [P.], seq 7935020:7935216, ack 4609, win 501, length 196
00:31:09.374999 IP 138.197.139.105.ssh > cpef81d0fadd1d3-cmf81d0fadd1d0.cpe.net.fido.ca.64129: Flags [P.], seq 7935216:7935412, ack 4609, win 501, length 196
00:31:09.375080 IP 138.197.139.105.ssh > cpef81d0fadd1d3-cmf81d0fadd1d0.cpe.net.fido.ca.64129: Flags [P.], seq 7935412:7935608, ack 4609, win 501, length 196
00:31:09.375161 IP 138.197.139.105.ssh > cpef81d0fadd1d3-cmf81d0fadd1d0.cpe.net.fido.ca.64129: Flags [P.], seq 7935608:7935804, ack 4609, win 501, length 196
00:31:09.375275 IP 138.197.139.105.ssh > cpef81d0fadd1d3-cmf81d0fadd1d0.cpe.net.fido.ca.64129: Flags [P.], seq 7935804:7936000, ack 4609, win 501, length 196
00:31:09.375414 IP 138.197.139.105.ssh > cpef81d0fadd1d3-cmf81d0fadd1d0.cpe.net.fido.ca.64129: Flags [P.], seq 7936000:7936196, ack 4609, win 501, length 196
00:31:09.375512 IP 138.197.139.105.ssh > cpef81d0fadd1d3-cmf81d0fadd1d0.cpe.net.fido.ca.64129: Flags [P.], seq 7936196:7936392, ack 4609, win 501, length 196
00:31:09.375597 IP 138.197.139.105.ssh > cpef81d0fadd1d3-cmf81d0fadd1d0.cpe.net.fido.ca.64129: Flags [P.], seq 7936392:7936588, ack 4609, win 501, length 196
00:31:09.375684 IP 138.197.139.105.ssh > cpef81d0fadd1d3-cmf81d0fadd1d0.cpe.net.fido.ca.64129: Flags [P.], seq 7936588:7936784, ack 4609, win 501, length 196
00:31:09.375766 IP 138.197.139.105.ssh > cpef81d0fadd1d3-cmf81d0fadd1d0.cpe.net.fido.ca.64129: Flags [P.], seq 7936784:7936980, ack 4609, win 501, length 196
00:31:09.375846 IP 138.197.139.105.ssh > cpef81d0fadd1d3-cmf81d0fadd1d0.cpe.net.fido.ca.64129: Flags [P.], seq 7936980:7937176, ack 4609, win 501, length 196
00:31:09.375931 IP 138.197.139.105.ssh > cpef81d0fadd1d3-cmf81d0fadd1d0.cpe.net.fido.ca.64129: Flags [P.], seq 7937176:7937372, ack 4609, win 501, length 196
00:31:09.376023 IP 138.197.139.105.ssh > cpef81d0fadd1d3-cmf81d0fadd1d0.cpe.net.fido.ca.64129: Flags [P.], seq 7937372:7937568, ack 4609, win 501, length 196
00:31:09.376134 IP 138.197.139.105.ssh > cpef81d0fadd1d3-cmf81d0fadd1d0.cpe.net.fido.ca.64129: Flags [P.], seq 7937568:7937764, ack 4609, win 501, length 196
00:31:09.376226 IP 138.197.139.105.ssh > cpef81d0fadd1d3-cmf81d0fadd1d0.cpe.net.fido.ca.64129: Flags [P.], seq 7937764:7937960, ack 4609, win 501, length 196
00:31:09.376310 IP 138.197.139.105.ssh > cpef81d0fadd1d3-cmf81d0fadd1d0.cpe.net.fido.ca.64129: Flags [P.], seq 7937960:7938156, ack 4609, win 501, length 196
00:31:09.376405 IP 138.197.139.105.ssh > cpef81d0fadd1d3-cmf81d0fadd1d0.cpe.net.fido.ca.64129: Flags [P.], seq 7938156:7938352, ack 4609, win 501, length 196
00:31:09.376499 IP 138.197.139.105.ssh > cpef81d0fadd1d3-cmf81d0fadd1d0.cpe.net.fido.ca.64129: Flags [P.], seq 7938352:7938548, ack 4609, win 501, length 196
00:31:09.376582 IP 138.197.139.105.ssh > cpef81d0fadd1d3-cmf81d0fadd1d0.cpe.net.fido.ca.64129: Flags [P.], seq 7938548:7938744, ack 4609, win 501, length 196
00:31:09.376667 IP 138.197.139.105.ssh > cpef81d0fadd1d3-cmf81d0fadd1d0.cpe.net.fido.ca.64129: Flags [P.], seq 7938744:7938940, ack 4609, win 501, length 196
00:31:09.376749 IP 138.197.139.105.ssh > cpef81d0fadd1d3-cmf81d0fadd1d0.cpe.net.fido.ca.64129: Flags [P.], seq 7938940:7939136, ack 4609, win 501, length 196
00:31:09.376856 IP 138.197.139.105.ssh > cpef81d0fadd1d3-cmf81d0fadd1d0.cpe.net.fido.ca.64129: Flags [P.], seq 7939136:7939332, ack 4609, win 501, length 196
00:31:09.376954 IP 138.197.139.105.ssh > cpef81d0fadd1d3-cmf81d0fadd1d0.cpe.net.fido.ca.64129: Flags [P.], seq 7939332:7939528, ack 4609, win 501, length 196
00:31:09.377044 IP 138.197.139.105.ssh > cpef81d0fadd1d3-cmf81d0fadd1d0.cpe.net.fido.ca.64129: Flags [P.], seq 7939528:7939724, ack 4609, win 501, length 196
00:31:09.377124 IP 138.197.139.105.ssh > cpef81d0fadd1d3-cmf81d0fadd1d0.cpe.net.fido.ca.64129: Flags [P.], seq 7939724:7939920, ack 4609, win 501, length 196
00:31:09.377207 IP 138.197.139.105.ssh > cpef81d0fadd1d3-cmf81d0fadd1d0.cpe.net.fido.ca.64129: Flags [P.], seq 7939920:7940116, ack 4609, win 501, length 196
00:31:09.377293 IP 138.197.139.105.ssh > cpef81d0fadd1d3-cmf81d0fadd1d0.cpe.net.fido.ca.64129: Flags [P.], seq 7940116:7940312, ack 4609, win 501, length 196
00:31:09.377378 IP 138.197.139.105.ssh > cpef81d0fadd1d3-cmf81d0fadd1d0.cpe.net.fido.ca.64129: Flags [P.], seq 7940312:7940508, ack 4609, win 501, length 196
00:31:09.377458 IP 138.197.139.105.ssh > cpef81d0fadd1d3-cmf81d0fadd1d0.cpe.net.fido.ca.64129: Flags [P.], seq 7940508:7940704, ack 4609, win 501, length 196
00:31:09.377543 IP 138.197.139.105.ssh > cpef81d0fadd1d3-cmf81d0fadd1d0.cpe.net.fido.ca.64129: Flags [P.], seq 7940704:7940900, ack 4609, win 501, length 196
00:31:09.377624 IP 138.197.139.105.ssh > cpef81d0fadd1d3-cmf81d0fadd1d0.cpe.net.fido.ca.64129: Flags [P.], seq 7940900:7941096, ack 4609, win 501, length 196
00:31:09.377705 IP 138.197.139.105.ssh > cpef81d0fadd1d3-cmf81d0fadd1d0.cpe.net.fido.ca.64129: Flags [P.], seq 7941096:7941292, ack 4609, win 501, length 196
00:31:09.377803 IP 138.197.139.105.ssh > cpef81d0fadd1d3-cmf81d0fadd1d0.cpe.net.fido.ca.64129: Flags [P.], seq 7941292:7941488, ack 4609, win 501, length 196
00:31:09.377853 IP cpef81d0fadd1d3-cmf81d0fadd1d0.cpe.net.fido.ca.64129 > 138.197.139.105.ssh: Flags [.], ack 7915004, win 513, length 0
00:31:09.377890 IP cpef81d0fadd1d3-cmf81d0fadd1d0.cpe.net.fido.ca.64129 > 138.197.139.105.ssh: Flags [.], ack 7920688, win 513, length 0
00:31:09.377912 IP cpef81d0fadd1d3-cmf81d0fadd1d0.cpe.net.fido.ca.64129 > 138.197.139.105.ssh: Flags [P.], seq 4609:4645, ack 7920688, win 513, length 36
00:31:09.378028 IP 138.197.139.105.ssh > cpef81d0fadd1d3-cmf81d0fadd1d0.cpe.net.fido.ca.64129: Flags [P.], seq 7941488:7942116, ack 4645, win 501, length 628
00:31:09.378121 IP 138.197.139.105.ssh > cpef81d0fadd1d3-cmf81d0fadd1d0.cpe.net.fido.ca.64129: Flags [P.], seq 7942116:7942312, ack 4645, win 501, length 196
00:31:09.378211 IP 138.197.139.105.ssh > cpef81d0fadd1d3-cmf81d0fadd1d0.cpe.net.fido.ca.64129: Flags [P.], seq 7942312:7942508, ack 4645, win 501, length 196
00:31:09.378311 IP 138.197.139.105.ssh > cpef81d0fadd1d3-cmf81d0fadd1d0.cpe.net.fido.ca.64129: Flags [P.], seq 7942508:7942704, ack 4645, win 501, length 196
00:31:09.378401 IP 138.197.139.105.ssh > cpef81d0fadd1d3-cmf81d0fadd1d0.cpe.net.fido.ca.64129: Flags [P.], seq 7942704:7942900, ack 4645, win 501, length 196
00:31:09.378487 IP 138.197.139.105.ssh > cpef81d0fadd1d3-cmf81d0fadd1d0.cpe.net.fido.ca.64129: Flags [P.], seq 7942900:7943096, ack 4645, win 501, length 196
00:31:09.378568 IP 138.197.139.105.ssh > cpef81d0fadd1d3-cmf81d0fadd1d0.cpe.net.fido.ca.64129: Flags [P.], seq 7943096:7943292, ack 4645, win 501, length 196
00:31:09.378655 IP 138.197.139.105.ssh > cpef81d0fadd1d3-cmf81d0fadd1d0.cpe.net.fido.ca.64129: Flags [P.], seq 7943292:7943488, ack 4645, win 501, length 196
00:31:09.378736 IP 138.197.139.105.ssh > cpef81d0fadd1d3-cmf81d0fadd1d0.cpe.net.fido.ca.64129: Flags [P.], seq 7943488:7943684, ack 4645, win 501, length 196
00:31:09.378824 IP 138.197.139.105.ssh > cpef81d0fadd1d3-cmf81d0fadd1d0.cpe.net.fido.ca.64129: Flags [P.], seq 7943684:7943880, ack 4645, win 501, length 196
00:31:09.378907 IP 138.197.139.105.ssh > cpef81d0fadd1d3-cmf81d0fadd1d0.cpe.net.fido.ca.64129: Flags [P.], seq 7943880:7944076, ack 4645, win 501, length 196
00:31:09.379005 IP 138.197.139.105.ssh > cpef81d0fadd1d3-cmf81d0fadd1d0.cpe.net.fido.ca.64129: Flags [P.], seq 7944076:7944272, ack 4645, win 501, length 196
00:31:09.379096 IP 138.197.139.105.ssh > cpef81d0fadd1d3-cmf81d0fadd1d0.cpe.net.fido.ca.64129: Flags [P.], seq 7944272:7944468, ack 4645, win 501, length 196
00:31:09.379177 IP 138.197.139.105.ssh > cpef81d0fadd1d3-cmf81d0fadd1d0.cpe.net.fido.ca.64129: Flags [P.], seq 7944468:7944664, ack 4645, win 501, length 196
00:31:09.379267 IP 138.197.139.105.ssh > cpef81d0fadd1d3-cmf81d0fadd1d0.cpe.net.fido.ca.64129: Flags [P.], seq 7944664:7944860, ack 4645, win 501, length 196
00:31:09.379361 IP 138.197.139.105.ssh > cpef81d0fadd1d3-cmf81d0fadd1d0.cpe.net.fido.ca.64129: Flags [P.], seq 7944860:7945056, ack 4645, win 501, length 196
00:31:09.379447 IP 138.197.139.105.ssh > cpef81d0fadd1d3-cmf81d0fadd1d0.cpe.net.fido.ca.64129: Flags [P.], seq 7945056:7945252, ack 4645, win 501, length 196
00:31:09.379529 IP 138.197.139.105.ssh > cpef81d0fadd1d3-cmf81d0fadd1d0.cpe.net.fido.ca.64129: Flags [P.], seq 7945252:7945448, ack 4645, win 501, length 196
00:31:09.379611 IP 138.197.139.105.ssh > cpef81d0fadd1d3-cmf81d0fadd1d0.cpe.net.fido.ca.64129: Flags [P.], seq 7945448:7945644, ack 4645, win 501, length 196
00:31:09.379699 IP 138.197.139.105.ssh > cpef81d0fadd1d3-cmf81d0fadd1d0.cpe.net.fido.ca.64129: Flags [P.], seq 7945644:7945840, ack 4645, win 501, length 196
00:31:09.379780 IP 138.197.139.105.ssh > cpef81d0fadd1d3-cmf81d0fadd1d0.cpe.net.fido.ca.64129: Flags [P.], seq 7945840:7946036, ack 4645, win 501, length 196
00:31:09.379862 IP 138.197.139.105.ssh > cpef81d0fadd1d3-cmf81d0fadd1d0.cpe.net.fido.ca.64129: Flags [P.], seq 7946036:7946232, ack 4645, win 501, length 196
00:31:09.379948 IP 138.197.139.105.ssh > cpef81d0fadd1d3-cmf81d0fadd1d0.cpe.net.fido.ca.64129: Flags [P.], seq 7946232:7946428, ack 4645, win 501, length 196
00:31:09.380043 IP 138.197.139.105.ssh > cpef81d0fadd1d3-cmf81d0fadd1d0.cpe.net.fido.ca.64129: Flags [P.], seq 7946428:7946624, ack 4645, win 501, length 196
00:31:09.380130 IP 138.197.139.105.ssh > cpef81d0fadd1d3-cmf81d0fadd1d0.cpe.net.fido.ca.64129: Flags [P.], seq 7946624:7946820, ack 4645, win 501, length 196
00:31:09.380217 IP 138.197.139.105.ssh > cpef81d0fadd1d3-cmf81d0fadd1d0.cpe.net.fido.ca.64129: Flags [P.], seq 7946820:7947016, ack 4645, win 501, length 196
00:31:09.380301 IP 138.197.139.105.ssh > cpef81d0fadd1d3-cmf81d0fadd1d0.cpe.net.fido.ca.64129: Flags [P.], seq 7947016:7947212, ack 4645, win 501, length 196
00:31:09.380409 IP 138.197.139.105.ssh > cpef81d0fadd1d3-cmf81d0fadd1d0.cpe.net.fido.ca.64129: Flags [P.], seq 7947212:7947408, ack 4645, win 501, length 196
00:31:09.380496 IP 138.197.139.105.ssh > cpef81d0fadd1d3-cmf81d0fadd1d0.cpe.net.fido.ca.64129: Flags [P.], seq 7947408:7947604, ack 4645, win 501, length 196
00:31:09.380584 IP 138.197.139.105.ssh > cpef81d0fadd1d3-cmf81d0fadd1d0.cpe.net.fido.ca.64129: Flags [P.], seq 7947604:7947800, ack 4645, win 501, length 196
00:31:09.380662 IP 138.197.139.105.ssh > cpef81d0fadd1d3-cmf81d0fadd1d0.cpe.net.fido.ca.64129: Flags [P.], seq 7947800:7947996, ack 4645, win 501, length 196
00:31:09.380744 IP 138.197.139.105.ssh > cpef81d0fadd1d3-cmf81d0fadd1d0.cpe.net.fido.ca.64129: Flags [P.], seq 7947996:7948192, ack 4645, win 501, length 196
00:31:09.380826 IP 138.197.139.105.ssh > cpef81d0fadd1d3-cmf81d0fadd1d0.cpe.net.fido.ca.64129: Flags [P.], seq 7948192:7948388, ack 4645, win 501, length 196
00:31:09.380935 IP 138.197.139.105.ssh > cpef81d0fadd1d3-cmf81d0fadd1d0.cpe.net.fido.ca.64129: Flags [P.], seq 7948388:7948584, ack 4645, win 501, length 196
00:31:09.381017 IP 138.197.139.105.ssh > cpef81d0fadd1d3-cmf81d0fadd1d0.cpe.net.fido.ca.64129: Flags [P.], seq 7948584:7948780, ack 4645, win 501, length 196
00:31:09.381099 IP 138.197.139.105.ssh > cpef81d0fadd1d3-cmf81d0fadd1d0.cpe.net.fido.ca.64129: Flags [P.], seq 7948780:7948976, ack 4645, win 501, length 196
00:31:09.381181 IP 138.197.139.105.ssh > cpef81d0fadd1d3-cmf81d0fadd1d0.cpe.net.fido.ca.64129: Flags [P.], seq 7948976:7949172, ack 4645, win 501, length 196
00:31:09.381258 IP 138.197.139.105.ssh > cpef81d0fadd1d3-cmf81d0fadd1d0.cpe.net.fido.ca.64129: Flags [P.], seq 7949172:7949368, ack 4645, win 501, length 196
00:31:09.381391 IP 138.197.139.105.ssh > cpef81d0fadd1d3-cmf81d0fadd1d0.cpe.net.fido.ca.64129: Flags [P.], seq 7949368:7949564, ack 4645, win 501, length 196
00:31:09.381518 IP 138.197.139.105.ssh > cpef81d0fadd1d3-cmf81d0fadd1d0.cpe.net.fido.ca.64129: Flags [P.], seq 7949564:7949760, ack 4645, win 501, length 196
00:31:09.381637 IP 138.197.139.105.ssh > cpef81d0fadd1d3-cmf81d0fadd1d0.cpe.net.fido.ca.64129: Flags [P.], seq 7949760:7949956, ack 4645, win 501, length 196
00:31:09.381738 IP 138.197.139.105.ssh > cpef81d0fadd1d3-cmf81d0fadd1d0.cpe.net.fido.ca.64129: Flags [P.], seq 7949956:7950152, ack 4645, win 501, length 196
00:31:09.381842 IP 138.197.139.105.ssh > cpef81d0fadd1d3-cmf81d0fadd1d0.cpe.net.fido.ca.64129: Flags [P.], seq 7950152:7950348, ack 4645, win 501, length 196
00:31:09.381936 IP 138.197.139.105.ssh > cpef81d0fadd1d3-cmf81d0fadd1d0.cpe.net.fido.ca.64129: Flags [P.], seq 7950348:7950544, ack 4645, win 501, length 196
00:31:09.382045 IP 138.197.139.105.ssh > cpef81d0fadd1d3-cmf81d0fadd1d0.cpe.net.fido.ca.64129: Flags [P.], seq 7950544:7950740, ack 4645, win 501, length 196
00:31:09.382142 IP 138.197.139.105.ssh > cpef81d0fadd1d3-cmf81d0fadd1d0.cpe.net.fido.ca.64129: Flags [P.], seq 7950740:7950936, ack 4645, win 501, length 196
00:31:09.382257 IP 138.197.139.105.ssh > cpef81d0fadd1d3-cmf81d0fadd1d0.cpe.net.fido.ca.64129: Flags [P.], seq 7950936:7951132, ack 4645, win 501, length 196
00:31:09.382368 IP 138.197.139.105.ssh > cpef81d0fadd1d3-cmf81d0fadd1d0.cpe.net.fido.ca.64129: Flags [P.], seq 7951132:7951328, ack 4645, win 501, length 196
00:31:09.382480 IP 138.197.139.105.ssh > cpef81d0fadd1d3-cmf81d0fadd1d0.cpe.net.fido.ca.64129: Flags [P.], seq 7951328:7951524, ack 4645, win 501, length 196
00:31:09.382643 IP 138.197.139.105.ssh > cpef81d0fadd1d3-cmf81d0fadd1d0.cpe.net.fido.ca.64129: Flags [P.], seq 7951524:7951720, ack 4645, win 501, length 196
00:31:09.382776 IP 138.197.139.105.ssh > cpef81d0fadd1d3-cmf81d0fadd1d0.cpe.net.fido.ca.64129: Flags [P.], seq 7951720:7951916, ack 4645, win 501, length 196
00:31:09.382866 IP 138.197.139.105.ssh > cpef81d0fadd1d3-cmf81d0fadd1d0.cpe.net.fido.ca.64129: Flags [P.], seq 7951916:7952112, ack 4645, win 501, length 196
00:31:09.382928 IP cpef81d0fadd1d3-cmf81d0fadd1d0.cpe.net.fido.ca.64129 > 138.197.139.105.ssh: Flags [.], ack 7925196, win 513, length 0
00:31:09.382955 IP cpef81d0fadd1d3-cmf81d0fadd1d0.cpe.net.fido.ca.64129 > 138.197.139.105.ssh: Flags [.], ack 7930120, win 513, length 0
00:31:09.382973 IP cpef81d0fadd1d3-cmf81d0fadd1d0.cpe.net.fido.ca.64129 > 138.197.139.105.ssh: Flags [.], ack 7933060, win 513, length 0
00:31:09.382986 IP cpef81d0fadd1d3-cmf81d0fadd1d0.cpe.net.fido.ca.64129 > 138.197.139.105.ssh: Flags [.], ack 7933452, win 511, length 0
00:31:09.383104 IP 138.197.139.105.ssh > cpef81d0fadd1d3-cmf81d0fadd1d0.cpe.net.fido.ca.64129: Flags [P.], seq 7952112:7952860, ack 4645, win 501, length 748
00:31:09.383197 IP 138.197.139.105.ssh > cpef81d0fadd1d3-cmf81d0fadd1d0.cpe.net.fido.ca.64129: Flags [P.], seq 7952860:7953056, ack 4645, win 501, length 196
00:31:09.383285 IP 138.197.139.105.ssh > cpef81d0fadd1d3-cmf81d0fadd1d0.cpe.net.fido.ca.64129: Flags [P.], seq 7953056:7953252, ack 4645, win 501, length 196
00:31:09.383375 IP 138.197.139.105.ssh > cpef81d0fadd1d3-cmf81d0fadd1d0.cpe.net.fido.ca.64129: Flags [P.], seq 7953252:7953448, ack 4645, win 501, length 196
00:31:09.383463 IP 138.197.139.105.ssh > cpef81d0fadd1d3-cmf81d0fadd1d0.cpe.net.fido.ca.64129: Flags [P.], seq 7953448:7953644, ack 4645, win 501, length 196
00:31:09.383552 IP 138.197.139.105.ssh > cpef81d0fadd1d3-cmf81d0fadd1d0.cpe.net.fido.ca.64129: Flags [P.], seq 7953644:7953840, ack 4645, win 501, length 196
00:31:09.383633 IP 138.197.139.105.ssh > cpef81d0fadd1d3-cmf81d0fadd1d0.cpe.net.fido.ca.64129: Flags [P.], seq 7953840:7954036, ack 4645, win 501, length 196
00:31:09.383720 IP 138.197.139.105.ssh > cpef81d0fadd1d3-cmf81d0fadd1d0.cpe.net.fido.ca.64129: Flags [P.], seq 7954036:7954232, ack 4645, win 501, length 196
00:31:09.383800 IP 138.197.139.105.ssh > cpef81d0fadd1d3-cmf81d0fadd1d0.cpe.net.fido.ca.64129: Flags [P.], seq 7954232:7954428, ack 4645, win 501, length 196
00:31:09.383885 IP 138.197.139.105.ssh > cpef81d0fadd1d3-cmf81d0fadd1d0.cpe.net.fido.ca.64129: Flags [P.], seq 7954428:7954624, ack 4645, win 501, length 196
00:31:09.383966 IP 138.197.139.105.ssh > cpef81d0fadd1d3-cmf81d0fadd1d0.cpe.net.fido.ca.64129: Flags [P.], seq 7954624:7954820, ack 4645, win 501, length 196
00:31:09.384052 IP 138.197.139.105.ssh > cpef81d0fadd1d3-cmf81d0fadd1d0.cpe.net.fido.ca.64129: Flags [P.], seq 7954820:7955016, ack 4645, win 501, length 196
00:31:09.384132 IP 138.197.139.105.ssh > cpef81d0fadd1d3-cmf81d0fadd1d0.cpe.net.fido.ca.64129: Flags [P.], seq 7955016:7955212, ack 4645, win 501, length 196
00:31:09.384218 IP 138.197.139.105.ssh > cpef81d0fadd1d3-cmf81d0fadd1d0.cpe.net.fido.ca.64129: Flags [P.], seq 7955212:7955408, ack 4645, win 501, length 196
00:31:09.384319 IP 138.197.139.105.ssh > cpef81d0fadd1d3-cmf81d0fadd1d0.cpe.net.fido.ca.64129: Flags [P.], seq 7955408:7955604, ack 4645, win 501, length 196
00:31:09.384450 IP 138.197.139.105.ssh > cpef81d0fadd1d3-cmf81d0fadd1d0.cpe.net.fido.ca.64129: Flags [P.], seq 7955604:7955800, ack 4645, win 501, length 196
00:31:09.384554 IP 138.197.139.105.ssh > cpef81d0fadd1d3-cmf81d0fadd1d0.cpe.net.fido.ca.64129: Flags [P.], seq 7955800:7955996, ack 4645, win 501, length 196
00:31:09.384637 IP 138.197.139.105.ssh > cpef81d0fadd1d3-cmf81d0fadd1d0.cpe.net.fido.ca.64129: Flags [P.], seq 7955996:7956192, ack 4645, win 501, length 196
00:31:09.384720 IP 138.197.139.105.ssh > cpef81d0fadd1d3-cmf81d0fadd1d0.cpe.net.fido.ca.64129: Flags [P.], seq 7956192:7956388, ack 4645, win 501, length 196
00:31:09.384807 IP 138.197.139.105.ssh > cpef81d0fadd1d3-cmf81d0fadd1d0.cpe.net.fido.ca.64129: Flags [P.], seq 7956388:7956584, ack 4645, win 501, length 196
00:31:09.384909 IP 138.197.139.105.ssh > cpef81d0fadd1d3-cmf81d0fadd1d0.cpe.net.fido.ca.64129: Flags [P.], seq 7956584:7956780, ack 4645, win 501, length 196
00:31:09.384998 IP 138.197.139.105.ssh > cpef81d0fadd1d3-cmf81d0fadd1d0.cpe.net.fido.ca.64129: Flags [P.], seq 7956780:7956976, ack 4645, win 501, length 196
00:31:09.385079 IP 138.197.139.105.ssh > cpef81d0fadd1d3-cmf81d0fadd1d0.cpe.net.fido.ca.64129: Flags [P.], seq 7956976:7957172, ack 4645, win 501, length 196
00:31:09.385162 IP 138.197.139.105.ssh > cpef81d0fadd1d3-cmf81d0fadd1d0.cpe.net.fido.ca.64129: Flags [P.], seq 7957172:7957368, ack 4645, win 501, length 196
00:31:09.385243 IP 138.197.139.105.ssh > cpef81d0fadd1d3-cmf81d0fadd1d0.cpe.net.fido.ca.64129: Flags [P.], seq 7957368:7957564, ack 4645, win 501, length 196
00:31:09.385330 IP 138.197.139.105.ssh > cpef81d0fadd1d3-cmf81d0fadd1d0.cpe.net.fido.ca.64129: Flags [P.], seq 7957564:7957760, ack 4645, win 501, length 196
00:31:09.385414 IP 138.197.139.105.ssh > cpef81d0fadd1d3-cmf81d0fadd1d0.cpe.net.fido.ca.64129: Flags [P.], seq 7957760:7957956, ack 4645, win 501, length 196
00:31:09.385493 IP 138.197.139.105.ssh > cpef81d0fadd1d3-cmf81d0fadd1d0.cpe.net.fido.ca.64129: Flags [P.], seq 7957956:7958152, ack 4645, win 501, length 196
00:31:09.385576 IP 138.197.139.105.ssh > cpef81d0fadd1d3-cmf81d0fadd1d0.cpe.net.fido.ca.64129: Flags [P.], seq 7958152:7958348, ack 4645, win 501, length 196
00:31:09.385657 IP 138.197.139.105.ssh > cpef81d0fadd1d3-cmf81d0fadd1d0.cpe.net.fido.ca.64129: Flags [P.], seq 7958348:7958544, ack 4645, win 501, length 196
00:31:09.385746 IP 138.197.139.105.ssh > cpef81d0fadd1d3-cmf81d0fadd1d0.cpe.net.fido.ca.64129: Flags [P.], seq 7958544:7958740, ack 4645, win 501, length 196
00:31:09.385827 IP 138.197.139.105.ssh > cpef81d0fadd1d3-cmf81d0fadd1d0.cpe.net.fido.ca.64129: Flags [P.], seq 7958740:7958936, ack 4645, win 501, length 196
00:31:09.385909 IP 138.197.139.105.ssh > cpef81d0fadd1d3-cmf81d0fadd1d0.cpe.net.fido.ca.64129: Flags [P.], seq 7958936:7959132, ack 4645, win 501, length 196
00:31:09.386011 IP 138.197.139.105.ssh > cpef81d0fadd1d3-cmf81d0fadd1d0.cpe.net.fido.ca.64129: Flags [P.], seq 7959132:7959328, ack 4645, win 501, length 196
00:31:09.386096 IP 138.197.139.105.ssh > cpef81d0fadd1d3-cmf81d0fadd1d0.cpe.net.fido.ca.64129: Flags [P.], seq 7959328:7959524, ack 4645, win 501, length 196
00:31:09.386184 IP 138.197.139.105.ssh > cpef81d0fadd1d3-cmf81d0fadd1d0.cpe.net.fido.ca.64129: Flags [P.], seq 7959524:7959720, ack 4645, win 501, length 196
00:31:09.386282 IP 138.197.139.105.ssh > cpef81d0fadd1d3-cmf81d0fadd1d0.cpe.net.fido.ca.64129: Flags [P.], seq 7959720:7959916, ack 4645, win 501, length 196
00:31:09.386365 IP 138.197.139.105.ssh > cpef81d0fadd1d3-cmf81d0fadd1d0.cpe.net.fido.ca.64129: Flags [P.], seq 7959916:7960112, ack 4645, win 501, length 196
00:31:09.386447 IP 138.197.139.105.ssh > cpef81d0fadd1d3-cmf81d0fadd1d0.cpe.net.fido.ca.64129: Flags [P.], seq 7960112:7960308, ack 4645, win 501, length 196
00:31:09.386529 IP 138.197.139.105.ssh > cpef81d0fadd1d3-cmf81d0fadd1d0.cpe.net.fido.ca.64129: Flags [P.], seq 7960308:7960504, ack 4645, win 501, length 196
00:31:09.386610 IP 138.197.139.105.ssh > cpef81d0fadd1d3-cmf81d0fadd1d0.cpe.net.fido.ca.64129: Flags [P.], seq 7960504:7960700, ack 4645, win 501, length 196
00:31:09.386706 IP 138.197.139.105.ssh > cpef81d0fadd1d3-cmf81d0fadd1d0.cpe.net.fido.ca.64129: Flags [P.], seq 7960700:7960896, ack 4645, win 501, length 196
00:31:09.386839 IP 138.197.139.105.ssh > cpef81d0fadd1d3-cmf81d0fadd1d0.cpe.net.fido.ca.64129: Flags [P.], seq 7960896:7961092, ack 4645, win 501, length 196
00:31:09.386956 IP 138.197.139.105.ssh > cpef81d0fadd1d3-cmf81d0fadd1d0.cpe.net.fido.ca.64129: Flags [P.], seq 7961092:7961288, ack 4645, win 501, length 196
00:31:09.387065 IP 138.197.139.105.ssh > cpef81d0fadd1d3-cmf81d0fadd1d0.cpe.net.fido.ca.64129: Flags [P.], seq 7961288:7961484, ack 4645, win 501, length 196
00:31:09.387178 IP 138.197.139.105.ssh > cpef81d0fadd1d3-cmf81d0fadd1d0.cpe.net.fido.ca.64129: Flags [P.], seq 7961484:7961680, ack 4645, win 501, length 196
00:31:09.387284 IP 138.197.139.105.ssh > cpef81d0fadd1d3-cmf81d0fadd1d0.cpe.net.fido.ca.64129: Flags [P.], seq 7961680:7961876, ack 4645, win 501, length 196
00:31:09.387398 IP 138.197.139.105.ssh > cpef81d0fadd1d3-cmf81d0fadd1d0.cpe.net.fido.ca.64129: Flags [P.], seq 7961876:7962072, ack 4645, win 501, length 196
00:31:09.387502 IP 138.197.139.105.ssh > cpef81d0fadd1d3-cmf81d0fadd1d0.cpe.net.fido.ca.64129: Flags [P.], seq 7962072:7962268, ack 4645, win 501, length 196
00:31:09.387636 IP 138.197.139.105.ssh > cpef81d0fadd1d3-cmf81d0fadd1d0.cpe.net.fido.ca.64129: Flags [P.], seq 7962268:7962464, ack 4645, win 501, length 196
00:31:09.387745 IP 138.197.139.105.ssh > cpef81d0fadd1d3-cmf81d0fadd1d0.cpe.net.fido.ca.64129: Flags [P.], seq 7962464:7962660, ack 4645, win 501, length 196
00:31:09.387859 IP 138.197.139.105.ssh > cpef81d0fadd1d3-cmf81d0fadd1d0.cpe.net.fido.ca.64129: Flags [P.], seq 7962660:7962856, ack 4645, win 501, length 196
00:31:09.387969 IP 138.197.139.105.ssh > cpef81d0fadd1d3-cmf81d0fadd1d0.cpe.net.fido.ca.64129: Flags [P.], seq 7962856:7963052, ack 4645, win 501, length 196
00:31:09.388079 IP 138.197.139.105.ssh > cpef81d0fadd1d3-cmf81d0fadd1d0.cpe.net.fido.ca.64129: Flags [P.], seq 7963052:7963248, ack 4645, win 501, length 196
00:31:09.388184 IP 138.197.139.105.ssh > cpef81d0fadd1d3-cmf81d0fadd1d0.cpe.net.fido.ca.64129: Flags [P.], seq 7963248:7963444, ack 4645, win 501, length 196
00:31:09.388295 IP 138.197.139.105.ssh > cpef81d0fadd1d3-cmf81d0fadd1d0.cpe.net.fido.ca.64129: Flags [P.], seq 7963444:7963640, ack 4645, win 501, length 196
00:31:09.388398 IP 138.197.139.105.ssh > cpef81d0fadd1d3-cmf81d0fadd1d0.cpe.net.fido.ca.64129: Flags [P.], seq 7963640:7963836, ack 4645, win 501, length 196
00:31:09.388511 IP 138.197.139.105.ssh > cpef81d0fadd1d3-cmf81d0fadd1d0.cpe.net.fido.ca.64129: Flags [P.], seq 7963836:7964032, ack 4645, win 501, length 196
00:31:09.388616 IP 138.197.139.105.ssh > cpef81d0fadd1d3-cmf81d0fadd1d0.cpe.net.fido.ca.64129: Flags [P.], seq 7964032:7964228, ack 4645, win 501, length 196
00:31:09.388725 IP 138.197.139.105.ssh > cpef81d0fadd1d3-cmf81d0fadd1d0.cpe.net.fido.ca.64129: Flags [P.], seq 7964228:7964424, ack 4645, win 501, length 196
00:31:09.388853 IP 138.197.139.105.ssh > cpef81d0fadd1d3-cmf81d0fadd1d0.cpe.net.fido.ca.64129: Flags [P.], seq 7964424:7964620, ack 4645, win 501, length 196
00:31:09.388960 IP 138.197.139.105.ssh > cpef81d0fadd1d3-cmf81d0fadd1d0.cpe.net.fido.ca.64129: Flags [P.], seq 7964620:7964816, ack 4645, win 501, length 196
00:31:09.389072 IP 138.197.139.105.ssh > cpef81d0fadd1d3-cmf81d0fadd1d0.cpe.net.fido.ca.64129: Flags [P.], seq 7964816:7965012, ack 4645, win 501, length 196
00:31:09.389179 IP 138.197.139.105.ssh > cpef81d0fadd1d3-cmf81d0fadd1d0.cpe.net.fido.ca.64129: Flags [P.], seq 7965012:7965208, ack 4645, win 501, length 196
00:31:09.389242 IP cpef81d0fadd1d3-cmf81d0fadd1d0.cpe.net.fido.ca.64129 > 138.197.139.105.ssh: Flags [.], ack 7939920, win 513, length 0
00:31:09.389280 IP cpef81d0fadd1d3-cmf81d0fadd1d0.cpe.net.fido.ca.64129 > 138.197.139.105.ssh: Flags [.], ack 7942900, win 513, length 0
00:31:09.389391 IP 138.197.139.105.ssh > cpef81d0fadd1d3-cmf81d0fadd1d0.cpe.net.fido.ca.64129: Flags [P.], seq 7965208:7965684, ack 4645, win 501, length 476
00:31:09.389506 IP 138.197.139.105.ssh > cpef81d0fadd1d3-cmf81d0fadd1d0.cpe.net.fido.ca.64129: Flags [P.], seq 7965684:7965880, ack 4645, win 501, length 196
00:31:09.389621 IP 138.197.139.105.ssh > cpef81d0fadd1d3-cmf81d0fadd1d0.cpe.net.fido.ca.64129: Flags [P.], seq 7965880:7966076, ack 4645, win 501, length 196
00:31:09.389735 IP 138.197.139.105.ssh > cpef81d0fadd1d3-cmf81d0fadd1d0.cpe.net.fido.ca.64129: Flags [P.], seq 7966076:7966272, ack 4645, win 501, length 196
00:31:09.389845 IP 138.197.139.105.ssh > cpef81d0fadd1d3-cmf81d0fadd1d0.cpe.net.fido.ca.64129: Flags [P.], seq 7966272:7966468, ack 4645, win 501, length 196
00:31:09.389951 IP 138.197.139.105.ssh > cpef81d0fadd1d3-cmf81d0fadd1d0.cpe.net.fido.ca.64129: Flags [P.], seq 7966468:7966664, ack 4645, win 501, length 196
00:31:09.390059 IP 138.197.139.105.ssh > cpef81d0fadd1d3-cmf81d0fadd1d0.cpe.net.fido.ca.64129: Flags [P.], seq 7966664:7966860, ack 4645, win 501, length 196
00:31:09.390165 IP 138.197.139.105.ssh > cpef81d0fadd1d3-cmf81d0fadd1d0.cpe.net.fido.ca.64129: Flags [P.], seq 7966860:7967056, ack 4645, win 501, length 196
00:31:09.390290 IP 138.197.139.105.ssh > cpef81d0fadd1d3-cmf81d0fadd1d0.cpe.net.fido.ca.64129: Flags [P.], seq 7967056:7967252, ack 4645, win 501, length 196
00:31:09.390400 IP 138.197.139.105.ssh > cpef81d0fadd1d3-cmf81d0fadd1d0.cpe.net.fido.ca.64129: Flags [P.], seq 7967252:7967448, ack 4645, win 501, length 196
00:31:09.390506 IP 138.197.139.105.ssh > cpef81d0fadd1d3-cmf81d0fadd1d0.cpe.net.fido.ca.64129: Flags [P.], seq 7967448:7967644, ack 4645, win 501, length 196
00:31:09.390618 IP 138.197.139.105.ssh > cpef81d0fadd1d3-cmf81d0fadd1d0.cpe.net.fido.ca.64129: Flags [P.], seq 7967644:7967840, ack 4645, win 501, length 196
00:31:09.390726 IP 138.197.139.105.ssh > cpef81d0fadd1d3-cmf81d0fadd1d0.cpe.net.fido.ca.64129: Flags [P.], seq 7967840:7968036, ack 4645, win 501, length 196
00:31:09.390839 IP 138.197.139.105.ssh > cpef81d0fadd1d3-cmf81d0fadd1d0.cpe.net.fido.ca.64129: Flags [P.], seq 7968036:7968232, ack 4645, win 501, length 196
00:31:09.390942 IP 138.197.139.105.ssh > cpef81d0fadd1d3-cmf81d0fadd1d0.cpe.net.fido.ca.64129: Flags [P.], seq 7968232:7968428, ack 4645, win 501, length 196
00:31:09.391050 IP 138.197.139.105.ssh > cpef81d0fadd1d3-cmf81d0fadd1d0.cpe.net.fido.ca.64129: Flags [P.], seq 7968428:7968624, ack 4645, win 501, length 196
00:31:09.391154 IP 138.197.139.105.ssh > cpef81d0fadd1d3-cmf81d0fadd1d0.cpe.net.fido.ca.64129: Flags [P.], seq 7968624:7968820, ack 4645, win 501, length 196
00:31:09.391265 IP 138.197.139.105.ssh > cpef81d0fadd1d3-cmf81d0fadd1d0.cpe.net.fido.ca.64129: Flags [P.], seq 7968820:7969016, ack 4645, win 501, length 196
00:31:09.391372 IP 138.197.139.105.ssh > cpef81d0fadd1d3-cmf81d0fadd1d0.cpe.net.fido.ca.64129: Flags [P.], seq 7969016:7969212, ack 4645, win 501, length 196
00:31:09.391483 IP 138.197.139.105.ssh > cpef81d0fadd1d3-cmf81d0fadd1d0.cpe.net.fido.ca.64129: Flags [P.], seq 7969212:7969408, ack 4645, win 501, length 196
00:31:09.391589 IP 138.197.139.105.ssh > cpef81d0fadd1d3-cmf81d0fadd1d0.cpe.net.fido.ca.64129: Flags [P.], seq 7969408:7969604, ack 4645, win 501, length 196
00:31:09.391696 IP 138.197.139.105.ssh > cpef81d0fadd1d3-cmf81d0fadd1d0.cpe.net.fido.ca.64129: Flags [P.], seq 7969604:7969800, ack 4645, win 501, length 196
00:31:09.391803 IP 138.197.139.105.ssh > cpef81d0fadd1d3-cmf81d0fadd1d0.cpe.net.fido.ca.64129: Flags [P.], seq 7969800:7969996, ack 4645, win 501, length 196
00:31:09.391913 IP 138.197.139.105.ssh > cpef81d0fadd1d3-cmf81d0fadd1d0.cpe.net.fido.ca.64129: Flags [P.], seq 7969996:7970192, ack 4645, win 501, length 196
00:31:09.392022 IP 138.197.139.105.ssh > cpef81d0fadd1d3-cmf81d0fadd1d0.cpe.net.fido.ca.64129: Flags [P.], seq 7970192:7970388, ack 4645, win 501, length 196
00:31:09.392128 IP 138.197.139.105.ssh > cpef81d0fadd1d3-cmf81d0fadd1d0.cpe.net.fido.ca.64129: Flags [P.], seq 7970388:7970584, ack 4645, win 501, length 196
00:31:09.392240 IP 138.197.139.105.ssh > cpef81d0fadd1d3-cmf81d0fadd1d0.cpe.net.fido.ca.64129: Flags [P.], seq 7970584:7970780, ack 4645, win 501, length 196
00:31:09.392345 IP 138.197.139.105.ssh > cpef81d0fadd1d3-cmf81d0fadd1d0.cpe.net.fido.ca.64129: Flags [P.], seq 7970780:7970976, ack 4645, win 501, length 196
00:31:09.392453 IP 138.197.139.105.ssh > cpef81d0fadd1d3-cmf81d0fadd1d0.cpe.net.fido.ca.64129: Flags [P.], seq 7970976:7971172, ack 4645, win 501, length 196
00:31:09.392559 IP 138.197.139.105.ssh > cpef81d0fadd1d3-cmf81d0fadd1d0.cpe.net.fido.ca.64129: Flags [P.], seq 7971172:7971368, ack 4645, win 501, length 196
00:31:09.392669 IP 138.197.139.105.ssh > cpef81d0fadd1d3-cmf81d0fadd1d0.cpe.net.fido.ca.64129: Flags [P.], seq 7971368:7971564, ack 4645, win 501, length 196
00:31:09.392776 IP 138.197.139.105.ssh > cpef81d0fadd1d3-cmf81d0fadd1d0.cpe.net.fido.ca.64129: Flags [P.], seq 7971564:7971760, ack 4645, win 501, length 196
00:31:09.392907 IP 138.197.139.105.ssh > cpef81d0fadd1d3-cmf81d0fadd1d0.cpe.net.fido.ca.64129: Flags [P.], seq 7971760:7971956, ack 4645, win 501, length 196
00:31:09.393020 IP 138.197.139.105.ssh > cpef81d0fadd1d3-cmf81d0fadd1d0.cpe.net.fido.ca.64129: Flags [P.], seq 7971956:7972152, ack 4645, win 501, length 196
00:31:09.393125 IP 138.197.139.105.ssh > cpef81d0fadd1d3-cmf81d0fadd1d0.cpe.net.fido.ca.64129: Flags [P.], seq 7972152:7972348, ack 4645, win 501, length 196
00:31:09.393218 IP 138.197.139.105.ssh > cpef81d0fadd1d3-cmf81d0fadd1d0.cpe.net.fido.ca.64129: Flags [P.], seq 7972348:7972544, ack 4645, win 501, length 196
00:31:09.393337 IP 138.197.139.105.ssh > cpef81d0fadd1d3-cmf81d0fadd1d0.cpe.net.fido.ca.64129: Flags [P.], seq 7972544:7972740, ack 4645, win 501, length 196
00:31:09.393429 IP 138.197.139.105.ssh > cpef81d0fadd1d3-cmf81d0fadd1d0.cpe.net.fido.ca.64129: Flags [P.], seq 7972740:7972936, ack 4645, win 501, length 196
00:31:09.393514 IP 138.197.139.105.ssh > cpef81d0fadd1d3-cmf81d0fadd1d0.cpe.net.fido.ca.64129: Flags [P.], seq 7972936:7973132, ack 4645, win 501, length 196
00:31:09.393594 IP 138.197.139.105.ssh > cpef81d0fadd1d3-cmf81d0fadd1d0.cpe.net.fido.ca.64129: Flags [P.], seq 7973132:7973328, ack 4645, win 501, length 196
00:31:09.393683 IP 138.197.139.105.ssh > cpef81d0fadd1d3-cmf81d0fadd1d0.cpe.net.fido.ca.64129: Flags [P.], seq 7973328:7973524, ack 4645, win 501, length 196
00:31:09.393762 IP 138.197.139.105.ssh > cpef81d0fadd1d3-cmf81d0fadd1d0.cpe.net.fido.ca.64129: Flags [P.], seq 7973524:7973720, ack 4645, win 501, length 196
00:31:09.393843 IP 138.197.139.105.ssh > cpef81d0fadd1d3-cmf81d0fadd1d0.cpe.net.fido.ca.64129: Flags [P.], seq 7973720:7973916, ack 4645, win 501, length 196
00:31:09.393932 IP 138.197.139.105.ssh > cpef81d0fadd1d3-cmf81d0fadd1d0.cpe.net.fido.ca.64129: Flags [P.], seq 7973916:7974112, ack 4645, win 501, length 196
00:31:09.394014 IP 138.197.139.105.ssh > cpef81d0fadd1d3-cmf81d0fadd1d0.cpe.net.fido.ca.64129: Flags [P.], seq 7974112:7974308, ack 4645, win 501, length 196
00:31:09.394094 IP 138.197.139.105.ssh > cpef81d0fadd1d3-cmf81d0fadd1d0.cpe.net.fido.ca.64129: Flags [P.], seq 7974308:7974504, ack 4645, win 501, length 196
00:31:09.394175 IP 138.197.139.105.ssh > cpef81d0fadd1d3-cmf81d0fadd1d0.cpe.net.fido.ca.64129: Flags [P.], seq 7974504:7974700, ack 4645, win 501, length 196
00:31:09.394275 IP 138.197.139.105.ssh > cpef81d0fadd1d3-cmf81d0fadd1d0.cpe.net.fido.ca.64129: Flags [P.], seq 7974700:7974896, ack 4645, win 501, length 196
00:31:09.394352 IP cpef81d0fadd1d3-cmf81d0fadd1d0.cpe.net.fido.ca.64129 > 138.197.139.105.ssh: Flags [.], ack 7947408, win 513, length 0
00:31:09.394383 IP cpef81d0fadd1d3-cmf81d0fadd1d0.cpe.net.fido.ca.64129 > 138.197.139.105.ssh: Flags [.], ack 7951720, win 513, length 0
00:31:09.394399 IP cpef81d0fadd1d3-cmf81d0fadd1d0.cpe.net.fido.ca.64129 > 138.197.139.105.ssh: Flags [.], ack 7956780, win 513, length 0
00:31:09.394414 IP cpef81d0fadd1d3-cmf81d0fadd1d0.cpe.net.fido.ca.64129 > 138.197.139.105.ssh: Flags [.], ack 7961680, win 513, length 0
00:31:09.394521 IP 138.197.139.105.ssh > cpef81d0fadd1d3-cmf81d0fadd1d0.cpe.net.fido.ca.64129: Flags [P.], seq 7974896:7975644, ack 4645, win 501, length 748
00:31:09.394613 IP 138.197.139.105.ssh > cpef81d0fadd1d3-cmf81d0fadd1d0.cpe.net.fido.ca.64129: Flags [P.], seq 7975644:7975840, ack 4645, win 501, length 196
00:31:09.394700 IP 138.197.139.105.ssh > cpef81d0fadd1d3-cmf81d0fadd1d0.cpe.net.fido.ca.64129: Flags [P.], seq 7975840:7976036, ack 4645, win 501, length 196
00:31:09.394786 IP 138.197.139.105.ssh > cpef81d0fadd1d3-cmf81d0fadd1d0.cpe.net.fido.ca.64129: Flags [P.], seq 7976036:7976232, ack 4645, win 501, length 196
00:31:09.394871 IP 138.197.139.105.ssh > cpef81d0fadd1d3-cmf81d0fadd1d0.cpe.net.fido.ca.64129: Flags [P.], seq 7976232:7976428, ack 4645, win 501, length 196
00:31:09.394954 IP 138.197.139.105.ssh > cpef81d0fadd1d3-cmf81d0fadd1d0.cpe.net.fido.ca.64129: Flags [P.], seq 7976428:7976624, ack 4645, win 501, length 196
00:31:09.395036 IP 138.197.139.105.ssh > cpef81d0fadd1d3-cmf81d0fadd1d0.cpe.net.fido.ca.64129: Flags [P.], seq 7976624:7976820, ack 4645, win 501, length 196
00:31:09.395117 IP 138.197.139.105.ssh > cpef81d0fadd1d3-cmf81d0fadd1d0.cpe.net.fido.ca.64129: Flags [P.], seq 7976820:7977016, ack 4645, win 501, length 196
00:31:09.395202 IP 138.197.139.105.ssh > cpef81d0fadd1d3-cmf81d0fadd1d0.cpe.net.fido.ca.64129: Flags [P.], seq 7977016:7977212, ack 4645, win 501, length 196
00:31:09.395283 IP 138.197.139.105.ssh > cpef81d0fadd1d3-cmf81d0fadd1d0.cpe.net.fido.ca.64129: Flags [P.], seq 7977212:7977408, ack 4645, win 501, length 196
00:31:09.395369 IP 138.197.139.105.ssh > cpef81d0fadd1d3-cmf81d0fadd1d0.cpe.net.fido.ca.64129: Flags [P.], seq 7977408:7977604, ack 4645, win 501, length 196
00:31:09.395505 IP 138.197.139.105.ssh > cpef81d0fadd1d3-cmf81d0fadd1d0.cpe.net.fido.ca.64129: Flags [P.], seq 7977604:7977800, ack 4645, win 501, length 196
00:31:09.395608 IP 138.197.139.105.ssh > cpef81d0fadd1d3-cmf81d0fadd1d0.cpe.net.fido.ca.64129: Flags [P.], seq 7977800:7977996, ack 4645, win 501, length 196
00:31:09.395691 IP 138.197.139.105.ssh > cpef81d0fadd1d3-cmf81d0fadd1d0.cpe.net.fido.ca.64129: Flags [P.], seq 7977996:7978192, ack 4645, win 501, length 196
00:31:09.395773 IP 138.197.139.105.ssh > cpef81d0fadd1d3-cmf81d0fadd1d0.cpe.net.fido.ca.64129: Flags [P.], seq 7978192:7978388, ack 4645, win 501, length 196
00:31:09.395859 IP 138.197.139.105.ssh > cpef81d0fadd1d3-cmf81d0fadd1d0.cpe.net.fido.ca.64129: Flags [P.], seq 7978388:7978584, ack 4645, win 501, length 196
00:31:09.395940 IP 138.197.139.105.ssh > cpef81d0fadd1d3-cmf81d0fadd1d0.cpe.net.fido.ca.64129: Flags [P.], seq 7978584:7978780, ack 4645, win 501, length 196
00:31:09.396023 IP 138.197.139.105.ssh > cpef81d0fadd1d3-cmf81d0fadd1d0.cpe.net.fido.ca.64129: Flags [P.], seq 7978780:7978976, ack 4645, win 501, length 196
00:31:09.396109 IP 138.197.139.105.ssh > cpef81d0fadd1d3-cmf81d0fadd1d0.cpe.net.fido.ca.64129: Flags [P.], seq 7978976:7979172, ack 4645, win 501, length 196
00:31:09.396194 IP 138.197.139.105.ssh > cpef81d0fadd1d3-cmf81d0fadd1d0.cpe.net.fido.ca.64129: Flags [P.], seq 7979172:7979368, ack 4645, win 501, length 196
00:31:09.396274 IP 138.197.139.105.ssh > cpef81d0fadd1d3-cmf81d0fadd1d0.cpe.net.fido.ca.64129: Flags [P.], seq 7979368:7979564, ack 4645, win 501, length 196
00:31:09.396357 IP 138.197.139.105.ssh > cpef81d0fadd1d3-cmf81d0fadd1d0.cpe.net.fido.ca.64129: Flags [P.], seq 7979564:7979760, ack 4645, win 501, length 196
00:31:09.396436 IP 138.197.139.105.ssh > cpef81d0fadd1d3-cmf81d0fadd1d0.cpe.net.fido.ca.64129: Flags [P.], seq 7979760:7979956, ack 4645, win 501, length 196
00:31:09.396518 IP 138.197.139.105.ssh > cpef81d0fadd1d3-cmf81d0fadd1d0.cpe.net.fido.ca.64129: Flags [P.], seq 7979956:7980152, ack 4645, win 501, length 196
00:31:09.396608 IP 138.197.139.105.ssh > cpef81d0fadd1d3-cmf81d0fadd1d0.cpe.net.fido.ca.64129: Flags [P.], seq 7980152:7980348, ack 4645, win 501, length 196
00:31:09.396691 IP 138.197.139.105.ssh > cpef81d0fadd1d3-cmf81d0fadd1d0.cpe.net.fido.ca.64129: Flags [P.], seq 7980348:7980544, ack 4645, win 501, length 196
00:31:09.396772 IP 138.197.139.105.ssh > cpef81d0fadd1d3-cmf81d0fadd1d0.cpe.net.fido.ca.64129: Flags [P.], seq 7980544:7980740, ack 4645, win 501, length 196
00:31:09.396877 IP 138.197.139.105.ssh > cpef81d0fadd1d3-cmf81d0fadd1d0.cpe.net.fido.ca.64129: Flags [P.], seq 7980740:7980936, ack 4645, win 501, length 196
00:31:09.396959 IP 138.197.139.105.ssh > cpef81d0fadd1d3-cmf81d0fadd1d0.cpe.net.fido.ca.64129: Flags [P.], seq 7980936:7981132, ack 4645, win 501, length 196
00:31:09.397040 IP 138.197.139.105.ssh > cpef81d0fadd1d3-cmf81d0fadd1d0.cpe.net.fido.ca.64129: Flags [P.], seq 7981132:7981328, ack 4645, win 501, length 196
00:31:09.397121 IP 138.197.139.105.ssh > cpef81d0fadd1d3-cmf81d0fadd1d0.cpe.net.fido.ca.64129: Flags [P.], seq 7981328:7981524, ack 4645, win 501, length 196
00:31:09.397203 IP 138.197.139.105.ssh > cpef81d0fadd1d3-cmf81d0fadd1d0.cpe.net.fido.ca.64129: Flags [P.], seq 7981524:7981720, ack 4645, win 501, length 196
00:31:09.397283 IP 138.197.139.105.ssh > cpef81d0fadd1d3-cmf81d0fadd1d0.cpe.net.fido.ca.64129: Flags [P.], seq 7981720:7981916, ack 4645, win 501, length 196
00:31:09.397369 IP 138.197.139.105.ssh > cpef81d0fadd1d3-cmf81d0fadd1d0.cpe.net.fido.ca.64129: Flags [P.], seq 7981916:7982112, ack 4645, win 501, length 196
00:31:09.397450 IP 138.197.139.105.ssh > cpef81d0fadd1d3-cmf81d0fadd1d0.cpe.net.fido.ca.64129: Flags [P.], seq 7982112:7982308, ack 4645, win 501, length 196
00:31:09.397536 IP 138.197.139.105.ssh > cpef81d0fadd1d3-cmf81d0fadd1d0.cpe.net.fido.ca.64129: Flags [P.], seq 7982308:7982504, ack 4645, win 501, length 196
00:31:09.397627 IP 138.197.139.105.ssh > cpef81d0fadd1d3-cmf81d0fadd1d0.cpe.net.fido.ca.64129: Flags [P.], seq 7982504:7982700, ack 4645, win 501, length 196
00:31:09.397710 IP 138.197.139.105.ssh > cpef81d0fadd1d3-cmf81d0fadd1d0.cpe.net.fido.ca.64129: Flags [P.], seq 7982700:7982896, ack 4645, win 501, length 196
00:31:09.397793 IP 138.197.139.105.ssh > cpef81d0fadd1d3-cmf81d0fadd1d0.cpe.net.fido.ca.64129: Flags [P.], seq 7982896:7983092, ack 4645, win 501, length 196
00:31:09.397909 IP 138.197.139.105.ssh > cpef81d0fadd1d3-cmf81d0fadd1d0.cpe.net.fido.ca.64129: Flags [P.], seq 7983092:7983288, ack 4645, win 501, length 196
00:31:09.398001 IP 138.197.139.105.ssh > cpef81d0fadd1d3-cmf81d0fadd1d0.cpe.net.fido.ca.64129: Flags [P.], seq 7983288:7983484, ack 4645, win 501, length 196
00:31:09.398090 IP 138.197.139.105.ssh > cpef81d0fadd1d3-cmf81d0fadd1d0.cpe.net.fido.ca.64129: Flags [P.], seq 7983484:7983680, ack 4645, win 501, length 196
00:31:09.398189 IP 138.197.139.105.ssh > cpef81d0fadd1d3-cmf81d0fadd1d0.cpe.net.fido.ca.64129: Flags [P.], seq 7983680:7983876, ack 4645, win 501, length 196
00:31:09.398314 IP 138.197.139.105.ssh > cpef81d0fadd1d3-cmf81d0fadd1d0.cpe.net.fido.ca.64129: Flags [P.], seq 7983876:7984072, ack 4645, win 501, length 196
00:31:09.398415 IP 138.197.139.105.ssh > cpef81d0fadd1d3-cmf81d0fadd1d0.cpe.net.fido.ca.64129: Flags [P.], seq 7984072:7984268, ack 4645, win 501, length 196
00:31:09.398514 IP 138.197.139.105.ssh > cpef81d0fadd1d3-cmf81d0fadd1d0.cpe.net.fido.ca.64129: Flags [P.], seq 7984268:7984464, ack 4645, win 501, length 196
00:31:09.398605 IP 138.197.139.105.ssh > cpef81d0fadd1d3-cmf81d0fadd1d0.cpe.net.fido.ca.64129: Flags [P.], seq 7984464:7984660, ack 4645, win 501, length 196
00:31:09.398692 IP 138.197.139.105.ssh > cpef81d0fadd1d3-cmf81d0fadd1d0.cpe.net.fido.ca.64129: Flags [P.], seq 7984660:7984856, ack 4645, win 501, length 196
00:31:09.398771 IP 138.197.139.105.ssh > cpef81d0fadd1d3-cmf81d0fadd1d0.cpe.net.fido.ca.64129: Flags [P.], seq 7984856:7985052, ack 4645, win 501, length 196
00:31:09.398871 IP 138.197.139.105.ssh > cpef81d0fadd1d3-cmf81d0fadd1d0.cpe.net.fido.ca.64129: Flags [P.], seq 7985052:7985248, ack 4645, win 501, length 196
00:31:09.398965 IP 138.197.139.105.ssh > cpef81d0fadd1d3-cmf81d0fadd1d0.cpe.net.fido.ca.64129: Flags [P.], seq 7985248:7985444, ack 4645, win 501, length 196
00:31:09.399063 IP 138.197.139.105.ssh > cpef81d0fadd1d3-cmf81d0fadd1d0.cpe.net.fido.ca.64129: Flags [P.], seq 7985444:7985640, ack 4645, win 501, length 196
00:31:09.399152 IP 138.197.139.105.ssh > cpef81d0fadd1d3-cmf81d0fadd1d0.cpe.net.fido.ca.64129: Flags [P.], seq 7985640:7985836, ack 4645, win 501, length 196
00:31:09.399236 IP 138.197.139.105.ssh > cpef81d0fadd1d3-cmf81d0fadd1d0.cpe.net.fido.ca.64129: Flags [P.], seq 7985836:7986032, ack 4645, win 501, length 196
00:31:09.399319 IP 138.197.139.105.ssh > cpef81d0fadd1d3-cmf81d0fadd1d0.cpe.net.fido.ca.64129: Flags [P.], seq 7986032:7986228, ack 4645, win 501, length 196
00:31:09.399399 IP 138.197.139.105.ssh > cpef81d0fadd1d3-cmf81d0fadd1d0.cpe.net.fido.ca.64129: Flags [P.], seq 7986228:7986424, ack 4645, win 501, length 196
00:31:09.399484 IP 138.197.139.105.ssh > cpef81d0fadd1d3-cmf81d0fadd1d0.cpe.net.fido.ca.64129: Flags [P.], seq 7986424:7986620, ack 4645, win 501, length 196
00:31:09.399565 IP 138.197.139.105.ssh > cpef81d0fadd1d3-cmf81d0fadd1d0.cpe.net.fido.ca.64129: Flags [P.], seq 7986620:7986816, ack 4645, win 501, length 196
00:31:09.399663 IP 138.197.139.105.ssh > cpef81d0fadd1d3-cmf81d0fadd1d0.cpe.net.fido.ca.64129: Flags [P.], seq 7986816:7987012, ack 4645, win 501, length 196
00:31:09.399784 IP 138.197.139.105.ssh > cpef81d0fadd1d3-cmf81d0fadd1d0.cpe.net.fido.ca.64129: Flags [P.], seq 7987012:7987208, ack 4645, win 501, length 196
00:31:09.399874 IP 138.197.139.105.ssh > cpef81d0fadd1d3-cmf81d0fadd1d0.cpe.net.fido.ca.64129: Flags [P.], seq 7987208:7987404, ack 4645, win 501, length 196
00:31:09.399956 IP 138.197.139.105.ssh > cpef81d0fadd1d3-cmf81d0fadd1d0.cpe.net.fido.ca.64129: Flags [P.], seq 7987404:7987600, ack 4645, win 501, length 196
00:31:09.400039 IP 138.197.139.105.ssh > cpef81d0fadd1d3-cmf81d0fadd1d0.cpe.net.fido.ca.64129: Flags [P.], seq 7987600:7987796, ack 4645, win 501, length 196
00:31:09.400125 IP 138.197.139.105.ssh > cpef81d0fadd1d3-cmf81d0fadd1d0.cpe.net.fido.ca.64129: Flags [P.], seq 7987796:7987992, ack 4645, win 501, length 196
00:31:09.400194 IP cpef81d0fadd1d3-cmf81d0fadd1d0.cpe.net.fido.ca.64129 > 138.197.139.105.ssh: Flags [.], ack 7965208, win 513, length 0
00:31:09.400233 IP cpef81d0fadd1d3-cmf81d0fadd1d0.cpe.net.fido.ca.64129 > 138.197.139.105.ssh: Flags [.], ack 7968820, win 513, length 0
00:31:09.400280 IP 138.197.139.105.ssh > cpef81d0fadd1d3-cmf81d0fadd1d0.cpe.net.fido.ca.64129: Flags [P.], seq 7987992:7988188, ack 4645, win 501, length 196
00:31:09.400400 IP 138.197.139.105.ssh > cpef81d0fadd1d3-cmf81d0fadd1d0.cpe.net.fido.ca.64129: Flags [P.], seq 7988188:7988664, ack 4645, win 501, length 476
00:31:09.400483 IP 138.197.139.105.ssh > cpef81d0fadd1d3-cmf81d0fadd1d0.cpe.net.fido.ca.64129: Flags [P.], seq 7988664:7988860, ack 4645, win 501, length 196
00:31:09.400561 IP 138.197.139.105.ssh > cpef81d0fadd1d3-cmf81d0fadd1d0.cpe.net.fido.ca.64129: Flags [P.], seq 7988860:7989056, ack 4645, win 501, length 196
00:31:09.400660 IP 138.197.139.105.ssh > cpef81d0fadd1d3-cmf81d0fadd1d0.cpe.net.fido.ca.64129: Flags [P.], seq 7989056:7989252, ack 4645, win 501, length 196
00:31:09.400746 IP 138.197.139.105.ssh > cpef81d0fadd1d3-cmf81d0fadd1d0.cpe.net.fido.ca.64129: Flags [P.], seq 7989252:7989448, ack 4645, win 501, length 196
00:31:09.400887 IP 138.197.139.105.ssh > cpef81d0fadd1d3-cmf81d0fadd1d0.cpe.net.fido.ca.64129: Flags [P.], seq 7989448:7989644, ack 4645, win 501, length 196
00:31:09.401002 IP 138.197.139.105.ssh > cpef81d0fadd1d3-cmf81d0fadd1d0.cpe.net.fido.ca.64129: Flags [P.], seq 7989644:7989840, ack 4645, win 501, length 196
00:31:09.401119 IP 138.197.139.105.ssh > cpef81d0fadd1d3-cmf81d0fadd1d0.cpe.net.fido.ca.64129: Flags [P.], seq 7989840:7990036, ack 4645, win 501, length 196
00:31:09.401230 IP 138.197.139.105.ssh > cpef81d0fadd1d3-cmf81d0fadd1d0.cpe.net.fido.ca.64129: Flags [P.], seq 7990036:7990232, ack 4645, win 501, length 196
00:31:09.401346 IP 138.197.139.105.ssh > cpef81d0fadd1d3-cmf81d0fadd1d0.cpe.net.fido.ca.64129: Flags [P.], seq 7990232:7990428, ack 4645, win 501, length 196
00:31:09.401469 IP 138.197.139.105.ssh > cpef81d0fadd1d3-cmf81d0fadd1d0.cpe.net.fido.ca.64129: Flags [P.], seq 7990428:7990624, ack 4645, win 501, length 196
00:31:09.401594 IP 138.197.139.105.ssh > cpef81d0fadd1d3-cmf81d0fadd1d0.cpe.net.fido.ca.64129: Flags [P.], seq 7990624:7990820, ack 4645, win 501, length 196
00:31:09.401708 IP 138.197.139.105.ssh > cpef81d0fadd1d3-cmf81d0fadd1d0.cpe.net.fido.ca.64129: Flags [P.], seq 7990820:7991016, ack 4645, win 501, length 196
00:31:09.401816 IP 138.197.139.105.ssh > cpef81d0fadd1d3-cmf81d0fadd1d0.cpe.net.fido.ca.64129: Flags [P.], seq 7991016:7991212, ack 4645, win 501, length 196
00:31:09.401912 IP 138.197.139.105.ssh > cpef81d0fadd1d3-cmf81d0fadd1d0.cpe.net.fido.ca.64129: Flags [P.], seq 7991212:7991408, ack 4645, win 501, length 196
00:31:09.402004 IP 138.197.139.105.ssh > cpef81d0fadd1d3-cmf81d0fadd1d0.cpe.net.fido.ca.64129: Flags [P.], seq 7991408:7991604, ack 4645, win 501, length 196
00:31:09.402104 IP 138.197.139.105.ssh > cpef81d0fadd1d3-cmf81d0fadd1d0.cpe.net.fido.ca.64129: Flags [P.], seq 7991604:7991800, ack 4645, win 501, length 196
00:31:09.402191 IP 138.197.139.105.ssh > cpef81d0fadd1d3-cmf81d0fadd1d0.cpe.net.fido.ca.64129: Flags [P.], seq 7991800:7991996, ack 4645, win 501, length 196
00:31:09.402343 IP 138.197.139.105.ssh > cpef81d0fadd1d3-cmf81d0fadd1d0.cpe.net.fido.ca.64129: Flags [P.], seq 7991996:7992192, ack 4645, win 501, length 196
00:31:09.402475 IP 138.197.139.105.ssh > cpef81d0fadd1d3-cmf81d0fadd1d0.cpe.net.fido.ca.64129: Flags [P.], seq 7992192:7992388, ack 4645, win 501, length 196
00:31:09.402565 IP 138.197.139.105.ssh > cpef81d0fadd1d3-cmf81d0fadd1d0.cpe.net.fido.ca.64129: Flags [P.], seq 7992388:7992584, ack 4645, win 501, length 196
00:31:09.402653 IP 138.197.139.105.ssh > cpef81d0fadd1d3-cmf81d0fadd1d0.cpe.net.fido.ca.64129: Flags [P.], seq 7992584:7992780, ack 4645, win 501, length 196
00:31:09.402739 IP 138.197.139.105.ssh > cpef81d0fadd1d3-cmf81d0fadd1d0.cpe.net.fido.ca.64129: Flags [P.], seq 7992780:7992976, ack 4645, win 501, length 196
00:31:09.402821 IP 138.197.139.105.ssh > cpef81d0fadd1d3-cmf81d0fadd1d0.cpe.net.fido.ca.64129: Flags [P.], seq 7992976:7993172, ack 4645, win 501, length 196
00:31:09.402973 IP 138.197.139.105.ssh > cpef81d0fadd1d3-cmf81d0fadd1d0.cpe.net.fido.ca.64129: Flags [P.], seq 7993172:7993368, ack 4645, win 501, length 196
00:31:09.403136 IP 138.197.139.105.ssh > cpef81d0fadd1d3-cmf81d0fadd1d0.cpe.net.fido.ca.64129: Flags [P.], seq 7993368:7993564, ack 4645, win 501, length 196
00:31:09.403234 IP 138.197.139.105.ssh > cpef81d0fadd1d3-cmf81d0fadd1d0.cpe.net.fido.ca.64129: Flags [P.], seq 7993564:7993760, ack 4645, win 501, length 196
00:31:09.403350 IP 138.197.139.105.ssh > cpef81d0fadd1d3-cmf81d0fadd1d0.cpe.net.fido.ca.64129: Flags [P.], seq 7993760:7993956, ack 4645, win 501, length 196
00:31:09.403450 IP 138.197.139.105.ssh > cpef81d0fadd1d3-cmf81d0fadd1d0.cpe.net.fido.ca.64129: Flags [P.], seq 7993956:7994152, ack 4645, win 501, length 196
00:31:09.403534 IP 138.197.139.105.ssh > cpef81d0fadd1d3-cmf81d0fadd1d0.cpe.net.fido.ca.64129: Flags [P.], seq 7994152:7994348, ack 4645, win 501, length 196
00:31:09.403622 IP 138.197.139.105.ssh > cpef81d0fadd1d3-cmf81d0fadd1d0.cpe.net.fido.ca.64129: Flags [P.], seq 7994348:7994544, ack 4645, win 501, length 196
00:31:09.403703 IP 138.197.139.105.ssh > cpef81d0fadd1d3-cmf81d0fadd1d0.cpe.net.fido.ca.64129: Flags [P.], seq 7994544:7994740, ack 4645, win 501, length 196
00:31:09.403790 IP 138.197.139.105.ssh > cpef81d0fadd1d3-cmf81d0fadd1d0.cpe.net.fido.ca.64129: Flags [P.], seq 7994740:7994936, ack 4645, win 501, length 196
00:31:09.403871 IP 138.197.139.105.ssh > cpef81d0fadd1d3-cmf81d0fadd1d0.cpe.net.fido.ca.64129: Flags [P.], seq 7994936:7995132, ack 4645, win 501, length 196
00:31:09.404037 IP 138.197.139.105.ssh > cpef81d0fadd1d3-cmf81d0fadd1d0.cpe.net.fido.ca.64129: Flags [P.], seq 7995132:7995328, ack 4645, win 501, length 196
00:31:09.404138 IP 138.197.139.105.ssh > cpef81d0fadd1d3-cmf81d0fadd1d0.cpe.net.fido.ca.64129: Flags [P.], seq 7995328:7995524, ack 4645, win 501, length 196
00:31:09.404222 IP 138.197.139.105.ssh > cpef81d0fadd1d3-cmf81d0fadd1d0.cpe.net.fido.ca.64129: Flags [P.], seq 7995524:7995720, ack 4645, win 501, length 196
00:31:09.404309 IP 138.197.139.105.ssh > cpef81d0fadd1d3-cmf81d0fadd1d0.cpe.net.fido.ca.64129: Flags [P.], seq 7995720:7995916, ack 4645, win 501, length 196
00:31:09.404414 IP 138.197.139.105.ssh > cpef81d0fadd1d3-cmf81d0fadd1d0.cpe.net.fido.ca.64129: Flags [P.], seq 7995916:7996112, ack 4645, win 501, length 196
00:31:09.404530 IP 138.197.139.105.ssh > cpef81d0fadd1d3-cmf81d0fadd1d0.cpe.net.fido.ca.64129: Flags [P.], seq 7996112:7996308, ack 4645, win 501, length 196
00:31:09.404622 IP 138.197.139.105.ssh > cpef81d0fadd1d3-cmf81d0fadd1d0.cpe.net.fido.ca.64129: Flags [P.], seq 7996308:7996504, ack 4645, win 501, length 196
00:31:09.404711 IP 138.197.139.105.ssh > cpef81d0fadd1d3-cmf81d0fadd1d0.cpe.net.fido.ca.64129: Flags [P.], seq 7996504:7996700, ack 4645, win 501, length 196
00:31:09.404791 IP 138.197.139.105.ssh > cpef81d0fadd1d3-cmf81d0fadd1d0.cpe.net.fido.ca.64129: Flags [P.], seq 7996700:7996896, ack 4645, win 501, length 196
00:31:09.404891 IP 138.197.139.105.ssh > cpef81d0fadd1d3-cmf81d0fadd1d0.cpe.net.fido.ca.64129: Flags [P.], seq 7996896:7997092, ack 4645, win 501, length 196
00:31:09.405145 IP 138.197.139.105.ssh > cpef81d0fadd1d3-cmf81d0fadd1d0.cpe.net.fido.ca.64129: Flags [P.], seq 7997092:7997288, ack 4645, win 501, length 196
00:31:09.405232 IP 138.197.139.105.ssh > cpef81d0fadd1d3-cmf81d0fadd1d0.cpe.net.fido.ca.64129: Flags [P.], seq 7997288:7997484, ack 4645, win 501, length 196
00:31:09.405314 IP 138.197.139.105.ssh > cpef81d0fadd1d3-cmf81d0fadd1d0.cpe.net.fido.ca.64129: Flags [P.], seq 7997484:7997680, ack 4645, win 501, length 196
00:31:09.405399 IP 138.197.139.105.ssh > cpef81d0fadd1d3-cmf81d0fadd1d0.cpe.net.fido.ca.64129: Flags [P.], seq 7997680:7997876, ack 4645, win 501, length 196
00:31:09.405487 IP 138.197.139.105.ssh > cpef81d0fadd1d3-cmf81d0fadd1d0.cpe.net.fido.ca.64129: Flags [P.], seq 7997876:7998072, ack 4645, win 501, length 196
00:31:09.405619 IP 138.197.139.105.ssh > cpef81d0fadd1d3-cmf81d0fadd1d0.cpe.net.fido.ca.64129: Flags [P.], seq 7998072:7998268, ack 4645, win 501, length 196
00:31:09.405767 IP 138.197.139.105.ssh > cpef81d0fadd1d3-cmf81d0fadd1d0.cpe.net.fido.ca.64129: Flags [P.], seq 7998268:7998464, ack 4645, win 501, length 196
00:31:09.405863 IP 138.197.139.105.ssh > cpef81d0fadd1d3-cmf81d0fadd1d0.cpe.net.fido.ca.64129: Flags [P.], seq 7998464:7998660, ack 4645, win 501, length 196
00:31:09.405947 IP 138.197.139.105.ssh > cpef81d0fadd1d3-cmf81d0fadd1d0.cpe.net.fido.ca.64129: Flags [P.], seq 7998660:7998856, ack 4645, win 501, length 196
00:31:09.406030 IP 138.197.139.105.ssh > cpef81d0fadd1d3-cmf81d0fadd1d0.cpe.net.fido.ca.64129: Flags [P.], seq 7998856:7999052, ack 4645, win 501, length 196
00:31:09.406113 IP 138.197.139.105.ssh > cpef81d0fadd1d3-cmf81d0fadd1d0.cpe.net.fido.ca.64129: Flags [P.], seq 7999052:7999248, ack 4645, win 501, length 196
00:31:09.406251 IP cpef81d0fadd1d3-cmf81d0fadd1d0.cpe.net.fido.ca.64129 > 138.197.139.105.ssh: Flags [.], ack 7972936, win 513, length 0
00:31:09.406269 IP cpef81d0fadd1d3-cmf81d0fadd1d0.cpe.net.fido.ca.64129 > 138.197.139.105.ssh: Flags [.], ack 7978976, win 513, length 0
00:31:09.406274 IP cpef81d0fadd1d3-cmf81d0fadd1d0.cpe.net.fido.ca.64129 > 138.197.139.105.ssh: Flags [.], ack 7979760, win 510, length 0
00:31:09.406279 IP 138.197.139.105.ssh > cpef81d0fadd1d3-cmf81d0fadd1d0.cpe.net.fido.ca.64129: Flags [P.], seq 7999248:7999444, ack 4645, win 501, length 196
00:31:09.406442 IP 138.197.139.105.ssh > cpef81d0fadd1d3-cmf81d0fadd1d0.cpe.net.fido.ca.64129: Flags [P.], seq 7999444:8000056, ack 4645, win 501, length 612
00:31:09.406542 IP 138.197.139.105.ssh > cpef81d0fadd1d3-cmf81d0fadd1d0.cpe.net.fido.ca.64129: Flags [P.], seq 8000056:8000252, ack 4645, win 501, length 196
00:31:09.406651 IP 138.197.139.105.ssh > cpef81d0fadd1d3-cmf81d0fadd1d0.cpe.net.fido.ca.64129: Flags [P.], seq 8000252:8000448, ack 4645, win 501, length 196
00:31:09.406745 IP 138.197.139.105.ssh > cpef81d0fadd1d3-cmf81d0fadd1d0.cpe.net.fido.ca.64129: Flags [P.], seq 8000448:8000644, ack 4645, win 501, length 196
00:31:09.406847 IP 138.197.139.105.ssh > cpef81d0fadd1d3-cmf81d0fadd1d0.cpe.net.fido.ca.64129: Flags [P.], seq 8000644:8000840, ack 4645, win 501, length 196
00:31:09.406934 IP 138.197.139.105.ssh > cpef81d0fadd1d3-cmf81d0fadd1d0.cpe.net.fido.ca.64129: Flags [P.], seq 8000840:8001036, ack 4645, win 501, length 196
00:31:09.407022 IP 138.197.139.105.ssh > cpef81d0fadd1d3-cmf81d0fadd1d0.cpe.net.fido.ca.64129: Flags [P.], seq 8001036:8001232, ack 4645, win 501, length 196
00:31:09.407116 IP 138.197.139.105.ssh > cpef81d0fadd1d3-cmf81d0fadd1d0.cpe.net.fido.ca.64129: Flags [P.], seq 8001232:8001428, ack 4645, win 501, length 196
00:31:09.407207 IP 138.197.139.105.ssh > cpef81d0fadd1d3-cmf81d0fadd1d0.cpe.net.fido.ca.64129: Flags [P.], seq 8001428:8001624, ack 4645, win 501, length 196
00:31:09.407300 IP 138.197.139.105.ssh > cpef81d0fadd1d3-cmf81d0fadd1d0.cpe.net.fido.ca.64129: Flags [P.], seq 8001624:8001820, ack 4645, win 501, length 196
00:31:09.407399 IP 138.197.139.105.ssh > cpef81d0fadd1d3-cmf81d0fadd1d0.cpe.net.fido.ca.64129: Flags [P.], seq 8001820:8002016, ack 4645, win 501, length 196
00:31:09.407480 IP 138.197.139.105.ssh > cpef81d0fadd1d3-cmf81d0fadd1d0.cpe.net.fido.ca.64129: Flags [P.], seq 8002016:8002212, ack 4645, win 501, length 196
00:31:09.407587 IP 138.197.139.105.ssh > cpef81d0fadd1d3-cmf81d0fadd1d0.cpe.net.fido.ca.64129: Flags [P.], seq 8002212:8002408, ack 4645, win 501, length 196
00:31:09.407688 IP 138.197.139.105.ssh > cpef81d0fadd1d3-cmf81d0fadd1d0.cpe.net.fido.ca.64129: Flags [P.], seq 8002408:8002604, ack 4645, win 501, length 196
00:31:09.407789 IP 138.197.139.105.ssh > cpef81d0fadd1d3-cmf81d0fadd1d0.cpe.net.fido.ca.64129: Flags [P.], seq 8002604:8002800, ack 4645, win 501, length 196
00:31:09.407892 IP 138.197.139.105.ssh > cpef81d0fadd1d3-cmf81d0fadd1d0.cpe.net.fido.ca.64129: Flags [P.], seq 8002800:8002996, ack 4645, win 501, length 196
00:31:09.407982 IP 138.197.139.105.ssh > cpef81d0fadd1d3-cmf81d0fadd1d0.cpe.net.fido.ca.64129: Flags [P.], seq 8002996:8003192, ack 4645, win 501, length 196
00:31:09.408070 IP 138.197.139.105.ssh > cpef81d0fadd1d3-cmf81d0fadd1d0.cpe.net.fido.ca.64129: Flags [P.], seq 8003192:8003388, ack 4645, win 501, length 196
00:31:09.408153 IP 138.197.139.105.ssh > cpef81d0fadd1d3-cmf81d0fadd1d0.cpe.net.fido.ca.64129: Flags [P.], seq 8003388:8003584, ack 4645, win 501, length 196
00:31:09.408251 IP 138.197.139.105.ssh > cpef81d0fadd1d3-cmf81d0fadd1d0.cpe.net.fido.ca.64129: Flags [P.], seq 8003584:8003780, ack 4645, win 501, length 196
00:31:09.408397 IP 138.197.139.105.ssh > cpef81d0fadd1d3-cmf81d0fadd1d0.cpe.net.fido.ca.64129: Flags [P.], seq 8003780:8003976, ack 4645, win 501, length 196
00:31:09.408529 IP 138.197.139.105.ssh > cpef81d0fadd1d3-cmf81d0fadd1d0.cpe.net.fido.ca.64129: Flags [P.], seq 8003976:8004172, ack 4645, win 501, length 196
00:31:09.408635 IP 138.197.139.105.ssh > cpef81d0fadd1d3-cmf81d0fadd1d0.cpe.net.fido.ca.64129: Flags [P.], seq 8004172:8004368, ack 4645, win 501, length 196
00:31:09.408726 IP 138.197.139.105.ssh > cpef81d0fadd1d3-cmf81d0fadd1d0.cpe.net.fido.ca.64129: Flags [P.], seq 8004368:8004564, ack 4645, win 501, length 196
00:31:09.408827 IP 138.197.139.105.ssh > cpef81d0fadd1d3-cmf81d0fadd1d0.cpe.net.fido.ca.64129: Flags [P.], seq 8004564:8004760, ack 4645, win 501, length 196
00:31:09.408937 IP 138.197.139.105.ssh > cpef81d0fadd1d3-cmf81d0fadd1d0.cpe.net.fido.ca.64129: Flags [P.], seq 8004760:8004956, ack 4645, win 501, length 196
00:31:09.409034 IP 138.197.139.105.ssh > cpef81d0fadd1d3-cmf81d0fadd1d0.cpe.net.fido.ca.64129: Flags [P.], seq 8004956:8005152, ack 4645, win 501, length 196
00:31:09.409135 IP 138.197.139.105.ssh > cpef81d0fadd1d3-cmf81d0fadd1d0.cpe.net.fido.ca.64129: Flags [P.], seq 8005152:8005348, ack 4645, win 501, length 196
00:31:09.409233 IP 138.197.139.105.ssh > cpef81d0fadd1d3-cmf81d0fadd1d0.cpe.net.fido.ca.64129: Flags [P.], seq 8005348:8005544, ack 4645, win 501, length 196
00:31:09.409326 IP 138.197.139.105.ssh > cpef81d0fadd1d3-cmf81d0fadd1d0.cpe.net.fido.ca.64129: Flags [P.], seq 8005544:8005740, ack 4645, win 501, length 196
00:31:09.409428 IP 138.197.139.105.ssh > cpef81d0fadd1d3-cmf81d0fadd1d0.cpe.net.fido.ca.64129: Flags [P.], seq 8005740:8005936, ack 4645, win 501, length 196
00:31:09.409543 IP 138.197.139.105.ssh > cpef81d0fadd1d3-cmf81d0fadd1d0.cpe.net.fido.ca.64129: Flags [P.], seq 8005936:8006132, ack 4645, win 501, length 196
00:31:09.409646 IP 138.197.139.105.ssh > cpef81d0fadd1d3-cmf81d0fadd1d0.cpe.net.fido.ca.64129: Flags [P.], seq 8006132:8006328, ack 4645, win 501, length 196
00:31:09.409734 IP 138.197.139.105.ssh > cpef81d0fadd1d3-cmf81d0fadd1d0.cpe.net.fido.ca.64129: Flags [P.], seq 8006328:8006524, ack 4645, win 501, length 196
00:31:09.409840 IP 138.197.139.105.ssh > cpef81d0fadd1d3-cmf81d0fadd1d0.cpe.net.fido.ca.64129: Flags [P.], seq 8006524:8006720, ack 4645, win 501, length 196
00:31:09.409943 IP 138.197.139.105.ssh > cpef81d0fadd1d3-cmf81d0fadd1d0.cpe.net.fido.ca.64129: Flags [P.], seq 8006720:8006916, ack 4645, win 501, length 196
00:31:09.410047 IP 138.197.139.105.ssh > cpef81d0fadd1d3-cmf81d0fadd1d0.cpe.net.fido.ca.64129: Flags [P.], seq 8006916:8007112, ack 4645, win 501, length 196
00:31:09.410148 IP 138.197.139.105.ssh > cpef81d0fadd1d3-cmf81d0fadd1d0.cpe.net.fido.ca.64129: Flags [P.], seq 8007112:8007308, ack 4645, win 501, length 196
00:31:09.410257 IP 138.197.139.105.ssh > cpef81d0fadd1d3-cmf81d0fadd1d0.cpe.net.fido.ca.64129: Flags [P.], seq 8007308:8007504, ack 4645, win 501, length 196
00:31:09.410342 IP 138.197.139.105.ssh > cpef81d0fadd1d3-cmf81d0fadd1d0.cpe.net.fido.ca.64129: Flags [P.], seq 8007504:8007700, ack 4645, win 501, length 196
00:31:09.410443 IP 138.197.139.105.ssh > cpef81d0fadd1d3-cmf81d0fadd1d0.cpe.net.fido.ca.64129: Flags [P.], seq 8007700:8007896, ack 4645, win 501, length 196
00:31:09.410545 IP 138.197.139.105.ssh > cpef81d0fadd1d3-cmf81d0fadd1d0.cpe.net.fido.ca.64129: Flags [P.], seq 8007896:8008092, ack 4645, win 501, length 196
00:31:09.410637 IP 138.197.139.105.ssh > cpef81d0fadd1d3-cmf81d0fadd1d0.cpe.net.fido.ca.64129: Flags [P.], seq 8008092:8008288, ack 4645, win 501, length 196
00:31:09.410736 IP 138.197.139.105.ssh > cpef81d0fadd1d3-cmf81d0fadd1d0.cpe.net.fido.ca.64129: Flags [P.], seq 8008288:8008484, ack 4645, win 501, length 196
00:31:09.410842 IP 138.197.139.105.ssh > cpef81d0fadd1d3-cmf81d0fadd1d0.cpe.net.fido.ca.64129: Flags [P.], seq 8008484:8008680, ack 4645, win 501, length 196
00:31:09.410929 IP 138.197.139.105.ssh > cpef81d0fadd1d3-cmf81d0fadd1d0.cpe.net.fido.ca.64129: Flags [P.], seq 8008680:8008876, ack 4645, win 501, length 196
00:31:09.411017 IP 138.197.139.105.ssh > cpef81d0fadd1d3-cmf81d0fadd1d0.cpe.net.fido.ca.64129: Flags [P.], seq 8008876:8009072, ack 4645, win 501, length 196
00:31:09.411113 IP 138.197.139.105.ssh > cpef81d0fadd1d3-cmf81d0fadd1d0.cpe.net.fido.ca.64129: Flags [P.], seq 8009072:8009268, ack 4645, win 501, length 196
00:31:09.411217 IP 138.197.139.105.ssh > cpef81d0fadd1d3-cmf81d0fadd1d0.cpe.net.fido.ca.64129: Flags [P.], seq 8009268:8009464, ack 4645, win 501, length 196
00:31:09.411303 IP 138.197.139.105.ssh > cpef81d0fadd1d3-cmf81d0fadd1d0.cpe.net.fido.ca.64129: Flags [P.], seq 8009464:8009660, ack 4645, win 501, length 196
00:31:09.411387 IP 138.197.139.105.ssh > cpef81d0fadd1d3-cmf81d0fadd1d0.cpe.net.fido.ca.64129: Flags [P.], seq 8009660:8009856, ack 4645, win 501, length 196
00:31:09.411511 IP 138.197.139.105.ssh > cpef81d0fadd1d3-cmf81d0fadd1d0.cpe.net.fido.ca.64129: Flags [P.], seq 8009856:8010052, ack 4645, win 501, length 196
00:31:09.411615 IP 138.197.139.105.ssh > cpef81d0fadd1d3-cmf81d0fadd1d0.cpe.net.fido.ca.64129: Flags [P.], seq 8010052:8010248, ack 4645, win 501, length 196
00:31:09.411700 IP 138.197.139.105.ssh > cpef81d0fadd1d3-cmf81d0fadd1d0.cpe.net.fido.ca.64129: Flags [P.], seq 8010248:8010444, ack 4645, win 501, length 196
00:31:09.411788 IP 138.197.139.105.ssh > cpef81d0fadd1d3-cmf81d0fadd1d0.cpe.net.fido.ca.64129: Flags [P.], seq 8010444:8010640, ack 4645, win 501, length 196
00:31:09.411874 IP cpef81d0fadd1d3-cmf81d0fadd1d0.cpe.net.fido.ca.64129 > 138.197.139.105.ssh: Flags [.], ack 7983876, win 513, length 0
00:31:09.411905 IP cpef81d0fadd1d3-cmf81d0fadd1d0.cpe.net.fido.ca.64129 > 138.197.139.105.ssh: Flags [P.], seq 4645:4681, ack 7983876, win 513, length 36
00:31:09.411910 IP cpef81d0fadd1d3-cmf81d0fadd1d0.cpe.net.fido.ca.64129 > 138.197.139.105.ssh: Flags [.], ack 7987012, win 513, length 0
00:31:09.411921 IP cpef81d0fadd1d3-cmf81d0fadd1d0.cpe.net.fido.ca.64129 > 138.197.139.105.ssh: Flags [.], ack 7991996, win 513, length 0
00:31:09.411950 IP 138.197.139.105.ssh > cpef81d0fadd1d3-cmf81d0fadd1d0.cpe.net.fido.ca.64129: Flags [P.], seq 8010640:8010836, ack 4681, win 501, length 196
00:31:09.412103 IP 138.197.139.105.ssh > cpef81d0fadd1d3-cmf81d0fadd1d0.cpe.net.fido.ca.64129: Flags [P.], seq 8010836:8011600, ack 4681, win 501, length 764
00:31:09.412187 IP 138.197.139.105.ssh > cpef81d0fadd1d3-cmf81d0fadd1d0.cpe.net.fido.ca.64129: Flags [P.], seq 8011600:8011796, ack 4681, win 501, length 196
00:31:09.412270 IP 138.197.139.105.ssh > cpef81d0fadd1d3-cmf81d0fadd1d0.cpe.net.fido.ca.64129: Flags [P.], seq 8011796:8011992, ack 4681, win 501, length 196
00:31:09.412352 IP 138.197.139.105.ssh > cpef81d0fadd1d3-cmf81d0fadd1d0.cpe.net.fido.ca.64129: Flags [P.], seq 8011992:8012188, ack 4681, win 501, length 196
00:31:09.412432 IP 138.197.139.105.ssh > cpef81d0fadd1d3-cmf81d0fadd1d0.cpe.net.fido.ca.64129: Flags [P.], seq 8012188:8012384, ack 4681, win 501, length 196
00:31:09.412512 IP 138.197.139.105.ssh > cpef81d0fadd1d3-cmf81d0fadd1d0.cpe.net.fido.ca.64129: Flags [P.], seq 8012384:8012580, ack 4681, win 501, length 196
00:31:09.412599 IP 138.197.139.105.ssh > cpef81d0fadd1d3-cmf81d0fadd1d0.cpe.net.fido.ca.64129: Flags [P.], seq 8012580:8012776, ack 4681, win 501, length 196
00:31:09.412682 IP 138.197.139.105.ssh > cpef81d0fadd1d3-cmf81d0fadd1d0.cpe.net.fido.ca.64129: Flags [P.], seq 8012776:8012972, ack 4681, win 501, length 196
00:31:09.412760 IP 138.197.139.105.ssh > cpef81d0fadd1d3-cmf81d0fadd1d0.cpe.net.fido.ca.64129: Flags [P.], seq 8012972:8013168, ack 4681, win 501, length 196
00:31:09.412890 IP 138.197.139.105.ssh > cpef81d0fadd1d3-cmf81d0fadd1d0.cpe.net.fido.ca.64129: Flags [P.], seq 8013168:8013364, ack 4681, win 501, length 196
00:31:09.412990 IP 138.197.139.105.ssh > cpef81d0fadd1d3-cmf81d0fadd1d0.cpe.net.fido.ca.64129: Flags [P.], seq 8013364:8013560, ack 4681, win 501, length 196
00:31:09.413074 IP 138.197.139.105.ssh > cpef81d0fadd1d3-cmf81d0fadd1d0.cpe.net.fido.ca.64129: Flags [P.], seq 8013560:8013756, ack 4681, win 501, length 196
00:31:09.413157 IP 138.197.139.105.ssh > cpef81d0fadd1d3-cmf81d0fadd1d0.cpe.net.fido.ca.64129: Flags [P.], seq 8013756:8013952, ack 4681, win 501, length 196
00:31:09.413239 IP 138.197.139.105.ssh > cpef81d0fadd1d3-cmf81d0fadd1d0.cpe.net.fido.ca.64129: Flags [P.], seq 8013952:8014148, ack 4681, win 501, length 196
00:31:09.413321 IP 138.197.139.105.ssh > cpef81d0fadd1d3-cmf81d0fadd1d0.cpe.net.fido.ca.64129: Flags [P.], seq 8014148:8014344, ack 4681, win 501, length 196
00:31:09.413402 IP 138.197.139.105.ssh > cpef81d0fadd1d3-cmf81d0fadd1d0.cpe.net.fido.ca.64129: Flags [P.], seq 8014344:8014540, ack 4681, win 501, length 196
00:31:09.413489 IP 138.197.139.105.ssh > cpef81d0fadd1d3-cmf81d0fadd1d0.cpe.net.fido.ca.64129: Flags [P.], seq 8014540:8014736, ack 4681, win 501, length 196
00:31:09.413574 IP 138.197.139.105.ssh > cpef81d0fadd1d3-cmf81d0fadd1d0.cpe.net.fido.ca.64129: Flags [P.], seq 8014736:8014932, ack 4681, win 501, length 196
00:31:09.413681 IP 138.197.139.105.ssh > cpef81d0fadd1d3-cmf81d0fadd1d0.cpe.net.fido.ca.64129: Flags [P.], seq 8014932:8015128, ack 4681, win 501, length 196
00:31:09.413769 IP 138.197.139.105.ssh > cpef81d0fadd1d3-cmf81d0fadd1d0.cpe.net.fido.ca.64129: Flags [P.], seq 8015128:8015324, ack 4681, win 501, length 196
00:31:09.413856 IP 138.197.139.105.ssh > cpef81d0fadd1d3-cmf81d0fadd1d0.cpe.net.fido.ca.64129: Flags [P.], seq 8015324:8015520, ack 4681, win 501, length 196
00:31:09.413939 IP 138.197.139.105.ssh > cpef81d0fadd1d3-cmf81d0fadd1d0.cpe.net.fido.ca.64129: Flags [P.], seq 8015520:8015716, ack 4681, win 501, length 196
00:31:09.414025 IP 138.197.139.105.ssh > cpef81d0fadd1d3-cmf81d0fadd1d0.cpe.net.fido.ca.64129: Flags [P.], seq 8015716:8015912, ack 4681, win 501, length 196
00:31:09.414107 IP 138.197.139.105.ssh > cpef81d0fadd1d3-cmf81d0fadd1d0.cpe.net.fido.ca.64129: Flags [P.], seq 8015912:8016108, ack 4681, win 501, length 196
00:31:09.414190 IP 138.197.139.105.ssh > cpef81d0fadd1d3-cmf81d0fadd1d0.cpe.net.fido.ca.64129: Flags [P.], seq 8016108:8016304, ack 4681, win 501, length 196
00:31:09.414306 IP 138.197.139.105.ssh > cpef81d0fadd1d3-cmf81d0fadd1d0.cpe.net.fido.ca.64129: Flags [P.], seq 8016304:8016500, ack 4681, win 501, length 196
00:31:09.414438 IP 138.197.139.105.ssh > cpef81d0fadd1d3-cmf81d0fadd1d0.cpe.net.fido.ca.64129: Flags [P.], seq 8016500:8016696, ack 4681, win 501, length 196
00:31:09.414539 IP 138.197.139.105.ssh > cpef81d0fadd1d3-cmf81d0fadd1d0.cpe.net.fido.ca.64129: Flags [P.], seq 8016696:8016892, ack 4681, win 501, length 196
00:31:09.414622 IP 138.197.139.105.ssh > cpef81d0fadd1d3-cmf81d0fadd1d0.cpe.net.fido.ca.64129: Flags [P.], seq 8016892:8017088, ack 4681, win 501, length 196
00:31:09.414710 IP 138.197.139.105.ssh > cpef81d0fadd1d3-cmf81d0fadd1d0.cpe.net.fido.ca.64129: Flags [P.], seq 8017088:8017284, ack 4681, win 501, length 196
00:31:09.414791 IP 138.197.139.105.ssh > cpef81d0fadd1d3-cmf81d0fadd1d0.cpe.net.fido.ca.64129: Flags [P.], seq 8017284:8017480, ack 4681, win 501, length 196
00:31:09.414874 IP 138.197.139.105.ssh > cpef81d0fadd1d3-cmf81d0fadd1d0.cpe.net.fido.ca.64129: Flags [P.], seq 8017480:8017676, ack 4681, win 501, length 196
00:31:09.414957 IP 138.197.139.105.ssh > cpef81d0fadd1d3-cmf81d0fadd1d0.cpe.net.fido.ca.64129: Flags [P.], seq 8017676:8017872, ack 4681, win 501, length 196
00:31:09.415037 IP 138.197.139.105.ssh > cpef81d0fadd1d3-cmf81d0fadd1d0.cpe.net.fido.ca.64129: Flags [P.], seq 8017872:8018068, ack 4681, win 501, length 196
00:31:09.415116 IP 138.197.139.105.ssh > cpef81d0fadd1d3-cmf81d0fadd1d0.cpe.net.fido.ca.64129: Flags [P.], seq 8018068:8018264, ack 4681, win 501, length 196
00:31:09.415197 IP 138.197.139.105.ssh > cpef81d0fadd1d3-cmf81d0fadd1d0.cpe.net.fido.ca.64129: Flags [P.], seq 8018264:8018460, ack 4681, win 501, length 196
00:31:09.415280 IP 138.197.139.105.ssh > cpef81d0fadd1d3-cmf81d0fadd1d0.cpe.net.fido.ca.64129: Flags [P.], seq 8018460:8018656, ack 4681, win 501, length 196
00:31:09.415361 IP 138.197.139.105.ssh > cpef81d0fadd1d3-cmf81d0fadd1d0.cpe.net.fido.ca.64129: Flags [P.], seq 8018656:8018852, ack 4681, win 501, length 196
00:31:09.415448 IP 138.197.139.105.ssh > cpef81d0fadd1d3-cmf81d0fadd1d0.cpe.net.fido.ca.64129: Flags [P.], seq 8018852:8019048, ack 4681, win 501, length 196
00:31:09.415531 IP 138.197.139.105.ssh > cpef81d0fadd1d3-cmf81d0fadd1d0.cpe.net.fido.ca.64129: Flags [P.], seq 8019048:8019244, ack 4681, win 501, length 196
00:31:09.415610 IP 138.197.139.105.ssh > cpef81d0fadd1d3-cmf81d0fadd1d0.cpe.net.fido.ca.64129: Flags [P.], seq 8019244:8019440, ack 4681, win 501, length 196
00:31:09.415698 IP 138.197.139.105.ssh > cpef81d0fadd1d3-cmf81d0fadd1d0.cpe.net.fido.ca.64129: Flags [P.], seq 8019440:8019636, ack 4681, win 501, length 196
00:31:09.415778 IP 138.197.139.105.ssh > cpef81d0fadd1d3-cmf81d0fadd1d0.cpe.net.fido.ca.64129: Flags [P.], seq 8019636:8019832, ack 4681, win 501, length 196
00:31:09.415862 IP 138.197.139.105.ssh > cpef81d0fadd1d3-cmf81d0fadd1d0.cpe.net.fido.ca.64129: Flags [P.], seq 8019832:8020028, ack 4681, win 501, length 196
00:31:09.415944 IP 138.197.139.105.ssh > cpef81d0fadd1d3-cmf81d0fadd1d0.cpe.net.fido.ca.64129: Flags [P.], seq 8020028:8020224, ack 4681, win 501, length 196
00:31:09.416025 IP 138.197.139.105.ssh > cpef81d0fadd1d3-cmf81d0fadd1d0.cpe.net.fido.ca.64129: Flags [P.], seq 8020224:8020420, ack 4681, win 501, length 196
00:31:09.416111 IP 138.197.139.105.ssh > cpef81d0fadd1d3-cmf81d0fadd1d0.cpe.net.fido.ca.64129: Flags [P.], seq 8020420:8020616, ack 4681, win 501, length 196
00:31:09.416192 IP 138.197.139.105.ssh > cpef81d0fadd1d3-cmf81d0fadd1d0.cpe.net.fido.ca.64129: Flags [P.], seq 8020616:8020812, ack 4681, win 501, length 196
00:31:09.416273 IP 138.197.139.105.ssh > cpef81d0fadd1d3-cmf81d0fadd1d0.cpe.net.fido.ca.64129: Flags [P.], seq 8020812:8021008, ack 4681, win 501, length 196
00:31:09.416359 IP 138.197.139.105.ssh > cpef81d0fadd1d3-cmf81d0fadd1d0.cpe.net.fido.ca.64129: Flags [P.], seq 8021008:8021204, ack 4681, win 501, length 196
00:31:09.416438 IP 138.197.139.105.ssh > cpef81d0fadd1d3-cmf81d0fadd1d0.cpe.net.fido.ca.64129: Flags [P.], seq 8021204:8021400, ack 4681, win 501, length 196
00:31:09.416524 IP 138.197.139.105.ssh > cpef81d0fadd1d3-cmf81d0fadd1d0.cpe.net.fido.ca.64129: Flags [P.], seq 8021400:8021596, ack 4681, win 501, length 196
00:31:09.416604 IP 138.197.139.105.ssh > cpef81d0fadd1d3-cmf81d0fadd1d0.cpe.net.fido.ca.64129: Flags [P.], seq 8021596:8021792, ack 4681, win 501, length 196
00:31:09.416685 IP 138.197.139.105.ssh > cpef81d0fadd1d3-cmf81d0fadd1d0.cpe.net.fido.ca.64129: Flags [P.], seq 8021792:8021988, ack 4681, win 501, length 196
00:31:09.416776 IP 138.197.139.105.ssh > cpef81d0fadd1d3-cmf81d0fadd1d0.cpe.net.fido.ca.64129: Flags [P.], seq 8021988:8022184, ack 4681, win 501, length 196
00:31:09.416876 IP 138.197.139.105.ssh > cpef81d0fadd1d3-cmf81d0fadd1d0.cpe.net.fido.ca.64129: Flags [P.], seq 8022184:8022380, ack 4681, win 501, length 196
00:31:09.416959 IP 138.197.139.105.ssh > cpef81d0fadd1d3-cmf81d0fadd1d0.cpe.net.fido.ca.64129: Flags [P.], seq 8022380:8022576, ack 4681, win 501, length 196
00:31:09.417042 IP 138.197.139.105.ssh > cpef81d0fadd1d3-cmf81d0fadd1d0.cpe.net.fido.ca.64129: Flags [P.], seq 8022576:8022772, ack 4681, win 501, length 196
00:31:09.417124 IP 138.197.139.105.ssh > cpef81d0fadd1d3-cmf81d0fadd1d0.cpe.net.fido.ca.64129: Flags [P.], seq 8022772:8022968, ack 4681, win 501, length 196
00:31:09.417205 IP 138.197.139.105.ssh > cpef81d0fadd1d3-cmf81d0fadd1d0.cpe.net.fido.ca.64129: Flags [P.], seq 8022968:8023164, ack 4681, win 501, length 196
00:31:09.417286 IP 138.197.139.105.ssh > cpef81d0fadd1d3-cmf81d0fadd1d0.cpe.net.fido.ca.64129: Flags [P.], seq 8023164:8023360, ack 4681, win 501, length 196
00:31:09.417372 IP 138.197.139.105.ssh > cpef81d0fadd1d3-cmf81d0fadd1d0.cpe.net.fido.ca.64129: Flags [P.], seq 8023360:8023556, ack 4681, win 501, length 196
00:31:09.417470 IP 138.197.139.105.ssh > cpef81d0fadd1d3-cmf81d0fadd1d0.cpe.net.fido.ca.64129: Flags [P.], seq 8023556:8023752, ack 4681, win 501, length 196
00:31:09.417560 IP 138.197.139.105.ssh > cpef81d0fadd1d3-cmf81d0fadd1d0.cpe.net.fido.ca.64129: Flags [P.], seq 8023752:8023948, ack 4681, win 501, length 196
00:31:09.417642 IP 138.197.139.105.ssh > cpef81d0fadd1d3-cmf81d0fadd1d0.cpe.net.fido.ca.64129: Flags [P.], seq 8023948:8024144, ack 4681, win 501, length 196
00:31:09.417734 IP 138.197.139.105.ssh > cpef81d0fadd1d3-cmf81d0fadd1d0.cpe.net.fido.ca.64129: Flags [P.], seq 8024144:8024340, ack 4681, win 501, length 196
00:31:09.417817 IP 138.197.139.105.ssh > cpef81d0fadd1d3-cmf81d0fadd1d0.cpe.net.fido.ca.64129: Flags [P.], seq 8024340:8024536, ack 4681, win 501, length 196
00:31:09.417900 IP 138.197.139.105.ssh > cpef81d0fadd1d3-cmf81d0fadd1d0.cpe.net.fido.ca.64129: Flags [P.], seq 8024536:8024732, ack 4681, win 501, length 196
00:31:09.417975 IP cpef81d0fadd1d3-cmf81d0fadd1d0.cpe.net.fido.ca.64129 > 138.197.139.105.ssh: Flags [.], ack 7996112, win 513, length 0
00:31:09.418005 IP cpef81d0fadd1d3-cmf81d0fadd1d0.cpe.net.fido.ca.64129 > 138.197.139.105.ssh: Flags [.], ack 7999248, win 513, length 0
00:31:09.418018 IP cpef81d0fadd1d3-cmf81d0fadd1d0.cpe.net.fido.ca.64129 > 138.197.139.105.ssh: Flags [.], ack 8003976, win 513, length 0
00:31:09.418055 IP 138.197.139.105.ssh > cpef81d0fadd1d3-cmf81d0fadd1d0.cpe.net.fido.ca.64129: Flags [P.], seq 8024732:8024928, ack 4681, win 501, length 196
00:31:09.418179 IP 138.197.139.105.ssh > cpef81d0fadd1d3-cmf81d0fadd1d0.cpe.net.fido.ca.64129: Flags [P.], seq 8024928:8025540, ack 4681, win 501, length 612
00:31:09.418317 IP 138.197.139.105.ssh > cpef81d0fadd1d3-cmf81d0fadd1d0.cpe.net.fido.ca.64129: Flags [P.], seq 8025540:8025736, ack 4681, win 501, length 196
00:31:09.418412 IP 138.197.139.105.ssh > cpef81d0fadd1d3-cmf81d0fadd1d0.cpe.net.fido.ca.64129: Flags [P.], seq 8025736:8025932, ack 4681, win 501, length 196
00:31:09.418498 IP 138.197.139.105.ssh > cpef81d0fadd1d3-cmf81d0fadd1d0.cpe.net.fido.ca.64129: Flags [P.], seq 8025932:8026128, ack 4681, win 501, length 196
00:31:09.418586 IP 138.197.139.105.ssh > cpef81d0fadd1d3-cmf81d0fadd1d0.cpe.net.fido.ca.64129: Flags [P.], seq 8026128:8026324, ack 4681, win 501, length 196
00:31:09.418670 IP 138.197.139.105.ssh > cpef81d0fadd1d3-cmf81d0fadd1d0.cpe.net.fido.ca.64129: Flags [P.], seq 8026324:8026520, ack 4681, win 501, length 196
00:31:09.418764 IP 138.197.139.105.ssh > cpef81d0fadd1d3-cmf81d0fadd1d0.cpe.net.fido.ca.64129: Flags [P.], seq 8026520:8026716, ack 4681, win 501, length 196
00:31:09.418846 IP 138.197.139.105.ssh > cpef81d0fadd1d3-cmf81d0fadd1d0.cpe.net.fido.ca.64129: Flags [P.], seq 8026716:8026912, ack 4681, win 501, length 196
00:31:09.418934 IP 138.197.139.105.ssh > cpef81d0fadd1d3-cmf81d0fadd1d0.cpe.net.fido.ca.64129: Flags [P.], seq 8026912:8027108, ack 4681, win 501, length 196
00:31:09.419014 IP 138.197.139.105.ssh > cpef81d0fadd1d3-cmf81d0fadd1d0.cpe.net.fido.ca.64129: Flags [P.], seq 8027108:8027304, ack 4681, win 501, length 196
00:31:09.419095 IP 138.197.139.105.ssh > cpef81d0fadd1d3-cmf81d0fadd1d0.cpe.net.fido.ca.64129: Flags [P.], seq 8027304:8027500, ack 4681, win 501, length 196
00:31:09.419175 IP 138.197.139.105.ssh > cpef81d0fadd1d3-cmf81d0fadd1d0.cpe.net.fido.ca.64129: Flags [P.], seq 8027500:8027696, ack 4681, win 501, length 196
00:31:09.419260 IP 138.197.139.105.ssh > cpef81d0fadd1d3-cmf81d0fadd1d0.cpe.net.fido.ca.64129: Flags [P.], seq 8027696:8027892, ack 4681, win 501, length 196
00:31:09.419352 IP 138.197.139.105.ssh > cpef81d0fadd1d3-cmf81d0fadd1d0.cpe.net.fido.ca.64129: Flags [P.], seq 8027892:8028088, ack 4681, win 501, length 196
00:31:09.419437 IP 138.197.139.105.ssh > cpef81d0fadd1d3-cmf81d0fadd1d0.cpe.net.fido.ca.64129: Flags [P.], seq 8028088:8028284, ack 4681, win 501, length 196
00:31:09.419517 IP 138.197.139.105.ssh > cpef81d0fadd1d3-cmf81d0fadd1d0.cpe.net.fido.ca.64129: Flags [P.], seq 8028284:8028480, ack 4681, win 501, length 196
00:31:09.419601 IP 138.197.139.105.ssh > cpef81d0fadd1d3-cmf81d0fadd1d0.cpe.net.fido.ca.64129: Flags [P.], seq 8028480:8028676, ack 4681, win 501, length 196
00:31:09.419684 IP 138.197.139.105.ssh > cpef81d0fadd1d3-cmf81d0fadd1d0.cpe.net.fido.ca.64129: Flags [P.], seq 8028676:8028872, ack 4681, win 501, length 196
00:31:09.419763 IP 138.197.139.105.ssh > cpef81d0fadd1d3-cmf81d0fadd1d0.cpe.net.fido.ca.64129: Flags [P.], seq 8028872:8029068, ack 4681, win 501, length 196
00:31:09.419849 IP 138.197.139.105.ssh > cpef81d0fadd1d3-cmf81d0fadd1d0.cpe.net.fido.ca.64129: Flags [P.], seq 8029068:8029264, ack 4681, win 501, length 196
00:31:09.419931 IP 138.197.139.105.ssh > cpef81d0fadd1d3-cmf81d0fadd1d0.cpe.net.fido.ca.64129: Flags [P.], seq 8029264:8029460, ack 4681, win 501, length 196
00:31:09.420013 IP 138.197.139.105.ssh > cpef81d0fadd1d3-cmf81d0fadd1d0.cpe.net.fido.ca.64129: Flags [P.], seq 8029460:8029656, ack 4681, win 501, length 196
00:31:09.420098 IP 138.197.139.105.ssh > cpef81d0fadd1d3-cmf81d0fadd1d0.cpe.net.fido.ca.64129: Flags [P.], seq 8029656:8029852, ack 4681, win 501, length 196
00:31:09.420180 IP 138.197.139.105.ssh > cpef81d0fadd1d3-cmf81d0fadd1d0.cpe.net.fido.ca.64129: Flags [P.], seq 8029852:8030048, ack 4681, win 501, length 196
00:31:09.420264 IP 138.197.139.105.ssh > cpef81d0fadd1d3-cmf81d0fadd1d0.cpe.net.fido.ca.64129: Flags [P.], seq 8030048:8030244, ack 4681, win 501, length 196
00:31:09.420349 IP 138.197.139.105.ssh > cpef81d0fadd1d3-cmf81d0fadd1d0.cpe.net.fido.ca.64129: Flags [P.], seq 8030244:8030440, ack 4681, win 501, length 196
00:31:09.420428 IP 138.197.139.105.ssh > cpef81d0fadd1d3-cmf81d0fadd1d0.cpe.net.fido.ca.64129: Flags [P.], seq 8030440:8030636, ack 4681, win 501, length 196
00:31:09.420507 IP 138.197.139.105.ssh > cpef81d0fadd1d3-cmf81d0fadd1d0.cpe.net.fido.ca.64129: Flags [P.], seq 8030636:8030832, ack 4681, win 501, length 196
00:31:09.420588 IP 138.197.139.105.ssh > cpef81d0fadd1d3-cmf81d0fadd1d0.cpe.net.fido.ca.64129: Flags [P.], seq 8030832:8031028, ack 4681, win 501, length 196
00:31:09.420674 IP 138.197.139.105.ssh > cpef81d0fadd1d3-cmf81d0fadd1d0.cpe.net.fido.ca.64129: Flags [P.], seq 8031028:8031224, ack 4681, win 501, length 196
00:31:09.420755 IP 138.197.139.105.ssh > cpef81d0fadd1d3-cmf81d0fadd1d0.cpe.net.fido.ca.64129: Flags [P.], seq 8031224:8031420, ack 4681, win 501, length 196
00:31:09.420853 IP 138.197.139.105.ssh > cpef81d0fadd1d3-cmf81d0fadd1d0.cpe.net.fido.ca.64129: Flags [P.], seq 8031420:8031616, ack 4681, win 501, length 196
00:31:09.420934 IP 138.197.139.105.ssh > cpef81d0fadd1d3-cmf81d0fadd1d0.cpe.net.fido.ca.64129: Flags [P.], seq 8031616:8031812, ack 4681, win 501, length 196
00:31:09.421017 IP 138.197.139.105.ssh > cpef81d0fadd1d3-cmf81d0fadd1d0.cpe.net.fido.ca.64129: Flags [P.], seq 8031812:8032008, ack 4681, win 501, length 196
00:31:09.421107 IP 138.197.139.105.ssh > cpef81d0fadd1d3-cmf81d0fadd1d0.cpe.net.fido.ca.64129: Flags [P.], seq 8032008:8032204, ack 4681, win 501, length 196
00:31:09.421188 IP 138.197.139.105.ssh > cpef81d0fadd1d3-cmf81d0fadd1d0.cpe.net.fido.ca.64129: Flags [P.], seq 8032204:8032400, ack 4681, win 501, length 196
00:31:09.421275 IP 138.197.139.105.ssh > cpef81d0fadd1d3-cmf81d0fadd1d0.cpe.net.fido.ca.64129: Flags [P.], seq 8032400:8032596, ack 4681, win 501, length 196
00:31:09.421357 IP 138.197.139.105.ssh > cpef81d0fadd1d3-cmf81d0fadd1d0.cpe.net.fido.ca.64129: Flags [P.], seq 8032596:8032792, ack 4681, win 501, length 196
00:31:09.421462 IP 138.197.139.105.ssh > cpef81d0fadd1d3-cmf81d0fadd1d0.cpe.net.fido.ca.64129: Flags [P.], seq 8032792:8032988, ack 4681, win 501, length 196
00:31:09.421585 IP 138.197.139.105.ssh > cpef81d0fadd1d3-cmf81d0fadd1d0.cpe.net.fido.ca.64129: Flags [P.], seq 8032988:8033184, ack 4681, win 501, length 196
00:31:09.421702 IP 138.197.139.105.ssh > cpef81d0fadd1d3-cmf81d0fadd1d0.cpe.net.fido.ca.64129: Flags [P.], seq 8033184:8033380, ack 4681, win 501, length 196
00:31:09.421820 IP 138.197.139.105.ssh > cpef81d0fadd1d3-cmf81d0fadd1d0.cpe.net.fido.ca.64129: Flags [P.], seq 8033380:8033576, ack 4681, win 501, length 196
00:31:09.421938 IP 138.197.139.105.ssh > cpef81d0fadd1d3-cmf81d0fadd1d0.cpe.net.fido.ca.64129: Flags [P.], seq 8033576:8033772, ack 4681, win 501, length 196
00:31:09.422052 IP 138.197.139.105.ssh > cpef81d0fadd1d3-cmf81d0fadd1d0.cpe.net.fido.ca.64129: Flags [P.], seq 8033772:8033968, ack 4681, win 501, length 196
00:31:09.422160 IP 138.197.139.105.ssh > cpef81d0fadd1d3-cmf81d0fadd1d0.cpe.net.fido.ca.64129: Flags [P.], seq 8033968:8034164, ack 4681, win 501, length 196
00:31:09.422268 IP 138.197.139.105.ssh > cpef81d0fadd1d3-cmf81d0fadd1d0.cpe.net.fido.ca.64129: Flags [P.], seq 8034164:8034360, ack 4681, win 501, length 196
00:31:09.422354 IP 138.197.139.105.ssh > cpef81d0fadd1d3-cmf81d0fadd1d0.cpe.net.fido.ca.64129: Flags [P.], seq 8034360:8034556, ack 4681, win 501, length 196
00:31:09.422438 IP 138.197.139.105.ssh > cpef81d0fadd1d3-cmf81d0fadd1d0.cpe.net.fido.ca.64129: Flags [P.], seq 8034556:8034752, ack 4681, win 501, length 196
00:31:09.422519 IP 138.197.139.105.ssh > cpef81d0fadd1d3-cmf81d0fadd1d0.cpe.net.fido.ca.64129: Flags [P.], seq 8034752:8034948, ack 4681, win 501, length 196
00:31:09.422600 IP 138.197.139.105.ssh > cpef81d0fadd1d3-cmf81d0fadd1d0.cpe.net.fido.ca.64129: Flags [P.], seq 8034948:8035144, ack 4681, win 501, length 196
00:31:09.422681 IP cpef81d0fadd1d3-cmf81d0fadd1d0.cpe.net.fido.ca.64129 > 138.197.139.105.ssh: Flags [.], ack 8008680, win 513, length 0
00:31:09.422711 IP cpef81d0fadd1d3-cmf81d0fadd1d0.cpe.net.fido.ca.64129 > 138.197.139.105.ssh: Flags [.], ack 8010836, win 513, length 0
00:31:09.422721 IP cpef81d0fadd1d3-cmf81d0fadd1d0.cpe.net.fido.ca.64129 > 138.197.139.105.ssh: Flags [.], ack 8015128, win 513, length 0
00:31:09.422733 IP cpef81d0fadd1d3-cmf81d0fadd1d0.cpe.net.fido.ca.64129 > 138.197.139.105.ssh: Flags [P.], seq 4681:4717, ack 8015128, win 513, length 36
